r_points,r_text,place
40,"Went last Sunday 22Sept lunch. A group of 3 adults 2 kids 7+9. We were the only table. Felt a bit awkward and started thinking whether a chef was present or whether we would be served microwaved Chinese with corn flour sauces to get the richness. Used to be a fan of China Spice in its early years but not recently as we turned more into Japanese fusion et al.I am glad to say that this was as good Chinese as you can get anywhere in Cyprus with the exception of the Chinese located at 4 Seasons hotel on Limassol.The salt n pepper squid was freshly fried, with the right sweet chili garlic and salt. Crispy aromatic duck was as churchy and tasty as it was 10 years ago at this restaurant. Main dishes included sizzling beef with oyster sauce, prawns with lobster sauce, noodles with 3 kinds of meat and egg fried rice. Writing this has just made me hungry again. Only dish that needed that extra punch of salt was sweet n sour chicken. Otherwise everything was deli. Service was exclusive of course since we were only people there. However, since quality of service is a word that the restaurant industry in Cyprus just doesn't get I would like to point out that the Philippino Greek speaking waitress was immaculate and so was the Greek waiter gentleman. Hey, they even treated us with fried banana and ice cream in the end courtesy of the restaurant. Employees of the month? Yes! Best Chinese in town?Yes! Not cheap of course but worth it.",China Spice
30,I went there with a friend. They already had the prawn crackers on the table and they got moist. The kitchen was very slow and the price just killed us.,China Spice
50,"I went there with friends and the food was delicious i loved it, but it was quite pricy. Its probably my favourite chinese restaurante",China Spice
30,"Nicosia does not have many chinese restaurantsChineSpice is one the good ones but the service is always slow and the kitchenwe had to wait 10 minutes for the waiter to get our orderdrink came after 15 minutes, the first dishes after 30 minutes and the main dishes after 60 minutesit was very disappointing",China Spice
50,"Hands down best Chinese restaurant in Cyprus. Not easy to find a good Chinese restaurant in Cyprus, and China Spice is by far best I have tried. Service is great (which is not the norm in Cyprus), beautiful environment, and most importantly great food, with more than the usual selection of dishes. Very easy recommendation for anybody looking for a Chinese restaurant in Cyprus.",China Spice
50,"best dinner everExcellent value, massive portions and friendly staff.Chine Spice is my favorite Chinese Restaurant. In fact, it is about the only place I will get chinese food from. I have been eating there since they opened. I tried other chinese restaurants but I still think Chine Spice is the best. Their food is excellent. You can get in and out on your lunch hour with no problem.",China Spice
50,Excellent quality and a lot of dishes to choose from. Some spicy dishes to choose from and new dishes are added,China Spice
50,"This is an exceptional authentic Chinese for Cyprus in fact the best with exceptional service, the onus being on the freshly cooked food with great spices catering for all palettes, an excellent wine choice superb for business meals but also that special occasion event. A no rush policy, so one is able to sit and savor the dishes. With all dishes freshly made we were a group of 4 with 2 of us liking hot and spicy and 2 preferring slightly more subtle dishes, but the dishes were all so good that we were constantly trying each others. Highly recommend the Chilli dipping sauce and the Peking Duck. Highly recommend for any occasion.",China Spice
40,"China spice is a high end restaurant with excellent service. Before the crisis you would be lucky to get a table at the weekend without booking. The food, if you choose it to be, is amazingly spicy for the Mediterranean. The waiters are very helpful and will explain each dish to you should you ask. The ingredients are fresh and delicious. I would particularly recommend asking for the superb chilli, coriander and garlic dipping sauce which is splendid. One small niggle was the chopsticks which were rather horrid cheap affairs, I noticed that very few diners used them so I do think the restaurant could produce something more fitting to the quality of the food. Acid test though ... Yes I will be coming back",China Spice
50,"Excellent quality of cooking, satisfactory quantity, limited variety and a little bit expensive, very good service....",China Spice
50,"Finally, and after so many years we discovered an authentic high quality Chinese restaurant in Nicosia.The moment you enter the restaurant you are welcomed warmly to a very stylish, clean and nicely decorated place (although it is not looking Chinese; but we would rather have good Chinese food, than nice Chinese décor and lousy food).We were very impressed with the service and cleanliness; especially changing plates and cutlery frequently, holding them with a serviette.You cannot try all the Menu items in one or even 10 visits; but you should never miss the Hot and Sour Soup, the Starter Selection, the Prawns with Black Bean Sauce, the Special Fried Rice and last but not least the Toffee Apple and Banana with Vanilla Ice Cream.",China Spice
50,"One of the best chinese restaurants on Nicosia (and there are not many!).It's a more formal restaurant, with an excellent combination of food and service and the prices are acceptable. Most of the staff are professionals and they make you feel comfy.It's an excellent choice!",China Spice
40,"It's the only place we go to for Chinese in the capital. The food is generally very good, for Cyprus that is, and the service is fast, though at our last visit the waiting staff was not up to the usual standard.The only criticism I would make is about the prices. It does bother me a bit that you can get much better Chinese food in the center of London for about half the cost.",China Spice
30,"The best Chinese you could in Nicosia,yet it is not always up to standard.some times is excellent and other times is very disappointing (the food).The ambience is average, the waiters are very friendly yet some times over attending .",China Spice
50,"Considered one of the fancier restaurants in the city, it rises up to expectations. You pay a bit more but the service is excellent, the atmosphere pleasant and the food delicious. Prefer it every time.",China Spice
50,this is one of the best chinese restaurants in Nicosia.the food is great and the prices for the quality and service is reasonable.very friendly staff!!the place is very elegantly decorated.its also recommended for business.dont miss to order the fright bananas at the end with a scoop of vanilla icecream... yami..... :),China Spice
