r_points,r_text,place
50,"Very pleasant! Delicious food, good servis! Very nice atmosphere. We always enjoy our lunch there. Hopefully we will be going back soon.",El Sabor Latino
50,"Excellent service, delicious food and very reasonably priced. Lots of options for a vegetarian :-) The mushrooms in garlic sauce were so absolutely delicious, you must order them. Simply perfect. Pleased we ordered two lots of potatoes with the spicy sauce (a nice tomato sauce, not very spicy but very tasty), they were too good to share! Grilled vegetables were ok. Garlic bread yum and hubby had the salmon steak (with potatoes, veges and salad) which he really enjoyed too. We had three pommegranate juices- they were so good, and then two nice desserts to top it all off (banoffi pie & affogato). Total for all that = 32 euro. Lovely location right by the mosque, really nice inside or outside. So pleased we ate here!!",El Sabor Latino
10,"I’ve been here with family over the years many times and it was always a brilliant experience, last two visits specially today was a shock we sat down to order we had to ask for menu then we ordered and our drink came after we finished our meals and even then it was wrong service was absolutely rubbish very rude staff and a big disappointment of a family meal. I would NOT recommend this restaurant to anyone.",El Sabor Latino
20,"Went to El Sabor as it was recommended by my cousin but left very disappointed.I ordered a T bone steak and my cousin ordered a pasta dish. I was asked how would I like my steak ? I replied medium rare.They were bought very quickly and the pasta did look good however my T bone was 1) so thin you’d think it was transparent but worst of all it was so under cooked it was raw, to the point twice I had to change my knife. Now you may say why didn’t you just send it back ? Getting the waiters attention was impossible. I asked one who said give me a moment I’ll send someone over. After about 5/6 minutes I just thought why bother. I’ll eat what I can and leave the rest. We then asked 3 times for the bill. Every time being told someone will come over.In the end I walked over to a waiter & said was this meal free because it was so bad ?He immediately got the Bill & came back too me.First time on a recommendation but last time. If you want a decent meal avoid the Tbone, I can’t comment on rest of the menu as I won’t be going there again.",El Sabor Latino
30,Visited this week as we usually eat here when we visit the Occupied side of Nicosia. Always been good. This visit my husband's chilli chicken was dry and the chilli sauce seemed to be sweet chilli sauce from a bottle. My steak was OK but so thin! The Dianne sauce was delicious though. I didn't feel we'd had a treat as in other visits.....not sure if anything has changed...new owners/chef?,El Sabor Latino
40,"Sabor has a great setting beside Selimiye Camii Mosque with both open air and inside dining. Friendly and efficient staff. Menu offers a good Tapas selection as well as pasta, chicken, steak, fish and salads.Four of us had tapas with a jug of sanghria, beer, bottle of water and desserts all for 360tl about £12 a head, great value.",El Sabor Latino
50,This has been a absolute favourite of ours since it’s open! After 2019 being a year of pure disappointment with the quality of restaurants in girne (where we are staying) my husband remembered here!All I can say is YES!!!! Hats off to the owners who ever they are for maintaining the quality for all these year. To all the tourist who still haven’t discovered this place... your truly missing out extremely fantastic value for money,El Sabor Latino
40,Very well priced restaurant serving good food at very reasonable prices - nice setting in open air - two main courses and two drinks c£14 - couldn’t beat it !,El Sabor Latino
50,"This restaurant in Nicosia (Turkish side) is one of my favourites when working in northern Cyprus, and a great place to meet friends and colleagues. The location is great in the old walled city. Great for lunch and evening meals.The restaurant is extremely popular and can be very busy in the evenings. Staff are really friendly and helpful.The menu is varied and features Spanish and Italian cuisines (as well as local). I particularly love the Patatas Bravas with Italian meatballs for starters. Good lasagne. Homemade lemonade really refreshing at lunchtime.",El Sabor Latino
50,Excellent food and wonderful staff! Would recommend a must visit when travelling to Nicosia. Enjoy !,El Sabor Latino
50,"We have been here before. Lovely friendly staff. The food is consistently good. Lots of choices, well presented and delicious. The prices are very reasonable. Our usual place to eat in Northern Cyprus. Highly recommended.",El Sabor Latino
40,"One of very few decent restaurants in North Nicosia and worth a visit. We went twice but the second time the steak was not as good as the first. A nice evening though all the same. And yes, the Sangria is good.",El Sabor Latino
50,"Generous and tasty dishes in the shadow of the cathedralThe Sabor restaurant terrace is very welcoming, in the shadow of the cathedral, a bit off the main tourist lanes of North Lefkosia. Ordered dishes were generous and very tasty: a feta salad, al dente arrabiata pasta or garlic shrimp and calamaris, without to mention the sabor fish. The ""local"" Turkish beers were served at the right temperature by a friendly and efficient staff. The ratio price/quality is excellent making it probably the best alternative to other tourist feeding places, on both sides of the green line. It remained the absolute best reference during our stay. We visited it twice. Apparently, the locals also like this place.",El Sabor Latino
40,I was skeptical to visit a Spanish & Italian restaurant at first. The wide menu also made me curious. We were a group of 10 and everyone tried different types of dishes. I had the shrimp and calamari with salad and potatoes. The presentation was quite interesting as well. My dish was tasty and I was satisfied. Their sangria is to die for!,El Sabor Latino
50,Best food and custumer service in Cyprus. Manager Riza is the best. This place feels like home. 10/10,El Sabor Latino
50,This is a restaurant continuing the similar menu for more than 10 years and it brings quality. The restaurant is next to Selimiye Mosque and there is no trafic so you can sit outside in the center of old city and enjoy your quality meal and pay around 30 euro for 2 people. What else do you want?,El Sabor Latino
50,"Surprised that the menu was almost exclusively Italian dishes in the Turkish occupied part of Nicosia. Close to a lot of attractions. Best of all the super helpful and attentive staff as well as the excellent quality of food, not to mention the huge portion sizes.",El Sabor Latino
40,"I had the mushroom cream chicken with a cappuccino and hit chocolate. Mine was delicious and perfectly cooked. My partner had pasta with Gorgonzola and he was not as satisfied, calling it average. Huge portion again. Located in a lovely area close to the mosque on the Turkish side of Nicosia. Service was excellent and attentive.",El Sabor Latino
50,"Being at the Turkish side and close to the visiting monument area we checked this restaurant and it was great. Fantastic service, food and ambiance. The price was really worthed since the conversion of the Turkish lira made it really good value.",El Sabor Latino
50,"There are not an overwhelming choice of restaurants in the northern part of Nicosia bit sabor would be just at home on the other side of the Green Line. Very good food in healthy portions, well priced house wine, excellent service and atmosphere. The restaurant is in the shadows of St. Sophia with plentiful outdoor seating and a cool vibe inside. The dishes are mainly influenced by Italian, Spanish and Portuguese cuisine. A great place to relax and enjoy the wine and company.",El Sabor Latino
50,El Sabor is great for a Tapas snack of a full on meal. Menu has enough choices to please everyone. Been back several times.,El Sabor Latino
40,The food is cheap and it’s one of the most cozy places that we’ve eaten in Nicosia. Would recommend if you are on the Turkish side of Nicosia.,El Sabor Latino
40,"Very efficient and friendly staff, very well organised, incredibly good food for the price and an over all lovely evening. Nice and relaxing outdoor space, perfect for a romantic meal. Great wine and great steaks!",El Sabor Latino
50,"Great food, friendly staff and nice location. Credit cards accepted here. Given the current £-TL exchange rate, makes a cheap meal!",El Sabor Latino
40,"A huge place with lots of outdoor space. The food is decent to very good, the service is excellent, the prices are very reasonable and the atmosphere is relaxed and friendly. What's not to like?",El Sabor Latino
40,"This seems to be the only modernish restaurant in the old city deviating from the standard tourist and local fare. Large terrace outdoors, the kitchen is Mediterrenean with a Portuguese touch.Still, the food is simple and the entrecote is cut as if it were a schnitzel. Would recommend, but only due to the absence of better restaurants.",El Sabor Latino
50,"Always excellent food and good service. A place where you will go again and again, Visit this place already for more than 30 years.",El Sabor Latino
50,"A very good Spanish-Italian fusion restaurant located in the center of the old town of Nicosia. Out of all the Italian restaurants I have been both in the South and the North of Cyprus, I have to say Sabor is the clear winner when it comes to food. The only issue with the restaurant is the slloooowwwww service, the waiters (there are very few of them for the size and number of tables so rightfully they look and act stressed, tired, and annoyed).",El Sabor Latino
20,It was not a busy lunchtime but the staff took over 20 minutes to come to my table to acknowledge me and even then I had to ask for the menu . They really had little interest in serving . I decided just to have s drink and not even risk ordering anything due to their poor attitude and lack of service.,El Sabor Latino
50,"Passed this place many times on our visits to Nicosia but decided to give it a go today. We were not disappointed! The staff were lovely and we enjoyed chatting to them. The menu was extensive covering classic Spanish and Italian food. The four of us had a drink each, a main course and a dessert and small bread rolls and oil was supplied with the drinks.. The food arrived very quickly was hot and above all, delicious! Clean plates all round and the bill came to 240 lira ( €50 ). The place is located in a quiet square to the rear of the main mosque. Loved it!",El Sabor Latino
40,"Stumbled upon this restaurant whilst walking the streets of the old town Nicosia. Food was really good, prices were good and service was ok.",El Sabor Latino
40,This place was full of locals at lunchtime which is always a good sign. We sat outside- but the inside was a very trendy bar. The food was good and reasonably priced. It has free wifi and is overlooking a lovely mosque.,El Sabor Latino
30,This place is in a great location on a quiet square next to a church.The food us Italian /Spanish which is a little odd on Turkish Cyprus but it was full of locals so must be popular.We had the tapas and it was good and tasty. The only complaint I have is that the service was quite slow.,El Sabor Latino
40,"The location is perfect: no road, a lovely square and the beautiful mosque / cathedral right in front. The terrasse is well arranged, the menu is varied, and there are good options for vegetarians. Good for couples or with friends.",El Sabor Latino
50,"What a find this is. The only restaurant in old north Nicosia to serve truly European cuisine. And to illustrate just how good this is, the place was packed out the night we went, with tables turning over 3 and 4 times in the 2 hours we were there. The menu is Spanish and Italian, mainly tapas and pasta, although there are mains meat and fish dishes. We ordered tapas straight away and were amazed when our food was delivered after only a couple of minutes. But don’t be alarmed, the taste was amazing. We had prawns in oil and garlic, fried calamari, mussels in a delicious creamy tomato sauce, spicy potatoes, olives and two baskets of bread, plus a bottle of Pinot Grigio, all for the equivalent of €22. Can you believe that? Fantastic food and fantastic value. We couldn’t believe it! Everywhere else we found in old North Nicosia was kebabs, kebabs and kebabs. No wonder it was so busy with mainly young locals.",El Sabor Latino
30,The restaurant is located at the old town of Kyneria. Outdoor option of the cafe type restaurant is increasing the satisfaction. The menu is serving for all needs that you would expect from a cafe. I suggest for family visit purposes mainly.,El Sabor Latino
50,"I haven't been to Sabor for a while, and by chance I have been twice this month. Both times were wonderful. Fabulous service. Excellent food. Lovely ambience. Very good wine list. I can't recommend it enough.",El Sabor Latino
40,Located in Nicosia. Tasty and nice food. Calm place and the service correct. The chicken avocado was tasty too. Price / quality very reasonable.,El Sabor Latino
40,"This restaurant is located on the Turkish side of the Nicosia, make sure you have you passport with you to cross the checkpoints. Very affordable restaurant with a nice variety of food. I have chicken avocado. A tender piece of chicken with fresh avocado and side salad, very fresh and crunchy vegetables, in addition to pumpkin soup, thick but not very well seasoned. Come to this place it is nice.",El Sabor Latino
50,"This has got to be my all time favourite restaurant in Lefkosa (Nicosia) Northern Cyprus. There is so much choice on the menu and it’s all cooked fresh, the waiters are friendly and efficient, when we visit Northern Cyprus we make this restaurant a must, because it’s so nice, I did suggest to the owner that they should open one in Bluewater Kent, so that we didn’t have to wait until we where on holiday. We have taken several friends and family members too Sabor and they have loved the menu, and the experience of a different restaurant serving a completely different variety of food, if you get the chance have visit, I don’t think you will be unhappy",El Sabor Latino
50,We had lunch here today. Our third visit here. Such a great place. Amazing value and large portions. Everything is cooked perfectly. The Turkish wine is super. Reasonably priced too. We sat outside under the pergola. The staff were friendly and efficient. A super place to have lunch after crossing over onto the northern side. I know we’ll return time and time again.,El Sabor Latino
40,This is one of my restaurants in downtown Nicosia (north) that I know will never let me down. The food is very good and the ambiance at night is amazing. Make sure to try their Sangria.,El Sabor Latino
50,"This is our second visit to El Sabor and it really hasn't changed. Great selection of food, we went for the Tapas this time. The staff and really helpful and friendly. Would really recommend this pace if you are in the area.",El Sabor Latino
30,Mmmmmmm....too much food on the plate. Too much going on in the dish..with flavours and different elements vying to please your senses. They think they offer a take on modern European cuisine..they don't. I won't rush back.,El Sabor Latino
50,A very good restaurant with outside seatings at the North part of Nicosia (Turkish part) serving Spanish tapas and Mediterranean dishes. Fast service good taste cheap prices.,El Sabor Latino
50,Everything I had there was delicious. Especially the pastas were my favorite. You can try their sangria with pleasure. There are several bars nearby. The staff was very helpful. You can try the evening snacks with a beer after sightseeing.,El Sabor Latino
30,"This restaurant is in a lovely setting by the Selimiye mosque, and has a wide selection of Mediterranean-influenced food and drink - a nice touch was the vino tinto con limon. Pastas were good, especially the penne pasta with sirloin, Gorgonzola and sundries tomatoes.",El Sabor Latino
20,"Since the location is very central in the middle of the old town and surrounded by the historical monuments, this restaurant is popular. But I would never recommend it. First of all, if you dont make yourself visible by standing up and walking angrily towards the waiters, they dont see you. You give your order and then the waiting process begins. AND in the end you get your food. Just ordinary. Not worth waiting at all. Not worth all that fuss. There are much better restaurants around. Pls ask local people for recommendation apart from Sabor. I am a local. You can ask me as well by sending private message.",El Sabor Latino
40,We visited the occupied part of Nicosia and had lunch at this restaurant. We were seated outside as the music inside was a little loud. They were playing some really nice older music but we wanted to just hear it in the background.The entree of chicken wings were absolutely delicious. Juicy with just a little spice! The prawn and calamari came on a hanging skewer and looked very impressive. The portion was a little small - accompanied by lovely vegetables and potatoes. It was very tasty.The chicken gorgonzola that my friend had was tasty and a sizable portion also with vegetables and potatoes. We did not have desert - only coffee.I will surely return to this restaurant!,El Sabor Latino
50,"Great location. Stopped here for drinks and sat admiring Selimiye Mosque that was facing it. Staff very helpful and friendly, frappe and fresh juices were lovely.",El Sabor Latino
50,As I live in Cyprus it is my pleasure to go to this really excellent restaurant quite regularly.. it would be difficult to find a better location set as it is just behind the main mosque in lefkosa.. one can eat outside most of the year but in the winter the inside although quite large is very cosy .. excellent service always and the menu is extensive.. wine list also great.... menu wise I have several times been told what I wanted was not available as when chef went shopping the particular product was not up to scratch and he wasn't going to use a below par thing in his cooking.. portions generous and well presented. .I'm not overly fond of the large wine glasses which makes the wine in the bottom look a bit miserable but that's personal.....everything is very clean and it is easy to spend a long time enjoying the meal and the company,El Sabor Latino
50,"It is one of my all time favourites , literally never disappointed me. I visited many times, food, service and ambiance are always up to my expectations. Even when I am not hungry I can just go their to enjoy the sangria. He prices are quite reasonable . If you felt like having a dessert, don't miss out on their apple pie.",El Sabor Latino
30,"Sabor used to be one of the best places to eat in northern Nicosia. I was a regular there. The location is just lovely, both in the winter and in the summer. It is authentic and spacious. It is really nice to sit outside too, and mostly, they play good music. The service is good and the staff is helpful. They have a good wine selection too. But the food that was really good before has at best became inconsistent. Sometimes they lack the ingredients, sometimes it is totally reheated, sometimes it is hotter or milder or saltier than before... Sometimes it says 8 chicken wings and you get 7 instead, sometimes the portions are a good size and other times too small. You get the idea... it has become inconsistent and because of that, mediocre. it is supposedly a Latino restaurant and a wine bar, but their cheese plate is just disappointing. Parmesan and feta cheese, really? no nuts, no dried fruit, no mature cheddar, no brie, really? Last time, they didnt event have peanuts, or mixed nuts or popcorn or any other nibbly bits to go with our wine let alone an acceptable cheese plate. I still go there, mainly for the location.",El Sabor Latino
40,This is one of my favourite restaurants on the island. The food is tasty and location is charming especially when the bougainvilleas bloom! Such a treat for your eyes and stomach in the old city Nicosia! p.s. don't forget to try the sangria!,El Sabor Latino
50,"El sabor Latino has been a great place to eat for islanders since the day it's opened it's doors which was 2004 as far as I remember. Located in the old city centre of Nicosia, it offers a beautiful view from the courtyard. The food is good. It's also nice to enjoy an average priced drinks with friends. Pastas are nice. I highly recommend if you find yourself in Nicosia.",El Sabor Latino
40,The place is known as the first spot to sell sangria in the north. The sangria isn't the best but it's not bad either,El Sabor Latino
30,We enjoyed lunch here. We appreciated the shaded tables on a hot day. We enjoyed a tapas menu - the chicken goujons stuffed with cheese were tasty and the potatoes nicely spiced.Prices were reasonable and the service slick. We were fascinated by the number of cats too!,El Sabor Latino
40,"It's a restaurant that have there for ages. Standard is good quality food, prices are reasonable. Spot is in the middle of traditional historic buildings so ambiance is quite lovely. Suggested restaurant for a night out meal.",El Sabor Latino
40,"Nice ambience, good food, cheap prices compared to Greek side as you can pay in Turkish Lira. Sirloin steak 32 lira (8 quid)",El Sabor Latino
50,"This has long been our favourite restaurant in the Turkish Republic of Northern Cyprus. Food is tasty and fresh and in generous portions. I particularly enjoy the seafood dishes, although the menu is varied and off menu variations are well accepted. Drinks are reasonably priced and the service is usually good and always friendly.The venue is very popular with locals, both at lunchtime and in the evenings.It is located in the newly and beautifully renovated historic centre of the city. On our last visit we were also able to watch and experience a display of Whirling Dervishes in a nearby historic building.",El Sabor Latino
10,The service was awful was waiting nearly an hour for the food wouldn't eat here again wouldn't recommend it to anyone,El Sabor Latino
40,When you visit nicosia. I really recommend El Sabor Latino. Specially during summer nights sitting outside and eating nice for will make you totally happy.,El Sabor Latino
40,"We called in here for lunch. We hadn't boomed. The interior had air conditioning and the feel of the building was quite industrialised. Concrete walls, exposed ducts and metal girders.We ordered our meals, but the service as unbelievably slow despite the restaurant being almost empty. Eventually three beers arrived for four of us! One member of the party went and collected the beer herself from the bar. The wait for the food and then the bill was painfully slow.The food itself was good. I had the calamari and prawn skewer. It was spectacular suspended on a stand.The price was reasonable for the food and drink too.",El Sabor Latino
50,"Tired of the typical Nicosia food, we traveled across to the northern side one night and a passerby recommended this restaurant. It's behind the mosque looking out at a small town square. The location is fantastic - especially when you eat outside. I had a pasta dish that was some of the best pasta I've ever had but the real surprise was the skewered seafood with a fantastic presentation. Definitely recommend!",El Sabor Latino
30,I have been to this restaurant many times but not for a few months. Today this normally busy little gem was very quiet which is unusual especially at this time of year. The service was OK by NC standards. My sister had a beef salad that was all lettuce and very little else - not something she would have again. I had grilled vegetables and a tapas portion of shrimps which lacked any flavour at all and were rather boring. This restaurant normally serves some super food so I was disappointed. The location is still lovely and they offer indoor and outside seating - and Spotlessly clean toilets.,El Sabor Latino
50,"Arrived just after noon, 3/4 tables taken but soon got busy. Charming waiter suggested a few tapas dishes so off we went.Garlic mushrooms, calamari, and chicken wings and a portion of patatas bravas!Food came quickly, service was attentive and price was excellent value.Amusing highlight of the 60 minute experience was the local business people running to move their cars as the cops blew their warning whistles !",El Sabor Latino
40,The menu had lots of choice at good prices. Our meals were lovely and the portion sizes very good. The service was friendly and the atmosphere and location great. Definitely one to return to and encourage friends to try. A lovely part of Nicosia with lots to see and do.,El Sabor Latino
40,"Nice location, authentic exterior, modern interior, friendly english speaking staff, nice food, not expensive",El Sabor Latino
40,"It was a business dinner. Yet, the waiter, realizing that it is our first time in Sabor and therefore we are not familiar with the dishes in the restaurants, he did his best to understand our preferences and not only recommended dishes for us individually, but almost let the cook prepare custom fit food. We all enjoyed our food. Having a bad experience in one of the the top rated Italian restaurant in London just a few days ago, I was very happy having a very delicious Italian food. A cosy environment is a plus.",El Sabor Latino
