r_points,r_text,place
50,After thinking about where to go to for our anniversary I suggested el sabor because I always enjoy it.I ordered off menu as there are less vegetarian pasta dishes on the new menu. They are quite happy to accommodate. We treated ourselves to prosecco. It was perfect served with ice cold glasses. Service fantastic as usual. Go you won't be disappointed.,El Sabor Latino
50,"it has very tasty foods and good environment, there are many historical places around that restaurant.",El Sabor Latino
40,"A Cypriot friend recommended this restaurant to us and took us here. What a treat it was, extensive menu, something for everyone's taste, large portions (couldn't finish my smoked salmon pasta) and lovely atmosphere with the Selimiye Mosque (St. Sofya) nearby and beautifully illuminated at night. Would definitely go again and recommend this restaurant to others.",El Sabor Latino
10,"A few years back we used to visit this restaurant quite often. We always enjoyed the food and the service! Nostalgia led us back to Sabor and we were bitterly disappointed. Upon arriving there we were put off by the state of the tables. It looked cheap and uncared for. The service though okay, was exaggerated and we ended up waiting 45 minutes for our meals! The salads and maib courses were brought at the same time and they were really nothing special!! As we ate we were attacked by flies and wasps and there was no apology whatsoever for the late arrival of the foo! Not planning on returning",El Sabor Latino
40,"We had a dinner on a busy Monday evening. It's very nicely located at the big yard of Santa Sophia Cathedral / Selimiye Mosque and it seems quite a favourite as it was full (considered a week day). Menu is extensive and surely you will find something you like. I didn't find it purely Latin/Spanish. There are various dishes ranging from Italian to Spanish to more International cuisine. That's why maybe the 'Latino' in the name sounds limiting. We had mainly dishes with chicken and you have lots of choice on them (i.e. mango, curry etc). Recommended!",El Sabor Latino
50,"A beautiful summer evening spent with friends al fresco enjoying excellent food. The surrounding environment reminded me of Nicosia of yesteryear but the service and food was certainly up to date and without fault. We tried a variety of starters, tomato and mozarella salad, mushrooms in a garlic sauce, marinated octopus and a few others which set the standard for our main courses. Highly recommended is the garlic and cream prawns with potatoes and vegetables, large portions but every single mouthful was eaten. Desserts are homemade - the bananoffee pie is to die for! Time just passed without us realising it had gone midnight! Definitely on our 'to go agan list'.",El Sabor Latino
50,"i love this place, I found it by accident when a London Taxi driver who I'd met invited me for a meal. The food, ambience and service is superb .... I always come back here to sit beneath the walls of the Lusignan cathedral (now a mosque) and while away the hours. I now know the chef and his family and I would recommend to only my best friends.",El Sabor Latino
50,"We got here due to a local recommendation who we didnt know about his personal taste. It was a refreshing surprise! The food is delicious, the plate sizes are super big. We even had to take with home what we couldn't eat.",El Sabor Latino
10,Went late afternoon and the restaurant was nearly empty. Ordered a bottle of white and red wine. Waiter brought 4 frozen glasses and poured the red into two of them. When We tried to stop her she said no it always in cold glasses and continued to pour second glass even thought We had insisted that we did not want this. I asked for fresh glasses but they never arrived. Very rude lady waiter with a terrible attitude. Starters were good but the attitude of the staff was appalling. They tried to clear our starters before we had finished as they told us our mains were ready. Waiter not happy when one off our party said for him to wait until we had all finished. He stood looking at us and As soon as we had finished our last mouthful the mains were thrown in front of us and we're dried up and cold but we gave up trying to get a good service and asked for the bill and left. It's a shame as we have been to sabor on many occasions and had a great experience. This time we had taken two friends who were here on holiday and had raved about the food and service. Very very disappointed. Perhaps the notice in the window said it all EXPERIENCED STAFF REQUIRED. They will not need any new staff if they keep treating customers like this.,El Sabor Latino
50,"We went there twice. First time, we were there with a group, and had Bistecca Salad. It was great. The second time we were there for coffee and Cheese Cake. Both were great, Cheese cake was a bit over baked. Other than that the service was a bit slow and the waiters did not pay much attention, esp. during the second visit. My impression is that they take better care of groups and known customers than tourists.",El Sabor Latino
50,"A quick trip to El Sabor. I like El Sabor as one of the few restaurants that have vegetarian food on the menu.Everyone was happy with their meal, tasty, made from scratch, home made sauces.Great service as always, the staff here know just how to approach customers, help with choices, and are always polite and pleasant, with a good knowledge of English too.Much cheaper than some of the tasteless plastic joints the youngsters go to, and a much higher standard of fare.",El Sabor Latino
50,"I've been there today for lunch (it is my second time) and I am exited then before. First time I went there on recommendation of my friend, since I visit northern side often. Staff was very welcoming and kind. They helped me with order, since they have plenty of choices and everything looks delicious. First time I had grilled chicken with herbs and it was amazing(juicy, tender and really tasteful) served with fresh cooked vegetable (soft and nice cooked) and some potato.This time I had mussels for starter(tapas-just to taste it) and it was wonderful. I couldn't resist their fresh dark bread with olives and deep in olive oil (yummy-and I hate olives :)) for main I had diet sirloin since I am on diet(kind off) :) I was served by manager who was very polite and in the end suggested me an AMAZING dessert with banana and caramel...mmmmmmmmm.....Definitely I will go back as soon as I can, because I enjoy service,ambient,music and off course food. HIGLY recommended to everybody, since anybody can find something for themselves",El Sabor Latino
40,food excellent but access into the restaurant is awful ! It really needs a ramp several customers were commenting the same as my husband struggled to get my wheelchair up the steep step! Come on Sabor get to treat disabled as people too?,El Sabor Latino
50,For the modest price this is a very good restaurant. Nice setting in old town in atmospheric renovated quarter - probably the nicest part of Turkish Nicosia.,El Sabor Latino
50,We visited El Sabor twice recently and have enjoyed the menu very much. This restaurant is very clean and the staff very welcoming. Good value for money. It is a must when visiting the Turkish occupied part of Nicosia.,El Sabor Latino
50,We stopped at this restaurant off a main square in Nicosia recently and really enjoyed the food. We also enjoyed the Sangria as well!!! This place had a pretty extensive menu which included everything from Pizza and Pasta to Steaks and Asian style noodles. All three of us enjoyed our food and would definitely return to this restaurant if given the chance.,El Sabor Latino
50,"What a pleasant surprise! my hotel in Kyrenia catered for ""UK taste"" and I so wanted a decent meal before I left for home. I had a wonderful steak Sabor - freshly cooked, good use of herbs, good portion size, tasty. What more could you want?",El Sabor Latino
40,visited this with in-laws who are regular visitors. The service was attentive and when it arrived it was delicious. Well presented. Good value for money.,El Sabor Latino
40,"This is obviously a popular restaurant in the Turkish part of Nicosia, although a bit tucked away. It faces onto a square with a lot of outside seating. We took advantage of this as the weather was mild. What we didn't realise is that we would be plagued by the local cats, who all looked quite well fed. It seems obvious that some customers have been feeding them which isn't very sensible and spoils things for other customers who want to eat outside. I counted six different cats and they were a real nuisance, nor is their presence around the tables (& no doubt on them if they can get away with it) particularly hygienic. That apart the food was very good and they accept payment in euros as well as Turkish lira. The exchange rate is also very good so it was cheaper than eating in an equivalent Greek Cypriot establishment. Service was good but a few smiles would have been welcome - they seemed to be reserved for the regulars. I would go again but sit indoors!",El Sabor Latino
50,"such good value, for large portions.had difficulties getting in as I am in a wheelchair no ramps, it would not take much to improve the access to this place. Everyone was pleasantly surprised with the food. I was not so keen on my Thai salmon too many bones?The sticky toffee pudding was awesome.Can definitely recommend.",El Sabor Latino
50,"Going to the Turkish aide is a great idea for dinner. Sabor's was easy to find right by the Mosque. The menu is Turkish, Italian, Portugese, Japanese and Spanish. Very resonably priced and the food was excellent. Going to the Turkish side is not like going to North Korea. It's a great restaurant when in Nicosia. Highly recommended.",El Sabor Latino
40,"Stopped off here for a snack whilst visiting Nicosia. We shared some Tapas which was really tasty, the water then suggested that the chef made wonderful deserts... and he was correct. The Tiramisu was lovely. It's obviously a restaurant where the locals go and this was reflected in the price. Very reasonable and they also took Euros (wish they'd said that on the menu).",El Sabor Latino
50,Very clean and nicely laid out.nice view of the nearby church.good quality Mediterranean food. I had mango chicken with tagiatelli in creamy sauce and my wife had chicken and mushroom pizza.both delicious.I had a beer and the wife had a large glass of wine.price came to £16.50 sterling so great value.would definitely visit again,El Sabor Latino
50,"It's one of the best restaurants of both parts of Cyprus. You have the great possibility to taste both italian and local cuisine. The staff is very helpful and nice, the cook is just a genius. I highly recommend to visit the restaurant in the silent part of Turkish Nicosia",El Sabor Latino
40,"A really nice spot serving simple Italian/Spanish style food, it was a most enjoyable lunch in the sun in wonderful surroundings. Good attentive but not overbearing service, homemade bread and olive oil/balsamic complimentary, good drinks menu at sensible prices and a very comprehensive but not massive food menu. Worth a visit in this exquisite location. Lunchtimes can get very busy with the ""business"" crowd so early or late would be a good tip, we were in just before it filled up.",El Sabor Latino
10,"I stopped off here for lunch during a visit to the Turkish Cypriot part of Nicosia or Lefkosa. The restaurant, which served Italian and Spanish food, seemed very welcoming with lots of chairs and tables with umbrellas as well as plenty of indoor space.It took a while to get a menu and then a much longer wait to have my order taken. At this point I discovered that Sunday is the pizza chefs day off so the pizza I had chosen was not available. Then my substitute dish was not available. I made another selection and ordered my drink and 5 minutes later was told the drink was not available either so I chose another.I waited ages for the food and the whole focus of the waiter’s attention became the children and wife of the owner who took priority over everyone else while they were served.When the food came it was dry and unmemorable.",El Sabor Latino
40,"We had tapas in this restaurant while visiting Nicosia, the food is lovely and the service is good, try the home made lemonade",El Sabor Latino
40,"Tucked away near to the church but still in the centre of Northern Nicosia this restaurant is peaceful, clean and the staff were lovely. We had a tasty lunch (oddly serving Portuguese wine and dishes which we love). Unfortunately a swarm of hornets circled round us outside just before a cyclist ran over a tiny kitten. We were moved to another table and the staff brought some water and were very concerned. They didn't charge for one meal which wasn't eaten due to concern for the kitten even though it wasn't their fault. Would definitely recommend for a lunch of evening meal.",El Sabor Latino
40,A highly recommended restaurant. Nice open air arrangement. Full of customers yet very peaceful as not many shops around. The food is excellent and tasty. The menu is good and had quite variety of food. Though been there only once yet like the place very much. For sure you would love the place.,El Sabor Latino
50,"I had the misfortune of everything I fancied ""not being on"" that evening.My guest asked for a steak to be cooked well done and be served with a hot spicy sauce and salad, which was not on the menu, but they did a great job of!I was offered noodles without meat, which again is not on the menu, but was very tasty with real japanese wholewheat noodles.",El Sabor Latino
40,"I have been here a couple of times now and both occasions were at lunchtime. There is loads of indoor and outdoor seating. The menu is quite extensive, pizzas are delicious. I had a superb tuna salad on my last visit. The waiting staff are friendly and efficient. Definitely worth a visit because it's in a fab location where you can relax and chill out. They have free wi fi.",El Sabor Latino
40,Just popped in for a quick coffee and to check e-mails but what a nice place! Good coffee. Friendly service. Great location and clean modern decor.,El Sabor Latino
40,In a city or country where you can get really fed up trying to find suitable things to eat at least here there are about 8 or more tappas that are vegetarian some vegan . Sangria is good.,El Sabor Latino
10,"I think this is my second review for this restaurant. The first one was better but no improvements since then. What's more, it got worse. We went there with friends the other day. we ordered 8 dishes and unfortunately only one was happy. On my plate, I found a few tiny pieces of pasta or noodles which definitely didn't belong to that dish. In addition to that I found a small piece of mushroom which again shouldn't be there. When I noticed those ı stopped eating of course and told the waiter about it. He just nodded his head and went on. Almost noone ate their dish completely and we were mostly hungry when we left. And our complaints didn't receive any attention or any response either. So, my suggestion ""Don't go there if you don't want to experience a dinner ruining surprise, let alone the not so very nice state of their ""WC (Gents)"" which I mentioned in my earlier review. Sorry to see such a place that could be a fantastic restaurant turning into a bad restaurant everytime I go there. Most unfortunate.",El Sabor Latino
50,"When visiting the Turkish side of Nicosia, we always have lunch at this restaurant. The staff are really nice, fun & helpful. The location is wonderful, a really beautiful spot beside the church, quiet & relaxing. The food is excellent & although the tapas portions are small, it's just the right amount - in the heat, you don't fancy huge plates of food. I had sangria this time, this was lovely. It's very reasonably priced for a great meal. Highly recommend.",El Sabor Latino
50,"Sabor to me is the best restaurant in Northern Cyprus , their menu has over 100 dishes all explained in English and Turkish, and the food is cooked to perfection and taste wonderful, you can sit outside and eat or inside where there is excellent air conditioning, free WI-FI if you are one of those people that are constantly on their phone/laptop/IPad etc. At no extra charge when sitting down you are given some rolls/bread and a dish of olive oil and balsamic vinegar to dip in while you wait for your order to be prepared. The staff are friendly and quick with the service, if you do visit Lefkosa then I would recommend you take a visit to Sabor",El Sabor Latino
50,A great restaurant which has never failed to please me and my friends. The food is always reasonably priced and the quality is always good.,El Sabor Latino
50,"Food taste and quality are great, accompanying wine is good, rates are inexpensive, service and staff are fine and the location of the restaurant is unique : at the heart of old Nicosia, looking towards Selimiye Mosque, the great historical building. It's a pleasure to spend time at Sabor Nicosia...",El Sabor Latino
40,"This good decorated restaurant, when I came with my friends loved the food. The meal was international and good served. We tried all portions from ourselves and it was really nice.",El Sabor Latino
40,"Sabor has been around for a long time and the location is just magic: in the old square with the Mosque in front of you. The food is nice, just what you will expect from a Spanish/Italian place with pasta and tapas etc. every thing is well cooked. On a lovely Sunday spring day sitting in the shade of the trees, listening to jazz music, listening to the call from the mosque, sipping chilled white wine and nibbling different plates... That was just we wanted and enjoyed.",El Sabor Latino
30,"The only word on the outside of this restaurant (located near the old cathedral/mosque on the north side of the border) is ""sabor"". I did not know it claimed to also have ""el"" and ""latino"" in the name. Never mind. I lived in Spain for over 10 years and speak the language fluently and although we have enjoyed eating lunch at this restaurant a number of times, only the name reminded me of Spain (Sabor = flavour).If the weather is good then the setting of this restaurant is ideal for eating outside. The menu is pretty extensive and they are more than generous with the quantities of pasta (Spanish ??) but not so generous with what they say goes with it, such as chicken. So, while the prices seem reasonable for some dishes they are not cheap.On this last occasion we were there with friends from the UK and the service was both slow and lacking in ""customer care"".We will be back, but a bit more cautiously regarding their so-called quality.",El Sabor Latino
50,"Studying in the Greek part of Cyprus, I like to come here regularly. The staff are friendly and the setting is great. The open kitchen gives a great feel to the place and you can watch your meal being cooked in front of your eyes. The food has never failed me once. Just be prepared to get a shock when the mosque next door does its very loud call to prayer which can be a little disruptive for the few minutes that it lasts.The food is also extremely cheap compared to southern Cyprus. If possible, pay in Turkish Liras to get the best price as if you ask to pay with Euros they will round up the price a little to a cleaner figure.",El Sabor Latino
50,"Located on a cobbled square in a pedestrianised area, near the Selimiye Mosque and the Eaved HousePros:-Free WiFi - no password required-Friendly staff-Plentiful indoor and outdoor seating, including a leather sofa lounge area-Attractive decor on the walls-Menu in English-Wide range of food consisting of starters, pastas, chicken, meats, noodles, salads, paella, fish, desserts. Children's menu choices.-Wide range of drinks including white wines, red wines, beer, cocktails, cold drinks, coffee.-I ate chicken pesto (19TL), apple pie and drank a Efes Pilsen (50cl draught, 6TL) and a latte, which I thought were all reasonably priced.-Blankets available outside if you are cold-Relaxing background musicCons:-No ramp access",El Sabor Latino
50,"We've been to Sabors many times-- with friends, family, small children and as a couple--always excellent! The ambiance is lovely--I especially love the music. A wide variety of choices on the menu and so you will find something to your liking. The waiters are helpful and attentive even when the restaurant is full---not to be missed!.........and the good news is there's now one in Famagusta!!!",El Sabor Latino
50,"One of the best places that you can have a nice dinner out in Northen Cyprus. It is located in the old city in Nicosia. The aura of the place is worthy to experience. There used to be a Spanish guitarist whose name is Emo, make you feel the Mediterranean. The dishes were delicious. The patrons of the restaurant are chaste. Enjoy your time there.",El Sabor Latino
30,"I have been to El Sabor several times, sometimes with big groups up to 20 people. The service has always been very good and I have never had to wait around. The food is nothing surprising at such as it is a combination of pastas, tapas and other Spanish style grub. I have never been disappointed with my meal, yet I could really not describe the food as ""amazing."" Several friends have commented however that their paella is really very good.The settings are also very nice so the place is a safe bet if you fancy something non-East Mediterranean at the North side of Nicosia: the walk from the check point is nice on its own.",El Sabor Latino
40,"I come to this restaurant based in Lefkosa everytime i visit Kibris. The spanish style tapas are tsy the pasta is good and te chops are to die for. What impressed me is that they respect the local mosque next door to them, when the call for prayer started they turned off the music in respect. It definately earned my espect for them.",El Sabor Latino
50,"We have visited Sabors in every season--eaten indoors and outside. Food & service always excellent! Yes, outside there are loads of cats but that's hardly the restaurant's fault.Every dish I've tried has not disappointed--we regard the restaurant as one of the very best we've eaten in in Cyprus. Prices are reasonable for the quality of the food and we would recommend it to one and all!! The music played is reallylovely--chilled, relaxing and very cool!A real treat not to be missed!",El Sabor Latino
50,"It's best to visit this restaurant in the evening for its magical setting, just by the 13th century cathedral which is lit at night The food is wonderful, with very generous servings. The starters are especially delicious. There is a little restaurant next door, owned by the same family which does great mezes.",El Sabor Latino
30,"The food is really tasty and delicious...Of course, you might want to go a few times try different dishes and then decide on your favourite because some flavours might be a bit strong. However, that is no way to say the food is bad. Great food indeed. The service is nice, too. Waiters mostly kind and fast (except for times when it is too crowded...management could hire a few more waiters actually). I like to visit the place especially in winters and sit indoors because there can be hundreds of cats around that won't let you eat in peace (they jump on the table and try and have a bite of your dish etc etc) in summer. Besides, the tables are set right on the street not a garden or a seperated area. Well, you might enjoy that too.The orst thing about this restaurant, I guess, is the WC. There is just one for ladies and one for men. When the place is crowded you need to wait at the door of the WC or go back and try your luck again. Another awful thing about the toilet is that it looks dirty. I don't think it is very dirty but it looks like that. Yet another point is that they don't have paper towels or anything of that sort to dry your hands after you wash them. They really NEED to DO something about the WC.One last thing...just when I logged in to write my review I noticed that Sabor's address is given to be in the ""Turkish occupied territory""...well, to be honest it really doesn't look like it is under any ""occupied"" state at all. It is one of the fanciest restaurants at a very nice and touristic area of the city where lots of tourists visit everyday. So that definition might be somehow over exaggerated and unfair because people there don't seem to be under any ""occupation"" and from what I've seen (I've been living in TRNC for about 6 years now) and it seems like there's a lot of democracy and state government here. Management might want to change that detail too. Other than these two points, it is a nice restaurant that you should visit when you are in Nicosa, TRNC. (we do quite frequently)PS: They sometimes serve a special desert made with figs...tastes great...not to be missed if you're lucky enough to be there on a day that they serve it...no harm asking the waiters...",El Sabor Latino
40,"We were only in Northern Cyprus for a week, but went twice to this beautifully-sited restaurant. The owner, Fatma, was very welcoming and the food and wines were very good. Well worth a visit - and decent value for money",El Sabor Latino
40,I have been many times and will continue to go. The decor and the food are great. An open kitchen watching the chefs prepare the food is excellent. The waiters can sometimes be a bit unattentive but I can live with that. The pasta dishes are excellent. All washed down with an ice cold Efes in a frozen glass. If you are in the are then give it a try. Go to the top of the main shopping street and go to the left of the huge mosque. It is in the bottom left of the square.,El Sabor Latino
