r_points,r_text,place
50,"As a Food Critic I consider it a rare find as it differs from other restaurants.I am always searching for the very best and this humble little restaurant captured my heart from the first bite.Unique in its kind with owners two adorable ladies, Inga and Itala who work with passion and love behind their cuisine and it is this love for excellent taste that they want to share with us, their customers.Located in a quiet neighborhood of the old city, a little out of the centre, but still not that far from the main Ledra Street. Easy to find as it is part of a Craft centre. I was coming from the Cyprus Hilton however, so I was dropped by taxi here for €6.00.Humble and minimalistic interior. Space inside is limited, 3 or 4 small tables the maximum, but customers can enjoy their meals out by the patio at the flowery little garden. The yard is surrounded by several interesting Art workshops which by the way, I urge you to visit while there. Personally, I found them interesting.**Have in mind that portions on my photos are not the normal. I am mostly nibbling and trying the cuisine.FOOD OPTIONS:I had the opportunity to try a few of the dishes starting with the Raw Vegetable Soup that is served cold and is way too refreshing and super tasty. Ideal for the warm days of summer!Salad accompanies each meal and portions are huge. The Mixed Salad I had included dry figs, pinecone seeds and avocado and it was a delight.MAIN COURSES:I tried the super yummy Lasagna and Inga’s hearty Spring rolls which are not similar not even in shape to spring rolls we come across in other restaurants. It is a nutrient roll in a way full of flavour and taste.Be sure to try the Vegetable Burger topped with guacamole. It is way too popular here. Succulent and colorful a burger that I bet you will enjoy and return for more.If you love Indian food, try the vegetarian version of Curry. I tried Inga’s Vegetable Curry Korma and it was a delight. Definitely another dish to be considered!DESSERT:The restaurant prides for its super yummy desserts.I asked for something light to have with my coffee. The owners recommended the Vegan Lebanese Coconut Cream and it was the perfect choice. Mouthwatering and tempting. (€2.50).Of course one can choose from Chocolate Truffles, Ginger biscuits and homemade Muffins and a couple of more.IN ALL: In this tiny cute and picturesque little restaurant I experienced new tastes, made friends and enjoyed every minute of this “Taste Journey” as I like to call it when I am out trying new flavors. I highly recommend this business, and by all means you don’t have to be a vegetarian to visit it, only because there is something for everyone. Come here even for coffee and try the amazing homemade cakes, and sweets!",Ingas Veggie Heaven
50,"Finally found an amazing place to eat as vegans! The staff were so kind and helpful. The food was amazing, not to mention the cakes! A bit on the pricey side but worth it if you're veggie/vegan. Shame it doesn't open for dinner and it's not exactly in the centre of the old town but well worth the trip!",Ingas Veggie Heaven
50,Very small restaurant with deeeeeeeeelicious food. The day I was there one of the chefs acts as the waitress and was very pleasant. Great to be able to visit this place after attempting to have lunch in north Nicosia.,Ingas Veggie Heaven
50,"Inga's is a rare find! Good honest wholesome veggie food, made and served with care and love! A very welcoming, friendly and relaxed atmosphere compliments the quality food on offer. Very good value for money and a great choice of food and beverages. Sit outside in the soaring heat or take advantage of the shade in doors - either way I guarantee you'll have a meal to remember and rejoice by. Veggie Heaven… it really is!",Ingas Veggie Heaven
50,"So unexpected to find this little gem of a veggie retreat in the back streets of Nicosia. The food was very imaginative, fresh and beautifully dressed and the decor is so warm and cosy, a beautiful place to breathe out and relax in highly carnivorous Cyprus!",Ingas Veggie Heaven
50,Located in a pictoresque art district walking distance from the main Ledra Street.I felt immediately like at home thanks to Inga ( the owner from iceland) and Itala who welcomed me with very tasty veggie sauces (must to try the raspberry one) and superb burgersDon t miss it and take your time for an exquisite veggie mediterranean meal!,Ingas Veggie Heaven
50,"This lovely little restaurant is located in a very charming part of Old Nicosia, with quiet streets and picturesque old houses, and it offers an experience which is definitely very different from the various mainstream places in the busier part of the old town. The two ladies are simply adorable and their food is not only homemade but heavenly, indeed. We were lucky to enjoy delicious vegetarian lasagne, veggie burgers of marvellous texture and taste, nut roast with an Indian twist and truffles made of banana and dates. Don't miss it!",Ingas Veggie Heaven
40,"After several disappointing meat/fish-free meals in Cyprus it was a welcome relief to hunt out Inga's (in rather a desolate area). Wonderfully friendly Italian chef - she was very welcoming and offered to turn on the aircon for a poor Brit who can't cope with such heat (I sat in the courtyard instead). Tasty, fresh, colourful food. Not cheap (about 11 euros for the main lunch course) but worth it to get non-dairy protein at last.",Ingas Veggie Heaven
50,"From the freshly-baked bread chunks and lightly dressed mixed green salad, to the wholesomeness-packed veggie patties and tasty thai stir fry: we felt positively absolved. Add to that: excellent wine pairing, any kind of coffee, stroudel and banana-date ice cream (vegan), seating al fresco in a quiet square surrounded by craft shops in the old part of Nicosia, garnished with wonderful service. Really, what more could you ask for?",Ingas Veggie Heaven
40,"A small, cute little restaurant which is mostly open for lunch with tasty vegetarian dishes. Vegetarian restaurants are hard to find in Cyprus as the locals are mainly meat eaters so you might as well try Inga's, an Icelander who somehow ended up in Cyprus. With an Italian friend, they not only cook but make you feel at home. Another plus is the neighboorhood which must be visited on foot.",Ingas Veggie Heaven
