r_points,r_text,place
40,"Went there for lunch with friends, and we really enjoyed our meal, albeit with very slow service. Our friend had a limited time, and even though we ordered early, we got our food much later than most patrons. We tried the fava, very tasty, and the ""mpoutakia"" filled chicken thighs with halloumi and bacon! I will try the recipe. Also served with salad with ""glistirida"" a very nice local touch. Overall, slightly slow service, slightly overpriced (the portion of chicken was very small for its price, four half-thighs), but nicely prepared and very polite. Would return.",Pantopoleio Kali Orexi
50,"Excellent food, great atmosphere especially in the outdoor area. The menu changes twice a year, but favorite dishes are always part of it. Thomas always available to greet and serve his customers.",Pantopoleio Kali Orexi
50,This is the place to visit when you miss home-made Cypriot and Greek cuisine. Everything that we tried was made with fresh and seasonal ingredients and tasted delicious. There is an a la carte menu but also dishes of the day. The service was excellent and the members of staff were very polite and extremely helpful! The whole experience reminded us of the taverns/ouzeri in Greece! We will definitely return next time we are in Cyprus.,Pantopoleio Kali Orexi
50,"I really do like this place! I live in this town and every time I go I have a pleasant fulfilling experience. The food is really yummy and fresh. Ingredients and spices are local. Dishes are prepared according to the season's availability. The service is perfect and the owner, Thomas, is a professional. Have dinner or lunch and you will not regret it. Family, business, friends, date...all blend well in a nice loud atmosphere. Try to share dishes.",Pantopoleio Kali Orexi
40,"Visited it on Saturday night. Although it was a bit late (after 11 pm) kitchen was open and we were able to order. Since it is summer we had an outside seating.It is a Greek tavern with good food, good value for money and excellent service.Tip: The mastic liqueur offered courtesy of the shop at the end of the meal is great!",Pantopoleio Kali Orexi
40,"Having tried all main courses except the steak which run out, best choices for us were the burger and soutzoukakia. Our starters were also very good as was the salad with halloumi. Of the two deserts we tried the yogurt mousse tart was excellent. Service was also very attentive and friendly. Will visit again.",Pantopoleio Kali Orexi
40,"I always like the food here. The prices are reasonable, the waiters are friendly. Its great in the summer when you can sit outside. In the winter it can get a bit noisy inside (rather low ceiling). Plain and simple. You cant go wrong!",Pantopoleio Kali Orexi
