r_points,r_text,place
50,One of the Best tavern in Cyprus i ve ever visited! This is very cozy Greek Modern Tavern with big variety of great delicious dishes and fantastic service! Must Visit!,Pantopoleio Kali Orexi
40,"Nice and beautifull place. Staff is helpfull and polite. The food is expensive comparing with other places, but you can find some ""big fish"" visiting this place. For three adults and one kid payed nearly hundered euro, without filling the stomack up to end, as usually happens at other taverns.",Pantopoleio Kali Orexi
50,"Pantopoleio always has daily specials, which finish early as they are very good. But the a la carte menu is excellent as well, with classical dishes alongside a few with interesting twists. Everything is fresh and home made, and you can find meat dishes as well as vegetarian options (we go there often with my vegetarian sister in law). The restaurant itself is very welcoming indoors, and it has a great terrace when the weather is nice. They bring a small glass of masticha drink at the end, always a welcome digestive! A place we always come back to!",Pantopoleio Kali Orexi
50,"Amazing greek dishes, top service and genuine friendliness, I can't wait to revisit!!! And don't forge to order the lemon creme for dessert",Pantopoleio Kali Orexi
50,I am a very choosy person but the food of this restaurant was above my expectations! Very selective dishes for very demanding customers and I can't hide that I am one of them. Prices are average but I believe you pay what you get!,Pantopoleio Kali Orexi
40,"Quick service, nice food. Really enjoyed one of the 'dishes of the day'! Although the restaurant was full the service was very good. Highly recommend.",Pantopoleio Kali Orexi
50,"Pantopoleio really stands out because of the great food. Traditional dishes prepared very creatively, with excellent quality ingredients and presented always in most a delightful way. Very good service from people who love what they do, good wine selection, prices on the high side, deservedly so. Only issue, always crowded, occasionally noisy.",Pantopoleio Kali Orexi
50,"What is immediately noticeable is the casual yet sophisticated unintrusive style of the well mannered staff, who upon receiving you start laying a few tidbits of olives and hot peppers and excellent village bread on the table (just as in a traditional taverna), and continue explaining the unusual but novel dishes (no printed menu, everything is chalked on the main wall, serving both as a giant blackboard and a design feature. Frequent changes in the choices guarantee all fresh seasonal produce, but limit quantity so be prepared to go earlier than later).The place itself doesn't boast loud decor or fancy tables and chairs, but sticks to an atmosphere that is reminiscent of old day tavernas only it's freshly coated in white contrasting to the dark black and warm grays of floor and shelving. In general its a cosy taverna setting.Wines are few and decent enough, the food exceptionally well prepared if you like and know Greek cuisine. Overall, an excellent choice between kitchen, ambience and price.I have been already several times, always on the spur of the moment and without having reserved beforehand (but early enough, before the night rush) and noticed the standard always remained high.",Pantopoleio Kali Orexi
50,"Visited the place for a birthday dinner during our vacation in Cyprus and were very satisfied. Modern, creative yet sophisticated ambiente. The staff vere very attentive. Seafood pasta and beef liver were both perfectly cooked and, for us, a very welcome change from the standard ""authentic Cyprus"" tourist cuisine. Gorgeous deserts.From a look at the menu I'd say they mostly do modern interpretations of traditional Cyprus dishes. Not a cheap place, but certainly worth the money.",Pantopoleio Kali Orexi
50,Lovely and lively place. Good Greek food prepared with care and good ingredients. Simple menu that changes seasonally. Central but also in a quiet location with ample parking.The crowd here is loyal and regular and the staff friendly and responsiveGood for kids as well,Pantopoleio Kali Orexi
40,"We went there for business lunch. Attentive staff, food well cooked. Traditional local dishes, nice ambience. A pleasant surprise in the center of Nicosia. Although mostly business people, a mixed crowd, students as well as retired ladies meeting for lunch drinking wine. We ll be returning definitely to try to test more dishes from the menu.",Pantopoleio Kali Orexi
50,Always excellent cuisine High standards service and food Friendly and nice decoration as very friendly personnel Clean and nice design,Pantopoleio Kali Orexi
50,"Excellent food, quality is consistent! I would thoroughly recommend this restaurant -but make sure you have a table outside -as it can be extremely noisy inside, due to the acoustics /choice of materials... Reserve well in advance!",Pantopoleio Kali Orexi
50,"Excellent food, Cypriot and Greek cuisine, very tasty starters and big main dishes portions. Nice desserts as well, the orange pie to be recommended and service very good, polite waiters!",Pantopoleio Kali Orexi
50,"Fresh, wholesome food, excellent service in a warm, friendly environment. Suitable for all seasons! The one place where vegetables are not over cooked! Enjoy!",Pantopoleio Kali Orexi
30,"very nice set up, excellent service , good food and nice atmosphere, always busy book table before going",Pantopoleio Kali Orexi
50,We were guests at this restaurant as we have been two or three times before. The food has been very good every time and the service has always been excellent. I have no hesitation in recommending this restaurant to someone who is looking for an authentic Cypriot restaurant with elegance and excellent service. The complimentary Masticha after the meal is a very nice touch.,Pantopoleio Kali Orexi
50,We are visiting this restaurant quite frequently. It is consistently very very good. Both in terms of service and quality of food. These days that sitting outside is simply magic because of the weather the restaurant is simply perfect for a casual and relaxing dinner. Highly recommend it.,Pantopoleio Kali Orexi
40,Worthy restaurant with Mediterranean cuisine.Excellent service and staff ready to explain and serve you.Tasty dishes.Portions large enough to satisfy the customer. As regards pricing the main dishes are reasonably priced.First dishes expensive.Wine list is short but includes top local etiquettes.Some dust is coming from the nearby parking.Crusher run floor surface in the yard is a problem for ladies.We are going to visit again this place.,Pantopoleio Kali Orexi
40,I love this place for lunch. The only serious problem is that the place is so popular that often we cannot find a table for lunch. Excellent food and service. Highly recommended.,Pantopoleio Kali Orexi
50,"We have been to this restaurant a few times in the last three years and it was always excellent. They cater for the whole family so we had no problem with young children (4 and 7 years). The cheesecake was simply devine! Having lived in several countries in Europe, this cheesecake is up there amongst the top ones!It is also well situated, in a street off a main road not far from the Solomou bus station. So no problem with parking. Service was fast and pleasant. Booking might be a good idea as it gets really busy after 8:30.",Pantopoleio Kali Orexi
40,"We went for dinner on a Saturday night. Even though the place was very busy, the service was polite, friendly and attentive. The salad with halloumi was fresh and tasty and the meatballs with yoghurt sauce were nice and juicy. The pork chop with fries and the pork tenderloin with mashed potatoes were both cook to perfection and delicious. The penne with sausage was too dry. The lemon tiramisu was refreshing, but did not impress my taste buds. We liked the house wine and the complimentary mastic liqueur served at the end of the meal. Even though in some dishes there is place for improvement, I was impressed by the freshness and quality of the ingredients.",Pantopoleio Kali Orexi
20,"Good service, nice atmosphere, food was ok. Small portions, over cooked chicken kebab, nothing special for what is charged.",Pantopoleio Kali Orexi
50,"Excellent quality of food, authentic taste, at an overpriced approach. Coffee and desert could be at least offered on a complimentary basis rather than charged.",Pantopoleio Kali Orexi
40,The food was excellent and the service was very good but 2 issues:1. To expensive 4 adults and 2 small children 150 euros really?2. The outside tables are next to a parking entrance (dirt road). Result noice fumes and a lot of dust going on our foodGood experience but need to address the points above,Pantopoleio Kali Orexi
50,"This is a small restaurant in the city center with plates you can't choose which is the best.We allways visit it every time we stay in Nicosia.You can eat lunch or dinner.Meat plates,salads,starters all tastfull like a mummy's cook.You can smell the real butter even in the simple rice.Sweets exellent .Notification for the sef: Please reenter in your menu these AAAA CHOCOLATE LOUKOUMADES with cold heart.Congradulations to the owner.",Pantopoleio Kali Orexi
40,This is where local political and financial people hang out for lunch. Its a nice place with fresh food and the menu is always interesting. Price was its ok not on the cheap side. Make sure to book a table so you won't get disappointed. It can also get windy and dusty if you sit outside.,Pantopoleio Kali Orexi
50,"One of the bests example of how Cypriot-Mediterranean food can be developed into exciting and modern dishes, coupled with excellent service and reasonable prices Pantopoleio should not be missed if dining in Nicosia.",Pantopoleio Kali Orexi
50,"I have been to Pantopoleio several times the past 3 months. Superb quality of ingredients, decent portions and dishes cooked to perfection describe accurately this place. The vibe and service are also excellent. I am really proud to have this restaurant in Nicosia.",Pantopoleio Kali Orexi
40,Good food selection and good quality. Decoration is nice but this place gets a little bit noisy when is crowded. Overall nice restaurant. Tip: You can use the (huge) parking of Thoc and Ministry of Finance,Pantopoleio Kali Orexi
50,Superb quality of food. Serves an eclectic mix of delicious Greek dishes. Service is excellent too eventhough the place is always very busy.,Pantopoleio Kali Orexi
50,"Pantopoleion has a pleasant ambiance and is very popular for lunches and dinners, so book ahead.The food is very good, Greek style with a twist .Prices are very reasonable and the staff try very hard to keep the customers happy , I would certainly reccomen IT.",Pantopoleio Kali Orexi
50,Very few restaurants in Cyprus that offer local cuisine where the focus is on QUALITY rather than QUANTITY. Everything they make is great. Always use what is in season so the menu changes frequently. The service is good. Recommend it mainly for business lunch but also good for family.,Pantopoleio Kali Orexi
50,excellent modern mediterranean /greek cuisine..food quality never failed us and service is always a pleasure because the personnel are more than just polite waiters...best place in Nicosia..my favourite!,Pantopoleio Kali Orexi
40,"We arrived about 1 pm on a Tuesday with no reservation. The place was empty. We were shown to a table outside as we were told this was all that was available. Sure enough, by 2pm it was full. Very popular for business lunch.Food was excellent, we had squid special and the courgette tart which was amazing. Very friendly service considering how busy it was.",Pantopoleio Kali Orexi
50,This was my 4th visit to this place and I have to admit it gets better every time. It is not your stereo-type Greek-Cypriot cuisine but there's always a touch in its menus that make them that much more interesting.Its salads are unbeatable and there are lots of lovely dishes. If you like liver than try the beef liver on the grill; fantastic.Great choice of wines too and professional service,Pantopoleio Kali Orexi
40,"Although the place is situated in the heart of busy Nicosia, the owner manages to keep it light and qiuet. Every dish we ordered was cooked with care and knowledge of the materials used. Traditional cheeses are served nicely with a twist. All plates have character but, without overdoing it. All in all, everything was delicious! I definitely recommend this great place!",Pantopoleio Kali Orexi
50,"Super good, great service - pasta with meatballs are super, as are the meat dishes - great selection of starters. Greek cuisine with a twist. Highly recommended.",Pantopoleio Kali Orexi
20,"Everything was awful except the service. High prices for very small portions, nothing special about the taste or the presentation of the plates.",Pantopoleio Kali Orexi
50,"The restaurant seem famous among administration people in Nicosia for lunch at least so reservation is a must. Closed to Cyprus museum and Leventis Art Gallery, for tourists. Looks modern, it's pretty clean and the food was amazing. Look beside the menu for the daily specials as they are the Crown Jewels. Moussaka was amazing, salads, desserts, everything was delicious all four times I haven been there... Service is great, by the way and prices extremely reasonable.",Pantopoleio Kali Orexi
50,"I have visited this place several times so far, and can not find something bad, or something not good so that will keep me away of this place. On the opposite side, everything is great, food is delicious and the service is always good.Ill visit again and i advice for the people that haven't visited this place to do so!",Pantopoleio Kali Orexi
40,I really enjoy Pantopoleio especially for lunch with business associates. It offers a wide variety of home cooked dishes but also other great greek dishes.,Pantopoleio Kali Orexi
40,The food is Greekish with an international flavour. Consistently good it attracts mainly locals for business lunches. Good and speedy service. A good choice.,Pantopoleio Kali Orexi
50,We always visit here on our frequent trips to see my parents. The welcome is genuine and friendly from a close knit team of waiters who care passionately about their food. The dishes are variants of Cypriot recipes with fresh ingredients. Outside seating is great in dry weather. THE OCTOPUS IS OUTSTANDING!!,Pantopoleio Kali Orexi
40,"Nice restaurant with really good food.We visited the restaurant with friends (10 people in total) and everybody left satisfied.I personally tested halloumi and graviera (starters), pork chops & chicken souvlaki (main courses) and mastiha macarons (desert) and everything was tasty.The decor is Greek style and the area is nice as even though in the heart of Nicosia it is really quiet, plus there is plenty of parking around so you don't worry where to park.Just for your information the map shows it at wrong location.The address is the same Vasileos Pavlou but at a different location. Next to the old GSP stadium, opposite of the ministry of finance.",Pantopoleio Kali Orexi
50,"We visited this cute Greek style restaurant for the second time this summer. The food is consistently at high level, well cooked and served fresh. Very polite staff and ready to help you . Nice atmosphere. Highly recommend it.",Pantopoleio Kali Orexi
50,"Glad to see a renewed menu. This simple, modern restaurant is a taverna with a twist. Much loved by locals, and especially enjoyable in summer, with outdoor seating in the evenings. The service is always outstanding!",Pantopoleio Kali Orexi
40,This lovely place serves mostly Greek food and it's absolutely delicious. The service is always attentive and the staff very helpful. The prices are reasonable and you can't beat the Greek-taverna ambiance. Recommended!,Pantopoleio Kali Orexi
40,"Being there several times and its consistenly good. The place serves modern greek cusine based on traditional dishes, special note to the service which is professional. A few minutes walk from the city wall but its worth a visit. You will see a few tourists here so if you like mingling with the locals look not further.",Pantopoleio Kali Orexi
50,"I've been coming to Cyprus for years as I have a lot of family here and have been to scores of restaurants. This one is one of the very best.We sat outside in the evening air. It's really on its own in a residential and business area so actually very easy to drive to and park. Watch out the location on TripAdvisor as it was wrong as on 15 June (reported). The correct address is Vasileos Pavlou 7, 1096 Nicosia near the Ministry of Economics and runs off Grigoriou Afxentiou.It's a relaxed, friendly and easy going place with great service. The waiters are super helpful and happy to help with any recommendations. The food is all local with a nod towards a modern twist here or there. The food is perfect - some of the very best I've had here in my several decades of coming to Cyprus. It's meat dishes are beautiful and there is also a good selection of vegetarian dishes.Love love love this restaurant!",Pantopoleio Kali Orexi
50,"I actually delayed my trip to Larnaca just so I could try the food as recommended by a Cypriot blogger. The cooking here is modern Greek with Cypriot touches -- my grilled chicken stuffed with halloumi cheese really showcased the cuisine in this corner of the Mediterranean. Food aside, I imagine it's the atmosphere that draws the crowds. On my weekday visit, the place was packed with officer folk and ladies who lunch. It felt like any bustling, yuppie cafe from Los Angeles to Melbourne, Singapore and everything in the between. Oh, and really nice servers, too, which is always welcome.",Pantopoleio Kali Orexi
40,"A very nice restaurant hiding behind the old GSP parking space.The menu is short, with limited options, but you are likely to find something you like. I tried the pork chop, which was well cooked and well spiced.The waiters are very friendly, and they were very understanding when we complaint about a dish. In fact, they deducted it from the bill, which was more than we could ask for.Nice food, nice service, nice atmosphere, nice place.",Pantopoleio Kali Orexi
50,"The food is fresh, prices are reasonable, and waiters are very friendly and rapid. I will go there every day for business lunch:)",Pantopoleio Kali Orexi
50,+++ Super tasty food! +++ reasonable prices! +++ relax and cozy atmosphere! +++ superb service! + next to free parking (Old GSP stadium) + nice yard in the summer,Pantopoleio Kali Orexi
50,"Excellent food and rich menu for all taste buds. The staff is extremely helpful, positive and eager to satisfy the customer's needs. The food quality and freshness of ingredient cannot be underestimated. Wine list is also very good . Value for money! I would definitely recommend this restaurant!",Pantopoleio Kali Orexi
50,"Enjoyed Pantopoleio ever since it opened. And the quality of the food has stayed the same all this time: fresh and high quality ingredients, beautifully prepared, and with authentic Greek flavors. The staff is Greek, attentive, knowledgeable and efficient. And the portokalocrema is to die for!!!! A must for anybody who likes Greek food.",Pantopoleio Kali Orexi
40,Its a regular business lunch choice. Food is geeat especially the daily menu. But its very heavy on the stomach each time. It doesnt stop us visiting it over and over again.,Pantopoleio Kali Orexi
40,"Whenever I have a chance to go for business lunch in Nicosia I choose this restaurant, the food is homemade, fresh and realy nice! I usually go for daily menu like salad and fish. The atmosphere is very nice, if it's not too hot it's nice to sit outside. The place gets very busy during lunch but it creates nice atmosphere.",Pantopoleio Kali Orexi
40,"Visited the restaurant for lunch just today.The location is excellent and the outside seating area is great when the weather is good. The inside is a bit small but evenly arranged so that it doesn't feel packed. I am not suire what happens when the outside is not available but i must say what i experienced.Service is excellent. We had no problems or delays ordering or receiving our dishes.Starters look interesting. We chose two of them and a salad. I must say that even though the portions are quite big, the prices for the starters are quite expensive. When only 2 for lunch i suppose there should be an option to order half portions of starters.I got some traditional meatballs with yoghurt sauce and my friend the grilled sea bass.He enjoyed the fish. My dish was a bit flat. I expected more from a traditional meatballs dish. More seasoning, some spice maybe...We also shared the halva with ice cream dessert which was really good.It's a good experience, a bit expensive for what it is so i wouldn't go there quite often for lunch during work breaks.I definately recommend it.",Pantopoleio Kali Orexi
30,Nice place with good decorations. The inside is not big and therefore very- very loudly! The tastes were good but not so special that make go again. The portions are very good and fair.,Pantopoleio Kali Orexi
30,"Is a nice place to go especially if you sit outside. The food is ok, but nothing special. Friendly environment, good staff. I visited the places 3 times and still the same impressions.",Pantopoleio Kali Orexi
50,Went here for lunch after a long drive. Left full and happy. Tried the pork chop and stuffed burger ( which was not stuffed but tasty!) Desserts ate great!,Pantopoleio Kali Orexi
40,"Very good service, nice surroundings especially the garden , tasty dishes and the most exquisite portokallokrema (orange taste cream). You definitely need to make a reservation before going there.",Pantopoleio Kali Orexi
40,"I come here very often for business lunches and i always look forward to the lunch. The place is nice and simple, always fool and food is great! Service is one of the best in Cyprus - very fast, friendly and attentive",Pantopoleio Kali Orexi
40,"We went for dinner one lovely evening and generally i was impressed by the quality of service. The waiter's recommendations were very genuine, he wasn't just trying to sell, the way he described each plate made it very clear what each should order. And he was right, the food was delicious! For desert we wanted to order the creme brulee but we also mentioned that we wanted something refreshing so he suggested that we should order the orange cream pie and he was so right! It was the perfect desert for a hot summer night!",Pantopoleio Kali Orexi
50,I was in Nicosia for business and out by myself this night. As a typical American I walked up at 730p only to be turned away and told to come back at 830. I was glad I waited. The Greek salad was the best I've ever had! Te rest if the meal was excellent and the Mustika offered at the end of the meal was a perfect was to finish! I would highly recommend this place to anyone. I will be back!!!,Pantopoleio Kali Orexi
50,"Whenever guests are over for business, this is the place to go. Its great, fresh and daily dishes never disappoint. Its a hidden gem in Nicosia.",Pantopoleio Kali Orexi
50,"This Restaurant was recommended for making special homemade dishes; we tried to make a reservation; unfortunately the page on Trip Advisor didn’t include much information and no Telephone number to call although it stated Reservations under Dining options. Finally, we found the telephone and called to make reservation.We were lucky that we made the reservation as the Restaurant was fully booked for Saturday lunch. The reception was fine, and although the restaurant was full; the service was great and fast; the waiters were moving like in a beehive.We ordered 3 Starters and 3 Main Courses; they were all unique and delicious; the Stuffed Tomatoes were superb, and the Chicken with Spinach and Prawn Sauce was very tasty; however, the orzo was over cooked.We will certainly visit the Pantopoleio to try the rest of the great unique dishes they offer.",Pantopoleio Kali Orexi
40,"We have visited that restaurant with some friends. The service was very good, well prepared food with extra touch of unique flavours. On top of that , they have offered us liquer ""masticha"" .",Pantopoleio Kali Orexi
30,"First time at this restaurant for lunch. Very good decor, attention to details, nice atmosphere and kind staff. We ordered the chicken with 'moscholemono' and honey and wild rice, and a pork chop with chips and spinach. The pork chop was ok but nothing special, the portion though was very generous. I expected the chicken to be marinated with moscholemono and honey and grilled, but in reality it was boiled chicken topped with a tomato sauce, but no taste of honey or lemon. The wild rice was just untasty which was very disappointing as I love wild rice. I would really like to give it another chance as everything else was very good.",Pantopoleio Kali Orexi
40,"very good food and good selection of wines. good service, warm people. nice atmosphere. a bit expensive",Pantopoleio Kali Orexi
40,Nice atmosphere both inside and outside. Kind and efficient service. Good quality greek food. Menu now in need of some changes to reflect better the year's seasons.,Pantopoleio Kali Orexi
50,"We've been to Pantopoleio multiple times since they opened a few years back. The food and service has always been outstanding. The portions are very generous. The atmosphere can get loud but should be no surprise as the place is popular since it is a great place to socialize. The decor is outstanding as well. I'll continue giving 5 stars although I don't like to if an establishment does not have draught beer, but, because Pantopoleio always completes every meal with some exceptional, gratis ice cold house mastich, they get 5 stars. Always a great time at Pantopoleio.",Pantopoleio Kali Orexi
