r_points,r_text,place
40,"Visited Loxandra's on our first night in Nicosia. We bumped into this place by coincidence and ended up having a great experience of local food.On the waiter's recommendation, we opted for Mezedes (Meze'), being a series of small plates to be shared. We were gradually presented with a total of 10 plates, ranging from Halloumi Cheese, Lamb sausages, spiced patties, pork sausages, lamb shanks, salads, fries, cheese balls and more!!We just couldn't finish them all and they were all delicious!For drinks we tried Keo, which is a local beer. Nothing special to be honest but acceptable.We paid €15 each for the food, which considering the abundancy, was a fair price.Recommended to try at least once!",To Steki tis Loxandras
40,"This taverna is in Laiki Geitonia, the most touristic place in Nicosia. However, it is original and very value for money. I had chicken with lemon sauce and potatoes and a beer. They brought me three small pastries to accompany by beer (for free) and a salad (for free). I paid 12 euro. The lady and his husband are very pleasant and kind people. And the food is very tastefull,, the pastries are delicious!Recommended!",To Steki tis Loxandras
50,"Tasty homemade food made from the heart to your stomach, good fast service, cosy Place in the old Town, A really must visit if u come to Nicosia",To Steki tis Loxandras
50,"My Cypriot friends recommended Loxandras Tavern, and I am thankful for them. We tried a lot of plates and every single one was excellent. The staff is nice, the prices are ok. I definitely eat there each time I visit Nicosia.",To Steki tis Loxandras
50,"We went with my colleagues to have dinner there the other day and it was an amazing experience. Not only was the food delicious but also the atmosphere downtown Nicosia inside the old walled city at night is amazing. Loxandra's Kontosouvli is the best I have ever eaten in my life! The saganaki, pork fillets, tirokafteri were excellent too. To top it off we ordered kataifi and baclava (Greek desserts) with mastiha ice cream which we thoroughly enjoyed. Fresh food, quality friendly service and overall excellent dishes!",To Steki tis Loxandras
50,The quality of food and the perfect service are the main characteristics of LOXANTRA TAVERN. We have been there many times with local and international friends and the comments were exceptional. Amazing food lovely atmosphere . Highly recommended!!!!,To Steki tis Loxandras
