r_points,r_text,place
50,"Without a doubt, this is one of the best taverns in the old town of Nicosia. Friendly staff and owner, very good service, food was absolutely amazing and the quantity was way more than what we could handle. we actually took the rest home :). We were a group of 10, and the bill was about 25 euros per person which in my opinion is absolutely fine. Everyone was happy with their food and service and top it all, the owner bought us a couple of rounds of drinks.A+++ strongly recommend this place.And I will definitely visit this place when i am in Cyprus again",Zanettos
30,"Just ok. Friendly staff, good and fast service but not much variety of food and definitely not delicious. The price it was good, I won't say that is cheap, for the quality of food that I ate. I will not chose this place for food.",Zanettos
30,Meze is definitely well cooked and quantity is a lot but variety is basic. For meat Meze the price is on the end. You can get very good fish Meze at a better rate.,Zanettos
50,"This place is legendary. The food is just great both in quality and quantity. Actually, the servings were so big that we ended up taking away food for a week. Trust me, it’s tasty and it’s never ending so if you want to try it all, keep that in mind.",Zanettos
50,"Great food, plenty of food, all is food there. Nice place to visit when being in Lefkosia...don't miss it...",Zanettos
30,We were three people and wanted to order meze for two. They said meze is fixed according to number of people and cannot change. So we had to order meze for three that was too much food. Also the food was not as tasty as we had expected.. Good thing they make homemade koumantaria.,Zanettos
50,"Located in the heart of the old city of nicosia. It is the oldest taverna in the city. The old building preserves the tradition and culture of old Cyprus. Serves local and traditional dishes, meze type. Music on weekends. Can accommodate groups and individuals. Can prepare vegetarian meals.",Zanettos
40,"Good meze, rip off tourist prices, extremely small interior but looks very retro inside, if it was bigger it'd be great",Zanettos
50,"I visit the place quite often. Very friendly atmosphere, attentive staff. The food is more than enough, big variety. Alway a lovely experience to visit.",Zanettos
40,"So much food, youll have to be really hungry or 4people.I felt bad i was not able to eat more and they brought more and more food.(i was not aware of the concept, so my fault not the restaurant)Autentisk food and Great service and Great prices, Just not to my taste.",Zanettos
50,"Went on the recommendations of several........ not at all disappointed, well, except that we were beaten and could not manage all the 21 courses - about 5 courses shy of completion!! The food was excellent, service was faultless and atmosphere superb. The place filled quickly, so we are lucky to have gone early....would love to go again when in the area, but will need to starve for a week first....what an outstanding meze.",Zanettos
50,"Cyprus Meze!! the best place, good quality of food and a huge variety of cypriot dishes!! the stuff amazing and really friendly!!",Zanettos
50,"This is the place to go if you want to experience Cypriot food. Book ahead as it is usually packed with people and very lively. They keep bring out meze, until you are fit to burst. Highly recommended, all the food is fresh and very very tasty,",Zanettos
50,"The only thing you have to do is to order what you want to drink!!!! everything else is at zanetos hand..... great dishes, original cyprus cuisine. I count 24 dishes.... Just great!!!!",Zanettos
40,Huge meze selection Liked the service and quality of food Priced above average for such places Felt welcome,Zanettos
50,"It is the perfect place to go for a person who has never tried the Cypriot or Greek cuisine in the past. The meze of Zannettos includes pretty much everything, and in good amount. We were five people and were served enough food to eat twice. The food was well cooked and tasted the way it should. The staff was very friendly and always very close to us and ready to provide what we needed. We were served traditional desert and drinks after the meal, which were also great. The environment in the restaurant was great. It was not a surprise that it was full.",Zanettos
30,"Here you are definitely going to eat a lot and many different small dishes. There are plenty of dishes made of vegetables like green salads of different types, mushrooms, fried zucchini stripes. One can also find dairy dishes, ravioles, grilled halloumi and definitely meat dishes (souvlaki,shieftalia, pork in wine, sausage etc). If you are visiting the place be advised to eat light meals during the day. The food is cooked in the old traditional way which make it a bit heavy. We visit the restaurant once a year just to remind us how it is.",Zanettos
30,"This is typical meze place where you don't order your food but the menu is fixed and you pay per person + drinks.The first time I've visited this place I felt like I was being punished and I had to eat more than I could.When my family visited they wanted to visit zanetos to see what is the fuss about.We were welcomed by the owner with a drop of rose water on our hands. If someone is allergic to rose, like my sister, don't hand your hand!The food they serve is in great quantity but it is very heavy and I don't think they ever even wondered if the dishes match the previous one in any way.First they bring yogurt and some salds, then different types of meat and halumi and at the very end, just before sweet, a huge plate of snails.This place is ideal for those who enjoy eating big quantities but a person who seeks flavours and quality will be disappointed.I don't think I will ever visit again, only if anyone else is visiting us again and insist on going.",Zanettos
50,Propably the best tavern in cyprus i am visiting this tavern for many years and is always perfect... It offers a perfect selection of plates (meze)... The plates nevers stops coming... Only wow can discripe it,Zanettos
50,"What a great quirky restaurant , the food just keeps coming and it is all fantastic. The setting is not fancy but for an experience of old Cyprus with great vast quantities of food , you can’t miss this place , great prices too 👍",Zanettos
50,"If you are going to zanettos make sure to be very very hungry. The diversity of food is great, there are meny options for vegetarians and even vegans (both me and my husband are). For meat eaters, the options are endless. The food is delicious and the atmosphere could not be more authentic. The place goes back for at least two generations. The owner is almost always there with a kind smile to supervise the best quality service. It is the most generous and friendly tavern we've been to to. If you are looking for an experience that you'll never foget, that the place to go!!",Zanettos
40,"This restaurant does one course only: a table full of mezze. A lot of mezze, and really a lot of it! different veggies, fried zucchini, tahini, yoghurt, salad, four kinds of meat, fries, potatoes, rice.. And all of good fresh homemade quality for about 25 euros each. Nice chardonnay from Cyprus.And despite of the comment before this one: it is no waste at all, because they kindly ask you if you want to take the rest home with you, gave us two aluminium boxes and a bag. So we'll have enough lunch and dinner for tomorrow. Well done, Zanettos!",Zanettos
20,"The food was decent but the quantity was irresponsibly out of this world. There was no way you could eat all that food. Too much waste and the owner very strange in his responses to our comments. Nonsense. We asked him to stop bringing more but he just ignored us. House policy he claimed. A total waste, inhumane and disrespectful in so many levels.",Zanettos
50,"Nice restaurant with good food and service , reasonable prices. Traditional cuisine and building in the city center of Nicosia.",Zanettos
30,"A vast variety of typical Cyprus mezedes, generally delicious. This is one of the Old tavernas in Nicosia, located in the Old Town.The place is a but run down and would need more attention to the quality of tableware etc. The staff could compensate, if they were a bit more attentive and polite. The taverna is not bad, but its level not attracting diners.",Zanettos
50,"Bring a huge appetite and plenty of time, probably best to skip or go light on lunch as dish after dish after dish keeps coming. I think there are something like 20+ small plates served with plenty of options for our vegetarian member as well as the omnivores. The host was awesome, the atmosphere local and joyful, loved it!",Zanettos
10,"Horrible place, very nonchalant staff who had ""read the script"" too many times and made me feel like that. Ordered a vegetarian set meal and was very quickly served gloop. There was no love or thought in the way the food had been put together. The feta salad was badly chopped cucumber, tomato and pepper with a large rectangular lump of feta on top, sprinkled with herbs. It was so unappetising for 16euros, I walked out of a restaurant for the first time in my life.Vegetarians and food lovers do not go there!",Zanettos
50,"What a range!! Great quality so one cannot stop overeating. Don't be put off by the outside or the back street location. Go on, eat, eat and eat more. Leave room for dessert!!",Zanettos
50,"This place was recommended to us by our airbnb host. It was great. Food is simple but good, very fresh and huge quantities. You should pace yourself, eat only what you like, and make peace with the fact that you will not eat a good fraction of the food.",Zanettos
40,"We were here the end of january and were the only tourists. We did not reserve but came early and half an hour later the place was crammed. The owner is overwhelming in a very nice way, and so is the food. The amounts are enormous, the quality is good (a nice introduction to Cypriotic food) but the food comes in an unstoppable flood. Even for big eaters like us it is too much but this seems to be normal. Avoid when you are a small or fussy eater, this is not your place. Good local wines. Some dishes were really good ! Sit back and enjoy the ride is the word here. Crazy evening. Nice people, great noisy and very vivid atmosfere. We loved it.",Zanettos
50,"Prepare yourself for an amazing food journey through Cypriot mezze. This place serves nothing else. You pay per guest and its the full deal or nothing. No menu just eating. We got 26 dishes and everything was very well prepared and fresh. Local wines are simple and affordable yet very good company to the mezze food.You start with salads, herbs and skordalia and travel through several grilled meats ,Cypriot sausage and Sheftalia to sauteed snails and even home-made village-style ravioli.If you are not almost full at half of the meal you probably did something wrong. Almost impossible to finish all the food, as they keep bringing your favourites again and again if you with so.Desserts are semolina and pudding based with only a mild sweetness and accompanied by fruit and preserves.Overall friendly and very fast service and very good value for money.",Zanettos
50,"Wow...just the most incredible meze I’ve had the privilege of eating. Very authentic Cypriot food, fresh and delicious., simple and very plentiful. The interior is lovely, it’s like your stepping into someone’s living room. If your in the district of old town Nicosia then you must visit. It’s hidden away in one of the back streets but worth seeking out.",Zanettos
40,"Great variety. Can be an one time experience for visitors. My advise to visitors is to be selective in what they try ,otherwise they will b3 pretty full very quickly without being able to taste the last servings.",Zanettos
50,"The restaurant is located in the heart of old Nicosia, it’s well maintained clean and a happy place to visit. Panayiotis the owner as soon as you sit he will offer church blessed rose water to wash your hands.The food served is excellent traditional Cyprus cuisine and will remind guests their mothers kitchen. Service is curtious and fast and the waiters always tell customers of the food they are serving. Price is also quite reasonable.All in all its a great place to visit.",Zanettos
20,"Who can eat so much food? It’s a shameful waste! Moreover, the food is not good. I am disappointed and don’t understand why there are many people dining here. (Only one set menu, €21, which is not expensive.)",Zanettos
30,The atmosphere is traditional for a cyprus tavern/ restaurant The staff is very polite and friendly The service is excellent The food is of good quality and the quantity is well above average Unfortunately it is overpriced,Zanettos
30,"One of the oldest tavern in Nicosia old city with traditional character...small place so i recommended reservation. Here you try the traditional meze plates so, especially for tourists who say near the old town is ideal. Is located in the cozy streets of old city and you can reach it on foot if you stayed in the area.",Zanettos
40,"Popular Cyprus food restaurant, popular for many years now. Cozy small place, traditional menu and good flavors.",Zanettos
50,"Zanettos is relatively unassuming, tucked away in a quiet street in the old town, but with a warm welcome and an intimate atmosphere, dominated by knickknacks and hundreds of photos of previous guests. The food is great, served in abundance, just when you think you cannot eat any more, yet more arrives, looking so attractive that you have to just keep tucking in. Fantastic for a group looking for a great evening out.",Zanettos
20,"Ok so the deal was to enjoy a traditional mezze in one of the oldest restaurants in Nicosia. There are pictures of celebrities that ate here. From the get go, the owner told us that we have to pay mezze for each person which was a bit unfair because half of our party would not be able to eat huge amounts. But I guess he wanted to make sure that each one of us will fork out the 20 euros. And at 11 persons that would make a nice sum. Of course the 20 euros does not include any drinks!The food was disappointing. Rice was flavorless so were the mushrooms. And the snails were soaked in a tomato sauce totally disgusting. I do not recommend this place as it is way overpriced for the quality it offers.",Zanettos
20,They put way too much food on the table and we asked them to stop then because we all felt bad about not finishing it and throwing it then away but they wouldn‘t accept it gave us more and more and we always send it back. We did not really like the food as well. We‘ve had better Mezze‘s in the past. Really disappointing!,Zanettos
40,"A typical taverna environment with a rich menu and quality food. A cosy place with friendly service and smiling people, whether customers or staff. Recommended for those who want to eat well and to eat a lot!",Zanettos
50,"Great variety of Cypriot cuisine meze type . Very delicious food , good service and traditional set up",Zanettos
50,A well known place situated in the old city of Nicosia with very good traditional food. A place that I always propose to my foreign friends and be sure that they will certainly appreciate my recommendation.,Zanettos
50,Local friends in Nicosia took us to this restaurant which has been operating for years I think I counted about 30 dishes which were delicious. Bookings are advised as it is very popular,Zanettos
50,"A friend who is Cypriot recommended Zanettos for dinner on a recent trip to Nicosia and we were certainly well advised.It took a little finding and from the outside is certainly very unassuming and without the recommendation we might have just passed it by.Once inside the welcome was warm and the food offering explained. There is no menu, just a set meal but the food just keeps on coming and coming and coming. The dishes are varied and represent traditional Cypriot cooking. I didn't count but afterwards we decided we had been offered in excess of twenty dishes, all delicious and interesting and so good in terms of cooking and quality that we were struggling to eat them all but couldn't resist them.The pricing for food quality, quantity and standard of service was at the low end of expectation.I recommend this place without reservation but maybe skip lunch on the day you plan to go, we skipped breakfast and lunch the following day too!",Zanettos
50,"This is a Cypriot Meze restaurant, and a very good one at that! The food is extremely generous: very large variety. Dishes just keep coming. The atmosphere is very nice. One of the oldest Tavernas in Central Nicosia. It has character!",Zanettos
50,Nice place to go with family or friends or even colleagues. The food is just great and the quantity just right.,Zanettos
50,everything are perfect excellent food and service. better go there with empty stomach :) very nice quality of the food I very good price,Zanettos
50,This restaurant is located in the old part of Nicosia. Great meat Meze. Prepare yourself to eat a lot!,Zanettos
40,One of the best places in old nicosia town to eat cyprus meze Traditional environment and plenty of cyprus dishes to taste,Zanettos
50,"If you want to enjoy meze go to Zanettos restaurant, in the old part of the city Nicosia. The street in front of the restaurant sais nothing what you can expect inside. The more positive view was inside where you can see a lot of tables. We came relatively early in the evening and we can choose our table on the open air. When leaving - the restaurant was full of guests. We didn't count the number of the courses but I think it was more than 15 fort the price 25 EUR each. The dishes were very tasty and we had enjoyed our dinner here.Josef Koc, Czech republic",Zanettos
50,"Zanettos offers a fixed meze menu with too many courses to count. My wife and I went as a couple, and they brought us enough food for easily 4 people. Pace yourself to enjoy all of the flavors, and don't feel guilty not finishing the early plates! Otherwise you won't have room for the later dishes. Some excellent and unusual items were included that we didn't see other meze places. My favorite of those were the snails served in shell.",Zanettos
40,"In nowdays it is dificult to find good Cyprian food in Nicosia. Even is located in the old city does not have "" tourist food "". In my opinion the quality is very good, all the plates are very taste and the price are very reasonable. For sure I will be visit it again.",Zanettos
40,"This is a truly remarkable place. As the friendly owner explains, there is no real menu. They just bring you a variety of local dishes, many of them quite tasty. What makes it exceptional is the extraordinary quantity being offered. Most travellers are familiar with the formula that you pay a fixed sum and may eat as much as you want. In this case they continue bringing it to your table until you firmly tell them to stop. The price would be very reasonable even if the dishes came in standard quantity.",Zanettos
50,"A loud, friendly and interesting place to eat. We were a couple but I would still recommend it. No menu; the food just starts arriving and keeps arriving until you ask them to stop. We loved it",Zanettos
50,"This restaurant offers excellent meze, friendly service and a relaxed vibe. It is one of the best places in Nicosia serving local dishes.",Zanettos
50,"Went on a Friday night at 9.30 pm which is early as we were the first ones there. It's in the old part of Nicosia and it's got the old feel to it which is great. Owner met & greeted us and ensured we were looked after the whole night, typical Cypriot hospitality. Seating seemed a bit tight but added to the cosiness. Wall are covered with pictures of celebrities that have visited which shows what a great landmark this place is.Food is mainly mezedes which comes in big volumes and tastes very traditional so go hungry.Will definitely visit again",Zanettos
50,"It would be easy to pass by this place and miss it, with its little entrance door... and that would be a mistake. This place serves delicious local dishes one after the other, continuously, and in abundance, until you are so full that you give up. Very friendly service staff. Get a table in the rear courtyard in summer for an even better experience.",Zanettos
50,"A difficult place to find, but the locals all seem to swear by it, and for good reason. The only choice is meze, and they keep on bringing entirely too much food. I was there with two others, and we would have needed at least another three more to have any chance to finish everything. They bring everything from a gigantic Greek salad, to fried zucchini, to snails, to liver, to sausages, to chicken and pork souvlaki, to all sorts of other dishes. Each is delicious, and you feel bad that you're not finishing everything, but as soon as the Greek salad shows up (right at the beginning), you know that you shouldn't even try. I'm told that you'll generally need a reservation (we went on a Monday night and it was pretty full). Pretty sure I won't have to eat tomorrow until dinner, and yet dinner and a half pint bottle of zivania was a bit over 27 Euro per person.",Zanettos
50,"I dined with a buisiness associate who is Greek Large place, very warm attmosohere Good vegeterian options The amount of food we were served was incredible. We had to leave two thirs of it on the table",Zanettos
50,"We reserved a table of 5 earlier that day. It was a Thursday so we didn't expected it to be that busy. I have to say the meze there isn't the cheapest on the island priced at 21€, but it is MORE THAN WORTH IT! If you happen to be in the island either visiting or whatever, you have to take the opportunity and go to Zanettos. It has a unique style that really reflects the Cypriot hospitality. Food had very good taste and the drinks range from wine to beer to spirits. The food just keeps coming, not to mention the sweets ranging from cypriot sweets like syruped walnuts to lebanese mahalepi. I will defenately visit again!!",Zanettos
50,"My visit to Zanettos came as a suggestion from a friend and it was the best recommendation that I have had in a long time. Zanettos is a traditional Cypriot serving a huge range of 26 Meze dishes to the table that are guaranteed to make you leave full and satisfied.I was greeted well by staff that spoke good English and despite being rather busy they attended the table to ensure that nothing more could be done to make the visit worthwhile. Personally I couldn't eat everything but was not disappointed as there was so much food - the desert came as a surprise that I hadn't accounted for but I managed to eatVisit this place no matter what you are in Nicosia for, whether you are alone, with work colleagues or with family and friends. Proper Cypriot food in a relaxed and traditional the restaurant - at a great price",Zanettos
50,"We happily managed to secure a table without a reservation and were warmly welcomed by the host/owner. As stated below the menu is fixed consisting of circa 20 generous dishes so if you didn't like one or two there really is no great loss. Personally I liked them all! The house wine was delicious as well. The price was very reasonable for such an experience and I would love to go back again. But will book next time! Oh and allow a lot of time the is an experience to linger over and relish, best eaten slowly :-)",Zanettos
50,"I was fortunate to be part of a group of about 20 who were booked into Zanettos in early March 2018 for an evening dinner - more accurately described as a feast. Course after course arrived, delicious Cypriot food, washed down with beer, wine and local version of raki. Totally stuffed and well-watered, don’t arrive having already had a snack.Staff were welcoming, the atmosphere rustic but that’s part of the charm. It’s not an elegant place for fine dining in a tuxedo but the best meal I’ve had so far when visiting Cyprus. Very much recommended.",Zanettos
50,A very traditional Cypriot experience. Fixed menu of 20 different dishes. Very friendly staff. value for money. They bring out dessert and fruit at the end. Really a lot of food so better go hungry.,Zanettos
40,If you are in group you cannot miss the meze in Zanettos restaurant. It is an experience everybody must do once in a life :),Zanettos
50,Serious eating but you have to be prepared! Go only if you are hungry as the choice and quantity are over any limits. The place is excellent - food is unbelievable with great cypriot kitchen and the staff is so friendly and nice. Highly recommended for people that can handle a significant dinner.,Zanettos
40,"Ok you want an authentic Cypriot meal experience and you like meat (repeat like meat) then you have to come here.Tavern is full everyday and the rich and famous Cypriots and non Cypriots come here.The owner is hands on and his team are friendly.The food was authentic, tasted great and oh my they are generous.If you want a quiet restaurant then this isn’t your place and if you want vegetarian yes they have a lot of options but this isn’t why they are famous.We had a meze and even though were 5 of us it could have served 10 easily.It’s great for groups up to 10 may struggle beyond that but who knows.",Zanettos
50,"10 of us decided to go back for another visit to see if we could get any closer to actually finishing the food laid out in front of us.We had starved ourselves that day and approached the task full of excitement and trepidation.Yet again we were taken down by the vast amounts of delicious local food. Even our hostess told us not to eat the bread before walking away laughing.We tried and failed again so that means we just need to keep going back.If you are hungry this place is a must. Great place, staff, food and drink.",Zanettos
