r_points,r_text,place
30,"Heard about it a lot!couldn't wait to visit!But when I finally got there with a company of around ten people,we were all very disappointed!The food was average with some of the meat dishes not chewable!was like rubber!Service was good but i think they were a little stressed and made a few mistakes!the worst part was the Bill!23 euros per person,drinks excluded!i don't think i would recommend it!there are much better places with better prices and food quality!",Zanettos
50,"The owner is very friendly, they have a nice selection of wines and you have to be starved to death in order to eat all the great food they serve.",Zanettos
50,There is no menu and they just keep bringing the food. It was copious and absolutely delicious! The restaurant has been around for 72 years and it is filled with character. It was one of our best meals in Cyprus. Definitely a redo and definitely recommened.,Zanettos
50,What a findWe had the Meze with every form of meat you could think of done on a Char Grill/BBQLamb Chicken Sausage Pork Beef Vegetables Salad Bread all washed down with the fine Local Beer (Name escapes me) and of course Ouzo You won't be disappointed here!,Zanettos
50,Service very quick! Food was amazing! A lot of food! And the prices very good for the food the bring! Thoroughly recommend!!!!,Zanettos
50,Portions are always huge and the service always great! Loving visiting this tavern over and over again. Good quality. A classic tavern in Nicosia old town.,Zanettos
50,"It is placed at the central of Nicosia and it is well known to allmost all the people of Nicosia. As soon asyou enter the place the owner wellcomes you with an old traditional Cyprus way. He puts on your hands rosewater and with a bright smile shows you. to your seat. Then you have to order what you like to drink. The rest food comes with the drinks. In Cyprus we call this food mezes. This means many little plates with splendid food. First here comes the ordeves. Taxini , olives, tzatziki, taramas, e.t.c. After these all , you can have different cyprus way cooked meats. There is souvla , ( pork meat cooked over fire like barbeque), kebab and sieftalia ( small parts of pork cooked over fire and mincemeat rolled in special way, very delicious. Also, you can have chichen , lamp, and beef meat all cooked in cyprus traditional way. You get sausages , beetroots with vivegar, fetta, chips with fresh potatoes, pasta with halloumi ( special cheese ) and many more plates with yammy food. The place is decorated. In old , traditional way with many things that reminds us old Cyprus",Zanettos
40,"I have been to this restaurant numerous times with friends. It's the best mezze I've had in Cyprus. Staff are friendly and helpful. We were really lucky going one night in summer and lucked into a half price special on drinks so it was a really inexpensive night. The only dish I wouldn't try was the snails! I don't like them. There is an assortment of vegetarian dishes within the mezze but there is a lot of meat. All of us felt like we needed a wheel barrow to get home in, we ate so much!",Zanettos
30,"Good food but not my kind of atmosphere. I think the are trying to create that ""traditional"" look but it seems a bit ""cheap"" in side..",Zanettos
40,"went there by indication of a person living in Nicosia otherwise would be hard to find it. the restaurant has a nice with tradicional decoration and lots of photos on the walls giving a cosy familiar atmosphere.The menu only has one choice and that is the abundant meze. Dishes of food start to arrive almost immediately and they are so many that we cannot keep up tasting a bit of each, and cannot even think of finishing them. By the middle of the meal we realise that the stomach is so full that it cannot take more, but then so many other dishes and akso a few deserts will come and you still fit in a bit more of each just to taste. The food is in general well condimented but not too much and seems to give an all round picture of cypriotic food. Prices are a bit above other restaurants but it is within ok prices, especially considering the amounts.",Zanettos
30,"Food is good, though expensive compared to other reputable mezze places. The place is packed with small groups 8 to 12 diners, very noisy Thursdays, Fri and Sat nights. A bit uncomfortable seating and ok service. Perhaps a good place if you are in the old city, but not worth the trip if you go there specifically to eat there. Overall I would not recommend it.",Zanettos
50,"This lovely restaurant was recommending by our Segway Tour Guide, as we stipulated that we wanted traditional Cypriot food, not tourist restaurant. Oh boy did this place deliver. There is no menu as they only serve Meze. The Staff are just lovely, making you feel so welcome. The food was just amazing, dish after delicious dish just kept coming. It was all fresh and tasty. Just be hungry and enjoy at your leisure.",Zanettos
40,"Friendly staff, good quality food and endless quantities. One of its major advantages is that it is open till late when most of the other restaurants are closed. Very popular among VIPs. If you are in the old city it worths a try. When you are there try ""mezedes""... But better be very hungry",Zanettos
50,"Warm, friendly atmosphere. Fantastic food. A Cypriot experience we will long remember. And free WiFi on top of it all.",Zanettos
50,"It was a fund evening out with friends...loved the athmospere, and the food...meat all along...would love to have another go..next trip to cyprus",Zanettos
50,"A Nicosia institution for several decades we went on the basis of a not altogether trusted guidebook review. There is no menu, you just get dish after dish of every meze variation you can think of. It gets crowded later but is not impossible to get in at all. The trick is to pace yourself; just when you think you're sated a whole pile of freshly cooked meat or vegetable dishes arrives. Perhaps fewer fish dishes than expected but it would be churlish to complain. Plainly served and not superficially stylish this is a Nicosia restaurant in which to get thoroughly well fed with fresh and well cooked food. Not at all expensive for what you get.",Zanettos
50,"this is a simple tavern with nice atmosphere and food, there is an indoor garden as well, people are friendly and the food very tasty, local dishes, seasonal and meze!",Zanettos
30,"Our attitude in Cyprus is that when we establish our name we forget about those who helped us.This is what you convey when you impose your clients what they have to order, and we are not talking about a minimum of two meze which is common in many restaurants in Cyprus.I gave you the opportunity, because it was my birthday, to prove that you have this attitude because you are the best. But you are not.Bad service, they spilled everything on two tables and on women's clothes.Medium quality souvlakia & sheftalia. No lamp chops, no pastourma.And at the end, instead of giving a discount due to the bad service that cost an expensive blouse, they gave discount vouchers for next time. I hope you understand, there won't be a next time.You need to think of your client policy, especially at times like the present one in Cyprus.",Zanettos
30,"Terrible hangover, this place used to be our favourite for years, the last two years its been terrible and heavily commercialised. Won't go there again.",Zanettos
50,"It is a fixed menu and the food just keeps coming and coming. Service was excellent. we chose a local rose wine and it was good. We tend to eat early, like 1930, so there was only one other couple there at first. The place filled up after about 2030. The wait staff really were running, but service still was maintained. Very reasonably priced. We were there on a Friday evening about 2 weeks ago. Definitely add this to your bucket list for Nicosia.",Zanettos
50,"All the Cyprus specialities in one place, really great food which comes all the time, very friendly service, value for money for all this... True hospitality!!",Zanettos
50,Real cypriot traditional food. Fantastic atmosphere and traditional dishes. Do not miss when you visit Nicosia. Strongly suggested...,Zanettos
50,"A Must place to visit when you are in Nicosia. Friendly staff, traditional atmosphere and the most important ... the Food ! Best meze ever ... you must try those meze at any cost ... 5 stars !",Zanettos
30,This place is hard to find if you don't know about it. The place itself says nothing but the food is great. Many personalities have been there too and you see it in the pictures. Very friendly people and cosy atmosphere. Will go back.,Zanettos
50,"Zanettos is the Best Meze food in Cyprus. Highly recommended , if you visit Cyprus you should give it a try",Zanettos
50,My local office contact took me here and the food was excellent! This restaurant has been around for a very long time. It's a favorite spot of celebrities & politicians in Cyprus. Their pictures cover the wall.We had the mezze and everything was outstanding. I would definitely go back!,Zanettos
50,"Well, after frequenting for more than 80 times to this excellent Cyprus Tavern the first great impressions on the very friendly atmosphere and the huge quantity of super food and, the initial wows were somewhat diminished. It seems one can get used to anything!!!",Zanettos
50,"I came here with friends on a Saturday night. The mezze was extraudinary it came with all the usual meat and sausages along with some vegetable dishes I hadn't come accross before, all of which very tasty! Service was good, simple decoration, entertaining photographs throughout the place. Would reccomend!",Zanettos
50,"If there is only one restaurant you visit whilst in Nicosia, make it Zanettos! I cannot recommend it enough. The food was of highest quality and the service 5 star!! The owner was lovely and took the time to come over & join us, as well as giving a nice souvenir to remember the evening. The whole dining experience was fantastic, and you most certainly wont leave hungry!!",Zanettos
50,"Very good, very friendly, really nice traditional restaurant. If you go to Nicosia, go there! Not easy to find, I come back for sure;-))",Zanettos
50,"Really, the rest of the ""excellent"" ratings sum it up: fantastic food, great atmosphere, wonderful staff It's really a beautiful tavern. Must see place. Enjoy",Zanettos
50,It is difficult for locals to find a good Cypriot tavern that will satisfy their demanding taste. Zanettos managed to achieve that by offering good quality food (lots of it!) and a great service in a fantastic place full of history. The owner/manager is very attentive of his customers as are the waiters. I would recommend this tavern without any hesitation.,Zanettos
40,"We visited the restaurant for traditional Cypriot food. It was all delicious however the wait staff were not very attentive , opting to circle a large family table. We may have been unlucky but felt very second best to the local table who were eating.Good food but prepare to be treat like the tourist!",Zanettos
50,"We went to the tavern for the first time last Saturday, Being a couple we had no choice but to order meze for 2. The food quanityt is overwhelming. So many different dishes full of different tastes from Cyprus.The meze dishes are really big. One village sausage for each person, two large pieces of halloumi white cheese, a bowl full of liver, a sealed yoghurt pot, big bowls of dips(not the usual small plates being half full), a large variety of chicken and pork souvlaki along with shieftalia and many many more dishes.As expected we left half of the food on the table. We had seen that a huge variety of desserts was expecting us. A plate of fruit, lebanese mahalepi cream, halva, traditional sweets from Cyprus and coffee was offered to us free of charge.And above all service was excellent as well as the ambiance and the whole environment.The tavern has a separated place for smokers which is clearly ""sealed"" therefore no cigarette smell will annoy any non-smokers. My wife is pregnant so i had clarified that over the phone and we were glad that this was the case when we got there.The price is a bit high per person in comparison to other meze taverns. But believe me there is nothing to be compared in regards to the food quality and quantity.I will definately go back with friends and family and i highly recommend the place to locals or visitors.",Zanettos
50,"Meat is juicy and tender, great selection and traditional food that makes this taverna the best in town.However be warned make sure you skip bfast,lunch and snacks before visiting. My favorite are the deep fried courgettes, sheftalia, smoked wine sausages and ravioli!",Zanettos
40,"Tavern worths a visit - Quality food, fresh ingredients, respect to customers, staff politeness and care.",Zanettos
30,"Went there for dinner with professional company from abroad. The food was nice and plenty. The service was pleasant and good! The place does remind of old times. However we found the prices a bit high for the setting and type of meze. It was 40 Euro per person for meze, simple drinks and desert.",Zanettos
50,"On a business trip to Cyprus, I asked my Cypriot colleague to take me for a typical Cypriot meal - he took me to Zanettos.As everyone has already said - the dishes kept coming and coming - I think there are about 20 in all. Luckily my colleague had advised me to just taste each dish rather than fill up on the first few selections. Each dish was freshly and beautifully made with fabulous flavours.Although I didn't even make a dent in the food offered, I tasted each dish.This is an absolute essential experience for anyone visiting Cyprus and wanting to experience the real thing. One thing I would say is that we ate early about 7.30pm but as we were leaving it did start to get VERY busy.",Zanettos
50,"My friend Stavros introduced me to this restaurant. Plate after plate kept coming every one as tasty as the last, my husband is vegetarian and he could not believe the tasty treats that came out of the kitchen. The seafood was wonderful. Every dish was a mouth watering experience. The staff were wonderful, the food is worth a trip to Cyprus for, I will most certainly be returning.I do have one compliant, I can no longer fit into my clothes, the wonderful stretched my waiste line.I encourage anyone to try this mouth watering experience, 100% satisfied.",Zanettos
50,"This eating experience is the real thing! Zanettos has been in Nicosia since 1938 and it's still going strong. I would rate it as an essential experience for anyone who wants to know what ""meze"" is really all about. There is no Menu as such - just a lot of delicious dishes brought one after another, in what is considered the right order, until you are truly fit to bust - and then they bring some more! Go prepared for a long evening, with a group of friends, and just relax and enjoy the whole experience. It looks like nothing from the outside, but that appearance is certainly deceptive. Not to be missed, if you're ever in Nicosia!",Zanettos
40,"We decided to try another tavern while in Nicosia (usually we go to Engomi)So we tried the mezze at ZanettosIt's very very good (and even too much, which is a pity)We loved it and we'll return when we'll be back in Nicosia, for sureNice food , wine and serviceMerci beaucoupThanks to the chief and all the staff(maybe could you propose ""mini"" mezzes, with less items, cheaper, and people should be able to finish !!)Our dinertuesday 22nd oct",Zanettos
50,"As others have said, the entrance to this restaurant is deceptive. It opens out into quite a large area but still gets very crowded. The challenge with the meze is to keep bringing food (which was all delicious) until you can't possibly eat anything else and then still try to entice you with something like the odd snail or two! It's not the sort of place you would probably just come across in wandering round the streets of the old town but it's really worth seeking out. They will package up whatever you don't eat and the remains might keep you going for the rest of the week. Not cheap but very good value.",Zanettos
40,"Don't be fooled by the front of the restaurant. A small opening, but this restaurant, in the heart of the old town, has a great meat meze. Similar to Spanish tapas, a meat or fish meze is typical for Cyprus.Once inside, there's more space than you'd initially think there is. The food is of excellent quality AND taste. Very friendly service and a great patio at the back. A simple restaurant with great food.",Zanettos
50,Liked everything from the food to the price. Went with friends one night and brought other friends the following night,Zanettos
40,"A group of us, including guests from out-of-town, headed to Zanettos on a Friday night. At 9pm it was half full, but soon it was packed - proof that the quality (and unfortunately prices) have remained up to the usual high standards. As usual, the owner was milling around, making sure the guests were entertained and happy. There was a big time gap half way throught he meal, and the guests were not prepared for ""round 2"". No-one was able to finish things off, and it seemed sucha waste! We washed down the meze with an excellent xynisteri from the Zambartas winery. Overall a great night out.",Zanettos
50,"Fantastic plentiful food. Excellent service. The very reasonable price includes sweet, fruit and desert with coffee. Do not miss but go hungry. Also nice little touches like rosé water hand rinse on arrival to welcome you. Note that the default assumption is that you a re having a mezze, this is not an a la carte restaurant but a very authentic Cypriot mezzo taverna.",Zanettos
40,"When I came to Zanettos I was surprised that there is no regular menu. Instead of that you 'll get a list of food which will be server for you for 20Euro/person (+drinks). As there is a lot to try (you'll get over a dozen different dishes) don'teat much at the beginning because your food will came for over half an hour, every time something different. And after you are full and you start to beg waiters to stop coming with new plates you must be aware that there are also deserts (yes, plural) after you stop eating main courses :)You will more roll out of the restaurant instead of go out :)Food is very good but it's to much. Don't go there if you are not hungry and you want to get only small salad.",Zanettos
40,"We found it in the middle of the old town, very difficult to find a parking space, we arrived around 8pm and the place was nearly empty, but it soon filled up and became very lively and eventually we realised why, they serve the finest Cyprus mezze and the food was tasty and just kept coming, the chef came out of the kitchen and asked if we wanted more, excellent.",Zanettos
40,"really good greek tabern with very friendly owner. We had ""messe"" which means everything possible including wine etc for reasonable price.The pita bread is magnific with all sorts of tajine, tzaziki, rice with spinach, grill meat (all varieties) but on top of everything what i like the most was the haloumi. Normally it is rather salty but here it melted in my mouth.Great atmosphere and good value for food",Zanettos
50,"I have been to this taverna 3 times, and the food is amazing and great value for money. You have to try their house wine which is the best! Staff are friendly and I will always go back.",Zanettos
20,"We went there after we heard that it is one of the best cypriot taverns.. The food is very good indeed but the yard that we had to sit have big walls and it is quite hot, especially during the summer. We were 4 people and one of the girls wasnt hungry so we decided to order 3 meze. However they said that we couldnt do that which is unacceptable!!!!!!! Meze is 21 euro per person which is quite expensive also. there are plenty -just as good places - much cheaper than Zanettos where you could actually order depending on how hungry you are! We will never go back to this tavern for sure!",Zanettos
50,"great dishesvery good servicepanagiotis and the stuff are great and very friendly, the food is very goodthe spot of the town is very good and for sure u will fell happy leaving this placetry the spanakorizo , karaolous and dont miss for desert the mahallepithere are some great wines from cyprus and greeceat the end try cyprus coffe",Zanettos
50,I had a dinner with fantastic fresh local food.Prices are really low compared the number of plates offered. Local Wine eccellent. Service meticoulus. Nice experience.,Zanettos
50,"Zanettos tavern, under Panagiotis Mentzis direction, is a typical authentic cyprian tavern in the Nicosia city center. It is the second time we visited Cyprus and Zanettos is our loved place to taste the local cuisine. Friendly, fast and happy staff. Special ""meze"" dishes, that are served in a certain dish flow, as you do not have to order them. It is true that food is too much! It was a pity that we were not able to handle with all that delicious food... Have a look at the kitchen, through the open door, and you will realize yourself the quality and freshness of the food and the fair preparation.",Zanettos
40,"Is a typical Cyprus Tavern, located in the old part of Nicosia near Archbishop's Palace and omerie hamam.Usualy crowded, especially on Fridays and Saturdays, noisy as mostly preffered by Cypriots, with good Cyprus Meze plenty and in good prices.It's better to make a reservation, before and be sure that you are really hungry.Is ideal for families.",Zanettos
40,A traditional tavern located in the old city of Nicosia and offers a variety of authentic dishes from Cyprus. We visited Zanettos twice and both nights it was almost full.Dishes are delicious but there is so … so much …food !!!I am sure you can’t eat everything even though you are really starving.Décor is very interesting and the staff very friendly. Reasonable prices. It is place you must visit once you are in NICOSIA,Zanettos
50,"On arrival I joined Owner Pete at a table opposite the restaurant. Arriving early, we connected, shared a glass of Commanderia, discussed Meze (his speciality), MBA's (we are both qualified), teased each other mercilessly over our smartphones (his Samsung) and mine (iPhone 5). I lost and had to make coffee. I the instructed him to cook dinner and take photos with his phone. Dinner was excellent. Still waiting for the photos, Pete. ;-)",Zanettos
40,This place is located in the old city of Nicosia and offers authentic meze. It is worth coming here if you want to try traditional Cypriot food and if you want to see a bit of the old town. Prices are average but the food keeps on coming!,Zanettos
40,"Very good cousine,reasonable prices,four meze with ,bottle of wine ,deserts about 110 euros, Many dishes you must go hungry no good as expected by the reviews but to be honest very good quality. Nice polite service. Recommended...",Zanettos
50,"I have been going to Zanettos for years and make a point of taking any guests and visitors I have there at least once, be it friends, family or colleagues.It's very simple. Book early, go hungry and make an evening out of it because a quick meal this is not. There is no menu (that I know of), just meze, and it will never end. Seriously. Service is friendly and reasonably fast (we are in the Med after all), the place itself is cozy and I have never been disappointed. Last time I was there with a group of 20 people, and everything went as smoothly as it has gone when visiting with a lot smaller groups.To be fair the food is not extraordinary, but it is very good and consistent. There is so much of too that even if you are a veggie or do not eat pork, you will still have plenty to eat. A must experience in Nicosia.",Zanettos
50,"Is by far the best place for Local Cypriot cuisin in Nicossia.... Is so famous that you can not miss it. Although it may look small on the outside the place is roomy and has a nice back yard. TOP chefs offer great treats of the local cuisine at good prices. Try the Mezedes, where a course of 20 (!!!!!) dishes will make you more than full. Ther is nothing to be said for the dishes but to describe them as the epitomi of the local cuisne. The wall are full of celebrities posing with the chef, from greek singers to almost all the tv stars..DO NOT MISS",Zanettos
50,food is great with a variety of dishes and service is good. Great value for money and is one of the places that none will be dissapointed,Zanettos
40,"One should go hungry to this place, as the series of plates arriving at your table seems to have no end. Do not eat too much in the first dishes, or the pitta with dips, so there is space for the later dishes, including ravioli with halloumi cheese, snails with onions, loukaniko (cypriot sausage), sheftalia (pork meatballs) and several other cypriot delicacies. Service is usually ok, but this restaurant can get very busy and loud, and there is a tendency to put tables very near each other. People also smoke in the terrace, where you may end up sitting, so bear that in mind.",Zanettos
40,"I was taken here by a local, and, well, wow. Like every other review, let me warn you about the quantity of food. It's nuts. I understand that the culture is different -- if you cleaned your plate, they didn't do their job -- but that can be a hard habit to break. The food was overall good quality. Some of the items were a little greasy, but that could have just been my stomach after several days of living high on the hog.",Zanettos
