r_points,r_text,place
50,"Zanettos Tavern has been around for almost 8 decades (meaning something must be going right in the kitchen)The flavours which come out of the kitchen are all equivalent to the aromas which follow before it. It is a busy establishment with hardly any vacancies for “walk-ins” so a reservation is always a proper way to create your first experience. The prices are properly sufficient to the quantity of food it supplies. In fact SO much food follows (when you order the “meze” option) that most people are usually stuffed from the starters alone! I’ve heard people, and seen it with my own eyes, requesting to stop bringing the food because they cannot eat anymore.",Zanettos
40,"Large range of meze.Food is very good.Not representative of the Cypriot nor the Greek cuisine. It walks the line between the two cuisines. Touches, colours, tastes and smells of both.Clean establishment.Neither cheap nor expensive.Extremely crowded on Friday and Saturday nights.Don't risk going without a reservation.",Zanettos
50,"Amazing place, where you can enjoy every type of Cyprus food in portions (called ""mezedes"").. Great food and dessert options..",Zanettos
50,"If you visit Zanettos, it's hardly by chance. Most likely you have read about it, and you are willing to accept their ""meze overkill"" challenge.Eating here feels like going on a journey through the cypriot cuisine, from the starters to the dessert. Just like any other travel, there will be moments to treasure, moments that you will forget and moments when you'll feel that you just can't possibly go on.The service is friendly and the place is pleasant (but we visited it during the low season). Our journey was rewarding and definitely low-cost. An experience you will tell about once you are back to your country.",Zanettos
50,A great way to experience a variety of Cypriot dishes. Very large portions and very tasty. Seems like reservations are needed at least on the weekends. I was able to get within without a reservation by going early and promising not to take too long. Make sure to save room for dessert!,Zanettos
50,"The owner told us right away that there is no menu and no optionsJust an endless stream of small to medium platesThe variety is so big that anyone can find plenty to eat even if you are not crazy about snails :)Not a good place for vegetarians as many of the dishes are various types of meat.Although we didn't see a menu or knew the price , the bill was very reasonableCome hungry and take your time",Zanettos
40,"The restaurant is extremely popular judging by the number of people in there the night I went. The place was packed. We had the set Meze. The food was very good and I lost count of the number of dishes served, they just kept coming. We all had our fll and there was plenty left when we had finished. Staff were fine, pleasant.",Zanettos
10,Quantity but not quality. The owner is very rude same as his employees. The food is bad and the place is loud. Avoid!,Zanettos
50,"food was great,atmosphere excellent,staff very friendly.plates for Cypriot meze were huge but very good.got to be very hungry.",Zanettos
40,"Our business partners invited us to Zanettos to experience some traditional cousine.All the food we got on the table was very good and particular, the final quantity was unbelieveable. In 4 we could barely eat half of what we got.The food is very good, the service is excellent. Its a busy and noisy restaurant so if you want to have some quiet time this is not the place to be.Overall amazin experience, the owner of the restaurant is a great person. Only comment is that the chairs are not too comfortable.Highly reccomend!",Zanettos
50,"Usually, a lot of people are commenting on a restaurant that his quantity is not good but the quality is great, Or that its quantity is big but the quality is low.Well thankfully in Zanettos, The quality is Fantastic and the quantity is more than enough.The owner is very friendly and funny, the service is very fast and helpful as they explain what each dish is.The location is great because it's not near a busy street and the atmosphere of the tavern is so cozy and it's like you are at a home family dinner.For sure try the sweets that come at the end.",Zanettos
40,"Nice tastes, but be prepared that the number of dishes served is very high, and this is the standard no need to order anything specifically. So better have time to digest after!",Zanettos
40,i have been going to Zanettos Restaurant/Tavern for many years. Great food Reasonable prices great atmosphere one of my favourites in Nicosia,Zanettos
40,"Nice cozy place. Good food, good & friendly service & value for money. The wines are kept a a very reasonable price, that is a big plus.",Zanettos
50,"Picturesque but authentic restoring where you must do nothing but sitting, waiting for the courses and... eat in the typical ""meze"" style! The most of the courses are delicious. Only one upsetting surprise: the χωριάτικη (the Greek salad) in Cyprus don't foresee onions! Unbelievable",Zanettos
50,"We wandered in not knowing anything about Zanettos and we’re instantly captivated by the charm and hospitality. Then the food came. It was the best Mediterranean meal I’ve ever had the pleasure of experiencing, and for an astoundingly low price.",Zanettos
40,"Good food but the meze is expensive. The staff was very friendly, the owner is very friendly and makes you feel welcome. The service was very good. The food was tasty.",Zanettos
10,"The positiveA. the atmosphereB. the ownerC. the decorationThe negativeA. The policy that everybody who is there gets to eat and pay.B. The foodAnalysisThe Positive:The setting is very nice, in the old town, inside the walls, usually full house, with a very welcoming owner and nice decoration that reminds more of an Athenian tavern than a Cypriot one. Photos of the owner with famous people who ate there is the main decoration theme.The Negative:A. The policy that everybody who sits there has to get the meze for 21 euro, even if they don't feel like eating an ox. The result of that is that you end up with food for 2 more days to be taken with you back home.B. The food is average to below average for a restaurant and I will go to all items one by one. Photos are provided for everything I mention here.1. Salat is pre-cut and the vegetables are not in prime condition. Tomatoes for example lost their texture and there were only good for stew. 3/102. Toasted bread with herbs and olive oil was nice and fresh. 7/103. Yoghurt was of a good quality 8/104. Beetroots were as expected plain probably bought in a container. 6/105. Skordalia had a very bad texture. The potatoes were not fully mashed and some of them were not fully cooked. It is an easy dish and there are no excuses for making it like that. Also there was a lot of water in it for the amount of potatoes and garlic. 3/106. Pitta bread was the average supermarket quality lightly toasted. Nothing special 6/107. Toasted Halloumi was again from the average quality you can buy from the supermarket cheap made from cow and powder milk. Cooked ok 5/108. The sausage was not the village type with red local wine and herbs. Mass production stuff from one of the main factories in Cyprus cooked on charcoal. 5/109. Ribs in wine. Now that was precooked and served to us after heated. All juices were out and if it wasn't for the fat, the thing would have been totally dry. It felt like I was eating yesterday’s food. 3/1010. Fried liver. Again pre-fried and reheated with no succulent juices. Texture was dry and almost cold inside. 3/1011. Spanakorizo (spinach risotto). Same mistake again here with precooked stuff. the rice got very soft and gluey due to overcooking and then getting cold and heated up again. Too much oil in it made it really very greasy. 2/1012. Mushroms were the cheap type button mushrooms grilled with oil. Again nothing to call home about 4/1013. The chips were probably the best dish. Double fried (I think by the same policy of the rest of the food), from real potatoes and cooked to be crispy. 8/1014. Seftialies. Now this was again below average. From frozen and factory made with not prime meat with addives. 3/1015. Souvlakia. From pork leg with a lot of big fatty pieces. Half dry from juices half fatty pieces. This is the cheapest part of the pork you can buy and it is not good for fast cooking like you have in souvlaki. You need bacon and neck meat to do them properly. 4/1016. Baked potatoes were not baked fully. Army food. 3/1017. Chicken souvlaki. From frozen chicken meat with a marinate to substitute for the lack of texture . Looks ok from the outside but inside is dry, dry, dry and takes time to chew it. 3/1018. Ox liver. Again the same mistake as the first liver. No point to have 2 liver dishes in the menu cooked in the same way. Liver needs to be served as “resting” otherwise it gets dry very fast. 3/1019. Fried courgette strips. This was freshly floured and fried. No salt to taste though. Nice touch. 7/1020. Ravioli. When you cook ravioli and you leave it in the water to wait 3-4 hours before you serve it, the dough becomes too soft and sticky. Factory made ravioli again from supermarket, boiled hours ago and re heated with the inside colder than the outside. 3/1021. Snails. This is supposed to be the jewel in the crown. Well is not. Overcooked hours ago in sauce and reheated. The fatty sauce has not melted with reheating and you could find lard and cold fat inside the snail! The overcooking in the sauce made the meat to loose its texture and become one taste with the sauce. Snails need a good chef. 3/1022. Pourgouri (pilaf). Cooked beforehand and left to dry without its juices. Not fully cooked and without its proper amount of moisture made this stuff difficult to eat. 3/1023. Eggs with tomatoes!! What a disaster! The worst kind! Like scramble eggs gone bad and poured over with tomato sauce. Uneatable. 1/1023. Lebanese machalepi was made there and was with real nice pistachios. The cream though was not made from real ingredients but bought as a powder. 6/1024. Sweets karidaki kitromilo. A bit dry, the cheap mass production you get from a factory. 4/1025. Halvas was nice with nuts in it and cinnamon, well cooked. Probably the best out of the lot. 7/1026. Fruits were imported apples and pears with two pieces of melon. The cheapest fruits in the market today. They could do better than that.We ended up eating very little of what they brought. I wish the quality of the cooking was better and the quantity less.I also have to mention that all food had very little salt and you had to adjust it. That is not good for cooking as this is a tavern and you have to know how to use salt while cooking. This is not a hospital. If someone needs less salt he can ask the cook especially to do it for him. Yet this is a problem when 90% of the menu is precooked.The place needs a chef who can cook and needs to upgrade its ingredients policy to stand up to its name. Cheap ingredients and non professional chefs don’t make a good restaurant however nice the setting is and sociable the owner.The service was fast but too fast for meze! Everything was on the table getting coldER without having space to move or time to enjoy it. Meze is to be served at a nice slow pace and not to be force fed.I would have given it 2 stars for the food but as the meze costs €21 per head and a can of coke or a litre of water is €2.5 it gets just one.",Zanettos
40,"Really great food, great service and they are very accommodating regarding dietary requirements.The only point missed would be that you cant order for fewer people since the quantities are so much, you can take away some of the food, but there is still food that goes to waste..i.e. gets thrown away, which is a pity.Besides this, 100% on overall, environment is buzzing, love the thought behind the décor and the traditional treat at the end is always welcomed",Zanettos
50,"This place worth a visit. You start by washing your hands with aromatic water and then you get the fixed menu. And plates come. And come. And come. Make sure you leave enough space to taste everything! Great place, tasty food, friendly staff!",Zanettos
40,"Dining in Zanettos is a real feast! Meze includes all the popular local dishes, in really generous portions! Food is delicious, ambience is cosy and service is normally efficient.",Zanettos
40,one of the more traditional tavernas in nicosia. located in the old city offers great variety of food and excellent service,Zanettos
50,Is the best place to go evritheng is great and fresh and the praise is good the problem is the parking place is peter take TAXI,Zanettos
50,"Felt great not just eating their great menu but also experiencing the staff 's excellent service skills and the skills of amazing owner. Will be back, totally recommended!",Zanettos
40,"A very friendly place, offering a very good quality cypriot meze. Mostly meat, although the selection includes a few vegetable offerings as well. As customary, good quality is accompanied by generous quantity.... Skip lunch if you plan to go there for dinner !!",Zanettos
40,"When you see it from the outside, all you can see is the name ""Zanettos"", and it looks as if you're walking into a wall. When you go in, you find yourself in a small room, with cups, and cutlery, and wine, you open the door and enter the restaurant, that just keeps unfolding itself and keeps getting bigger and bigger. We sat down in a seat in the corner of the main room (there was another room behind a glass window as well); The decoration around was very ethnic, the walls slightly old and covered with pictures and photographs. The waitress was quite friendly, but when we asked her for the menu or what was available, she said ""no, no there is no menu, the menu's on us"", or something like that. Usually ""mezes"" in Greece means small nibbles of food, but you still get to choose. Not here... She did ask us what we wanted to drink though, and we got two KEOS beers, and a KEOS orangeade (KEOS is the local brand of beer in Cyprus). Small starters came first, including olives, beetroot, small green salad with cheese, greek salad, vinegar, oil, to add, our drinks, toasted bread with oil and oregano, a jar of yoghurt.. Not to mention that the place-mates were wonderful, amazing design, and the plates had the restaurant's logo on it too; so cute! Anyway, and then the main-er courses came: sausages, haloumi cheese, lamb chops, naan bread, fried vegetables (courgettes, carrot...), liver, rice with spinach, chips, snails, pork chops, potatoes, and many more. And all these, about two at a time, every about 7 minutes. The food was absolutely lovely, divine flavour, extremely ethnic. I LOVED the food. But it was just too much. The plates didn't even fit on the table, by the time they'd brought everything. And we had eaten lots of the first stuff, because we didn't know there was going to be more coming. So we weren't hungry for the new things later on that hadn't even come yet. We tried to stop the waitress from bringing us more food, but she wouldn’t listen to us, and said there was more to come. In the end, it was really too much, and it ended up being a complete waste of food. It would have been really nice, if we weren’t staying in a hotel, and then we could've taken everything home with us, and had it later, instead of leaving it there. Wonderful taste, and experience, but a total waste. There were three of us.. Maybe one should've gone and ordered and then the others could join in.. But three definitely couldn't have eaten all that. Finally, we got to pudding, and we were completely stuffed by then.. Even the dessert was tons, and full of variety: fresh fruit, yoghurt for all of us, and halvas (traditional sweet)! Although the wipe design was very nice... All in all it was a bargain for what we got. It was 73,5 for tons of food for three people. And it came with sweeties...! At the end, I asked them for a place-mat, because the design was so wonderful, and they gave me about 30! I only wanted one...But they were very generous, and all in a very good mood, as, when we left, the chef was dancing to Greek music! And he posed for a photograph... ;) We would go again, but prepared next time! A restaurant definitely not to miss... but beware",Zanettos
50,Probably the best cyprus tavern with great plates of mezedes. Beautifull atmoshere and very good service!,Zanettos
50,"We had the good fortune, after a few months of living in Cyprus, of eating at Zanetto's. Meze (a spread) is not for the fully health-conscious but we heard from the owner (the place rated a Chef's Restaurant, i.e., one which other international chefs learn from) that, having learned in New York, he ensures every item is the freshest and best, and the food tasted that way. As with all meze, but more than most, the food was super-abundant, but in this case, as we don't eat pork, we were allowed to pick and choose (e.g., no snails, no pork, only chicken) and were really impressed with the kindness and flexibility of the staff. Most Cypriots dine late, but we were happy to come right as Zanetto's opened and be the only ones in the place, circa 6:30 or so, I believe. The zucchini fries were amazing, and the general authentic ambience - it is really the oldest, longest-running business in the country - testified to the new nephew's drive to keep what was amazing about the tradition while ensuring that the produce was fresh from the market and leftovers were never used. You can see why other star-quality international chefs might treasure a visit to Zanetto's; we did, and anyone who enjoys meze (know that, with kids, you don't have to get a full meze) will love the place. A bit pricier than other places but for what you get (we ended up making four meals out of the leftovers!) it is quite worth it, abundant, fresh, delicious, and authentic.",Zanettos
40,Great many options. Great range of dishes. Well prepared. Sufficient service. Overcrouded. Bit expensive. Clean.,Zanettos
50,Im going there at least 10 years and I have nothing but good to say about this friendly well known tavern. Great food with lots and lots of different dishes. The service is amazing and very friendly.,Zanettos
40,Not your typical tavern. I ve been to Zanettos a few times. Food is very good and portions are massive. Service is fast and the prices are ok. There is a huge variety of dishes. It works on the basis of fix menu per person and you can taste many different dishes from kebab to snails (karaolous).Be prepared to eat a lot. The dishes are coming to the table non stop and if you are enjoying tasting different plates you will enjoy a visit at Zanetos.,Zanettos
50,"The place is a cozy restaurant with friendly atmosphere and a lovely staff. It has been my first meze and I'm still impressed, not only because there were so many typical dishes from Cyprus but also they were delicious. If you wanna try the real taste from Cyprus, without any doubt I would recommend Zanettos :)",Zanettos
50,"Traditional greek meze food coming in large portions. Enjoyed everything about it. The food, the atmosphere, the staff. A place worth visiting.",Zanettos
50,"Zannetos tavern is a must in the district of Nicosia. If you want to taste cypriot heaven food, you should visit this paradise! Delicious traditional meze , excellent suvlaki and especially very good service! No words to describe the mouthwatering dessert!",Zanettos
40,it was great experience - one of the past that i used to visit the tavern when it was still a magirion - little local restaurant,Zanettos
30,Usual Cypriot meze with loads of food including the grill. Noisy for business dinner but if your out with friends then it's rather good. Shall continue going.,Zanettos
50,"All the other reviews say it - fantastic kebabs, liver, snails, beetroot salad, etc. Too much to eat but perfect meze. Tell your host that you like something, and they'll bring you more and more!Recommended to me by the Front of House Manager at the Hilton Park hotel. A must for anyone looking for authentic Cyprus meze!",Zanettos
50,"THE place for meze. The variety and amount of food overwhelming. Although not all dishes were to our taste, most of them were delicious!Priced at 21 euro per person and with the atmosphere and friendly service, it is a great deal that will leave you satisfied and your belly full.",Zanettos
50,"We just came from Athens and stopping over in Cyprus for 2 nights. Our friend who lives here took us to this restaurant, a typical Cypriot Meze. My oh my, was that a feast fit for a king. For 20 some Euros per person, you are treated to everything, I mean everything. I don't even know how to describe it. I have had something like this in Lebanon before. I guess this is how some Mediterranean people treat themselves. Among the first course, I loved the Beets salad and whatever the shredded green salad that was in a small cup. Could it be Dandelion Greens? Don't eat any bread if you plan to try everything that comes out of the kitchen. Pork belly was really good if you can eat the pork fat. Liver was well seasoned and grilled. Grilled Halloumi Cheese was great. The sausage is very strong. It's different from any sausages I've had in the US. I think it's similar to the Lebanese Sausages. Next, Fried Cauliflower and Zucchini. With lots of squeezed lemon, they were delicious. Grilled portabella mushrooms and green rice? They are good, but I think their presence was overshadowed by the next item: Grilled Meat Platter. Pork, Chicken, more Sausages, this was tender than the last sausages. I like the latter. I would like to know how they season the Chicken and Pork and grill to that perfection. My friend who lives there told me that they have a special oven. OK, can I at least know what seasoning they use? Maybe next time. So even french fries or thick steak fries were good. The side dishes were Rice, Scrambled Eggs-Cypriot Style, and Ravioli. Lastly, we got snails. Wow, the last time I had snails was in Portugal. These ones are little bigger, maybe escargot size. When my daughter pulled the meat out, it bounced around and made her think it was alive. She had to stab it several times to ""kill it"" just to make sure before she put a small piece into her mouth. Wow, what an experience. I love it. So, if you are in Cyprus one day, come to Zanettos. You won't regret it.",Zanettos
40,"Zanettos is a cultural icon , serving the traditional meze in Nicosia for decades. Food is descent and the atmosphere will take you back in the 60's. Usually crowded, reasonable prices, more food one can possibly take.",Zanettos
40,"The amount of delicious food that comes with the meze is amazing. The food is delicious but the quantity is overwhelming. I couldn't help feeling guilty about what we couldn't eat - it seemed wasteful. So when ordering, order for half the number of folks at your table and then enjoy it all!",Zanettos
50,"Still the best taverna in Nicosia (operating as a family business since 1938), regarding quality, variety and quantity of the mezedes! The colourful owner is the first to welcome you and all the staff are exceedingly friendly, helpful and efficient! Its always a pleasure to visit and sample the big variety of cypriot dishes and desserts!",Zanettos
50,Zanettos in the heart of the old city is a traditional cypriot restaurant with first class meze. Excellent food and great portions can satisfy even the most difficult customer. Dont expect luxurious surroundings but service and food is top.,Zanettos
50,Great off the beaten path restaurant that serves authentic Cyprus dishes. We came at 6:30 p.m. midweek and were the first customers.It was a very relaxing atmosphere with very friendly service. As far as choice of meal we were told that we had no choice but meat meze (a variety of different sample dishes). We agreed and didn't regret. It was delicious and plentiful. Took half of it home.Verdict: great family restaurant that operates from 1938 in a quiet setting of old town that is definitely worth visiting if you would like to try authentic Cyprus dishes.,Zanettos
50,"Traditional Cypriot tavern serving meze (variety of delicious meat and veg dishes). Come here a lot and have never left disappointed. Always plenty of good food. Excellent service, staff and owner very friendly.",Zanettos
40,"Been here for decades, no menu, just loads of Meze dishes. Lovely staff and the owner is usually around too. Food nice but not posh cuisine! Noticeable how many locals especially families eat here.It wasn't busy the night we went, but there are a lot of tables and it is probably very noisy when full.It felt very authentic and the value was great.",Zanettos
50,"They were only serving meze when we visited so we gave it a try. It turned into a bit of a marathon, despite warnings from the very helpful and friendly staff at the first 6 dishes being delivered that there was lot to come. When we got around the 15th we were starting to struggle but with a bit of determination made it through to the 24th-ish - we had lost count by the time the fruit arrived - so as not to let the side down. Dishes ranged from delicious yogurt, through excellent beetroot, varied well cooked meats and snails - which I admit we declined - and included a sooooo strong beef liver it shouldn't be let out alone. The food was overall excellent and all served in a old-style canteen environment which adds to the charm and by excellent staff.Drinks were good too, and the reasonable price didn't reflect how much, and how good, the food was. I'd certainly recommend a visit, but just not two consecutive nights if you are having the meze.",Zanettos
40,They really serve you lots of food. Some dishes are very good some are just ok. The price is fixed per person so either you eat it or not the will serve you. It is a nice experience to visit Zanettos.,Zanettos
