r_points,r_text,place
40,"I've visited a few microbreweries in my life and i have to say that this one does not disappoint.The produce 4 beers all year long and a couple seasonal. My opinion is that the wheat beer is the best. It reminds of a Franziskaner-Erdinger combination.Not a vast selection of food on the menu but just enough. What ever we ordered was ok, nothing fancy but good quality and fresh and nicely presented.Staff were very helpful. It was very nice that indoor seating was free of smoke. Difficult to find somewhere in Nicosia these days for non smokers.Recommended.",Pivo brewery
50,"We were recommended to go here having been on the Segway tour earlier. The sign hanging over the single green door says micro brewery. It is situated amongst the labyrinth of streets and side streets that makes up the character of Nicosia, once found, beer heaven awaits. The single entrance door does not prepare you for the surprising interior. This is a real life Tardis. The mind can't reconcile having walked through a terraced house front door which then opens up to a palacios interior, several rooms and a massive outside eating area. Then, having got over the vastness of this establishment, we turned to the craft beer. Quality costs, and this beer is a tad more expensive than the local brew, but a good selection of well thought out beers mean that that little extra euro is worth it. Two special beers for the month added to the five regulars, what's not to like about this micro brewery? The young owners have invested a lot if time effort and money in setting up the establishment. Make your way there and be amazed. Cheers",Pivo brewery
50,Real locally brewed beer. I liked the special dark ale on the occasion of St. Patrick. Very nice platters to share. Excellent the sausages. Great waiters and waitresses :-),Pivo brewery
50,"In my opinion, one of the best places in Nicosia! The place is simply great with cozy atmosphere, serving delicious food and a great variety of beers at reasonable prices. Excellent and super friendly staff.",Pivo brewery
40,Have been to Pivo 3 times now. They have a range of very good beers. I especially like the dark beers. Such a mellow taste. The atmosphere is also good. I would recommend it.,Pivo brewery
50,"This is an excellent place and there is nothing that compares in Nicosia.first it is a proper microbrewery serving really good beers. Second the food is just right, perfectly suited to the beer. Third the atmosphere and ambience is as close to perfection as it's possible to get. Fourth the staff are friendly, welcoming and knowledgable. Last but not least is the building, tastefully refurbished and the location within yards of the green line. Paradise for the discerning beer drinker.",Pivo brewery
50,"This was our first visit to Pivo and it was a super one!Wonderful setting within the old Nicosia area and a very warm atmosphere. Friendly and helpful staff explained all details about the various beer options, making the experience educational as well as enjoyable 😊.We were also very impressed with how accommodating the staff were regarding our food choices, going out of their way to deliver what was a great food experience. Highly recommend the vegetable rissoto!Finally, Dolly - one of the strongest in alcohol beers - was exquisite (and quite strong at 7 degrees....).All in all, a great and romantic evening out which left us with the best of impressions.Will certainly be going back!",Pivo brewery
50,"Food was served on time and hot, great taste. Staff is very friendly and eager to help. Highly recommended.",Pivo brewery
50,"A very nice place with cosy atmosphere, friendly staff ready to explain the special beers they create themselves and nice music. We really enjoyed their special beers and something to noble!!",Pivo brewery
50,"Nice place, with great beers and food.we tried the beers and the food of the night and we loved it.Pricewise is correct.staff was very friendly.",Pivo brewery
40,Go for the flight of different beers to taste all 4 varieties. Food is OK but the whole experience of a custom brew gives the place some of its attractiveness. What's lacking is the view of the brewery and a personal touch,Pivo brewery
30,"It's a nice building but nothing more. The beers are very disappointing and there no atmosphere in the place. Staff could be more helpful and respectful for the customers. I went once and that's enough.... if you want to enjoy beer, just go some where else.",Pivo brewery
40,We visit the place at a Sunday night. Nice smooth relaxing atmosphere. Helpful waiting staff and tasty beers. Over 6 different well home produced beers were available. Tasted them all. Totally recommended,Pivo brewery
40,"Of course the best beer in Cyprus,but the other menu...))They have to work on it!)But yellow couches are so cozy!Very tasty ""anti stress "" beer,highly recommend!",Pivo brewery
50,Second time to Pivo. Most excellent the beer they make.Our German friends love the beer.Bitter beer lovers will love the place.We ordered sausages just to begin with.Most of them nice and fresh.Locally made by a German guy from Limassol. Food excellent. Rips and jambono recommended. Staff very kind and prompt to serve you.Environment the most.Renovated building in the centre of the old city just by buffer zone and the occupied areas. Reasonable prices and good quality.,Pivo brewery
50,"Everything was great!Friendly staff, very good service, excellent food and inhouse made beers. Highly recommended!!",Pivo brewery
50,"The beer 'Pivo' is a product of the place itself. they have only 4 beers in the menu - but it's MORE than enough!The beers are very good and all 4 of them gives different taste for different people's taste.The food is also very good. comes in big dishes and nice presented on the plates.This is a place of beer, friends and a good ol' blues and rock in the background (not loud, sust the exact volume to have a good conversation).The have sometime a temporary special beer - for christmas they brewed a burned christmas tree flavour beer - nice and tingling on the tongue, bit bitter with sweetness.Also its a good place for a date, romantic but also simple.*** needs to reserve a table at least couple of days ahead.",Pivo brewery
50,"We just loved this place!Excellent and friendly staff. Owners of the brewery were more than happy to explain us how they are making the beers.We also had dinner, and all of our dishes was well cooked and tasty.Even If I'm not beer lover, I really like this place and we are totally getting back for another perfect night out !",Pivo brewery
50,"The whole microbrewery concept is great. And the setting is lovely. Ideal for beer & wine lovers alike, friends & lovers alike! Interesting dishes and friendly staff!",Pivo brewery
50,"A unique place in Nicosia with very friendly staff and great drinking choices. It's location is very convenient, in old city and close to parking and other bars. The decoration and the atmosphere are perfect.",Pivo brewery
50,This place was recommended to us by our segway tour guide. It really is a great place to stop and have a drink especially if you like beer! The food looked great although we are yet to sample any. We will be sure to stop again when we are next in Nicosia.,Pivo brewery
50,"Pivo is a restaurant that you won't regret going to. I liked the fact that everything is made there from their own materials. The food is very good and the beer is exceptional. I found it a bit overpriced though, but just a little. The thing I would give the most credits to, is the staff which provide a perfect overall experience.",Pivo brewery
50,"Pivo is a fantastic microbrewery, people working there are always with a smile and keen to help you out. The atmosphere is really cosy, there is a nice selection of beers and the plates we tasted were extremely good. Finally I would say the prices were logical. So overall Pivo is certainly a place worth visiting and I hope they keep up the quality of their services!!!!!!!!",Pivo brewery
50,"This is how restaurants should be set up. Limited menu choice but outstanding quality, owners running it with attention to detail.",Pivo brewery
50,"This place is just awesome! Reasonable price, very cosy and warm place, very friendly staff plus every month they surprise you and actually amaze you with the offer for the beer of the month! You rock Pivo ...",Pivo brewery
50,"I have been to Pivo twice in less than a month, with friends, and thoroughly enjoyed it both times. A lot of attention has been taken in all aspects of the experience, in addition to the obvious - the beer - and I could not fault it in any way! Excellent food (from the burgers to the ribs and the pork leg!!), in plentyful quantities, friendly staff (unobtrusive but always around) in a very well decorated environment (a restored old house and inner courtyard), beautiful beer glasses and of course, you are welcome to have a tour and talk beer all night. The owners are always happy to oblige!! time flies when you're having enjoying yourself with good company.",Pivo brewery
50,"Off the beaten tourist trail next to the demarcation zone, this wonderful watering hole is well worth seeking out. Entering the premises one feels as though you have found an oasis in the desert of urban decay.Popular with young Cypriots, the atmosphere is friendly and welcoming. Four beers are brewed on the premises. Each beer is unique and worthy of praise and more importantly taste.",Pivo brewery
50,"This welcoming restaurant / bar / microbrewery resides in a renovated house with courtyard in Old Nicosia very near the Green Line and close to Phaneromeni Square. The food was very good, the service excellent and the beers sublime. We each chose different ones and everyone was delighted. The atmosphere in the courtyard was also excellent and the three(?) owners of the brewery were happy to chat and show us the workings of the vats etc. Top marks!",Pivo brewery
50,"I highly recommend doing the beertasting, the 4 presented beers are each unique in taste. The guys who own the bar are engineers who went abroad to learn about beer brewing across Europe, with them they have brought techniques and added their own style and flavors to the beers. I was happy to learn that each week they make a new flavoured 5th beer and that they have made Belgian styled beers as well. The only thing missing I felt was something for the ladies, I know not everyone loves the taste of beer, so having a fruity/cidery beer as an alternative would have been nice. The location is perfect, classy, calm and it has some ancient ruins you can see through a window in the floor. Perfect place to chill out and talk with friends",Pivo brewery
50,"Already been quite a few times, this little gem of a restaurant/brewery will keep me returning for the food and ambience of the whole place (old historic city house, renovated perfectly to create an informal and unpretentious space of a few rooms and outer yard), and one doesn't even have to be a beer drinker to enjoy all else. Overall it's a great experience well worth visiting with friends or as couples.",Pivo brewery
50,We really enjoyed it! We had great time with friends! Very friendly waiters..fast service! You can enjoy homemade beers..of all tastes! If you are a beer lover..you should try it! Reasonable food prices.,Pivo brewery
40,"Very nice place, very nice atmosphere. Small problem with parking but Phaneromenis Municipal Parking is 100 meters away. The prices for food are a little expensive.",Pivo brewery
50,"This can be difficult to find as it is away from many of the other bars and restaurants but is just a short walk from the main pedestrian strip running through the centre of the Nicosia into the North part.As far as I have seen, there is nothing like this in Cyprus and is a great little place to spend your evening. The house beers are very nice and I would recommended trying at least Hoppy, if not all of them! They have a guest beers at different times too.Unfortunately, we did not eat here as we had made other plans but the food looked simple and very delicious, in particular the Sausage Platter.If you are visiting Nicosia you must visit Pivo.",Pivo brewery
50,"Been many times and each time I have had great food, excellent ales and friendly efficient service.The owners of Pivo are approachable and explain all about the process of making the ale as well as the differences between them.The food is excellent with some specials most nights.If you love your ale/beer then this is the place to try in old Nicosia.",Pivo brewery
50,"I happened to walk past as one of the owners was unloading some supplies and saw the microbrewery sign. As I am into brewing I asked him about the place. He told me it opened at 7 so I came back. I was on my own so didn't try the food but the beer was GREAT. They are brewing as you drink/dine so you really understand how fresh the beer is. It's also a fantastic building, very tastefully renovated and a great atmosphere.Love it!",Pivo brewery
50,"Hi, I have took a dinner yetserday evening at this Nice restaurant with few frends. We enjoyed the food and all 4 types of the beer. The place offers you a ""Taste"" - all 4 types of the beers they have (200ml)/each for only 8 euro. We loked also the service and atmosthere. For sure you have to visit it once you arrive in Nicosia. Also, it's at the border with Turkey side wall :).",Pivo brewery
50,"Delightful beers, wonderful service and the food is great. You can see the brewing process here and have a great chat with the brewers. Totally beautiful place.",Pivo brewery
40,Excellent home brewed beer. Food is good. Kotsi is the pick of the menu - when available (even though it is a bit pricy). Avoid the burgers.,Pivo brewery
50,Beer is not a usual bevarage that one finds in a back street of a historical city in Cyprus. Outside the major breweries now there is a small group of breweries crafting specialised beers. Pivo Microbrewery in the central of the Cyprus capital is a brilliant contemporary dining concept that fits well in the restored centre of old Nicosia. Superb German styled wheat or blonde beer can be drunk with a well thought out cuisine. However I would prefer the traditional Cypriot peanuts to nachos. The peanuts were introduced to Cyprus from Egypt in the twentieth century. Excellent and attentive service. They’ll even put down the music if you went there for a friendly chat. Highly recommend it.,Pivo brewery
40,"Great place (architecture / ambiance), suitable for friendly nights out but also bigger gatherings. Their weissbier was truly great (2.5euro for half pint, 4euro the pint). Their porkchops (10euro) were very well made and priced. Their schnitzel needs some more fine-tunning (and less salt).You might need to book a table in advance if you want to sit at the internal courtyard.",Pivo brewery
50,"Bad news for beer lovers: beer in Cyprus is not good (to put it nicely). Good news for beer lovers: there's a place in old Nicosia called Pivo Microbrewery. The place offers 4 different beers and all of them are heavenly. My personal favourite is Berliner Weisse (I think that's the name). They also serve quality food to accompany your drink but they will be happy to have you even if you are visiting for drinks only.The service is very friendly.The place itself is something like a fashionable bar and a simplistic pub joined together. It is not a typical cypriot place at all. When it is busy, you may have to share a table with some other guests. This adds some bierhalle spice to the atmosphere.I highly recommend this place if you are after quality beer and somewhat non-typical atmosphere.",Pivo brewery
50,Great place. Great atmosphere. Great food. Great beer. Great service. My food was cooked to perfection and the beer kept coming.,Pivo brewery
50,"For those of you who want a break from the Keo, this is the place to come. Their four regular beers are solid and their special is worth a look at.We had the four beer taster, followed by two large beers and some keftedakia (little meatballs). The beer was great and so was the food.It is also located on the Green Line in an old house, so it is very atmospheric too. The servers are all really great too.",Pivo brewery
50,"Very excellent place with great beer. The food is good,the stuff is very friendly! My favorites beer is now Blonde and noir and sitarenia. The localization is in old town of Nicosia.",Pivo brewery
50,"Really great place (not only) for beer lovers. The staff is very helpful, even in busy hours. The beer the guys make is really tasty and great idea to make always one special beer.Price coresponds to the quality of the beer.And also the coffee is great, long time didn't have such a good espresso (yeah, the price is not like for a sketo in a village, but you get what you pay for).",Pivo brewery
40,We decided to try this relatively new place in old area of Nicosia city to have some time for discussion and beer..although it was crowded food had very good quality considering that this place is for beer. There's no big variety of plates but it was really nice and prices normal. Also home made beer is offered with a special different recipe every week depending on the brewery process..it's something different but worths to try it and support such efforts..inside or outside sitting is available..We notified one of the directors that they were a bit late to serve the beer but he kindly explained the reason for that day..I hope they keep trying their best and maintain such a place in the city..I would recommend the place for couples and small companies..make your reservation to avoid disappointment..,Pivo brewery
50,"Can here with a group of colleagues from all around Europe and everybody was excited and left with the best impressions. The staff is very helpful and ready to help you. The beer quality is very nice. Also, if you ask one of the staff will give a short guide to the microbrewery and explain you how they make beer.",Pivo brewery
50,Very nice place in the old nicosia!! The food is very good and tasty especially the hamburger!! They make their own beer and is really good! Also has a part with glass floor and the decoration is very beautiful! The waiter was kind and with helpful advise for the food!,Pivo brewery
40,"An old renovated house with excellent architecture and simple but nice decoration,in the heart of the old town of Nicosia. Authentic Beer made by Pivo brewery, nice dishes that we all shared. We tried blondy, black and sitarenia. I liked blondy beer and the three dishes we tried were delicious. From Sussages I liked the spicy one, different kinds of good cheese and meet balls that were excellent !!! There is achoice of salads as well and some other dishes.Very good service, helpful stuff and reasonable prices. Beer about 3.5 euro and each plate about 13 euro. We will go again !Pivo MicrobrewerPivo Microbrewery",Pivo brewery
50,"Very buzzy cool place. Excellent choice of beers and wines. Big portions of foods,ideal for sharing,all good. Gets very busy in evenings so book esp if there's a few of you. Service very friendly and attentive,a common theme in Nicosia.",Pivo brewery
40,It was a nice touch the beer tasting option! I really enjoyed the cheese plater and the calming music. Definetly going back,Pivo brewery
50,"I'm happy to see that this place is going so well. Whenever we call they are already fully booked, but we are lucky to get their last small table (they do keep a few tables for walk-ins from my understanding). Their staff is so friendly and welcoming, you can tell they are happy to be there! The place is nicely restored and set up, with a nice atmosphere. I enjoyed all the beers I have tried the few times I have visited, but I do remember their smoked beer quite vividly and I am sorry that I only got to have it once before it sold out. I was very pleasantly surprised by the quality of the food! So far I have tried the curry veggie risotto, the veggie tagliatelle, and the seafood risotto. The seafood risotto blew me away! I also really like their ""beer-bread"" that they serve with the beer. We will be coming back!",Pivo brewery
50,First time we went there. They brew their own beers very tasty. The food incredible especially thete burgers. Will defenatly be going back.,Pivo brewery
50,"I have been hearing good comments about this place for some time now. Last night we got to visit with some friends. We were definitely not disappointed. The brewery/restaurant is located in a recently renovated beautiful house in old Nicosia (within the Venetian walls). Furniture and wall fittings very tasteful. The small back yard was very cozy. Mixed crowd, young and older. We had the house burger which was very good, the fries excellent. The service was excellent and we all enjoyed Blondie one of the beers they produce on the premises. We even got a small tour of the brewery from one of the owners! We are definitely going back.",Pivo brewery
50,An old house in the old part of Nicosia which has been converted to a brewery. Three brothers and a cousin as the young men have told us who like beer and decided to created their own brand. They produce beer on the premises. They have four flavours all very very tasty. The four young men have renovated the house with great taste having kept the character of the old city. Their idea to produce their own beer has paid off as they have done an excellent job in all respect. They also have some dishes if you are hungry. Atmosphere and service are great. Highly recommended.,Pivo brewery
40,This is an informal but well designed beer house. There is a patio that has been incorporated and it makes a very pleasant place to have an informal beer with food. The beer is fine (not great) but the overall experience was positive. Great staff!,Pivo brewery
50,The place is highly recommended for various reasons:1/ Building with the internal garden2/ Excellent service3/ Friendly staff4/ Excellent house beers5/ Ambience,Pivo brewery
50,"I went there with colleagues after work. Although not a big fun of beers, i was amazed by the unique flavor of the homemade beers this place offers. We also tried the food and it was great. The service was excellent. I will definitely visit the place again. I only wish they opened earlier so we could visit the place every Thursday after work!",Pivo brewery
40,"Very spacious, popular, lively and refined place with exquisite choice of beers. Nice terrace as well. Very good service.",Pivo brewery
50,"They are trying really hard, both beer and food good. Service, ambience and food would not be out of place in central london - really great and knowledgeable guy served us. Worth going, and worth supporting.",Pivo brewery
50,"the beer is fresh and nice, they look very experienced in what they do, food is great too and they serve natural cypriot fried potatoes which are hardly found i. restaurants anymore, the place has ambience and overall the four brothers who run it are doing a great job",Pivo brewery
40,Interesting place for a casual outing.Thied all kinds of beers but really loved the blond one.The platter of sausages was really nice...overall a nice choice to go out.,Pivo brewery
50,"One of my favourite places in Nicosia! Although serving only their homemade beers (and a limited range of other alchoholic drinks) it does not lack anything compared to other beer houses. The food is also good, with several choices and seasonal special dishes. I like the cosy atmoshpere, the small back yard, the mixture of people of all ages, and of course the low prices which are always a plus. However, what I love the most is their great service! The waiters (some of them are also the owners) constantly have a huge smile on their faces and are more than willing to offer their guest a pleasant night!!",Pivo brewery
50,"I visited Pívo because I finally wanted really good beer and I wasn't disappointed. Plus I could talk in czech for a little bit which was nice. I really liked all the beers, but of course, Blondie (bohemian pilsner) speaks to my czech nature the most...There was a lot of small children on Sunday lunch time, but in the evening is atmosphere always very nice...",Pivo brewery
50,"The brewery and it's bar/restaurant are situated in a back street and you will need a map to find it, but the effort is certainly worthwhile. A range of four core beers are served which represent the world of great beer styles: a Bohemian pilsner, a Bavarian weissbier, a Czech dark lager and an American IPA. A further beer changes regularly. At the time of my visit the featured brew was a Belgian abbey-style beer, rich and fruity. I didn't eat, but the food looked delicious, and the surroundings both in the bar/restaurant and in the rear courtyard were very pleasant. If you like beer, this is a 'must' during your visit to Lefkosia/Nicosia.",Pivo brewery
50,"I had heard from friends about this new initiative. A microbrewery in the heart of the old town. Tucked into a little street, one does not know what to expected. Once you step into the place, you will be amazed. A beautiful courtyard. A cosy interior. Old and modern at the same time. As for the beers, you can go any way you want. Blondie, Noir... maybe try a Special! Food is nice and interesting. You can find sausages as one would expect. But also a Gorgonzola salad with apples and red berries. I am definitely going back for more!",Pivo brewery
40,"4 brothers with a passion for beer recently opened this microbrewery. The building is nicely renovated. They have 4 beers all year round (Pilsner, Black Lager, Weizen and IPA) and one beer of the month. I spoke with one of the brewers and he told me that they are trying to brew a Belgian Style Triple, my favorite kind of beer. On my next trip to Nicosia, I will go there again.",Pivo brewery
