r_points,r_text,place
40,A nice micro brewery in Nicosia with lovely hand crafted beers. Amazing aroma and rich flavors of fruits and herbs. Great place to visit,Pivo brewery
40,Excellent set up. The people were enthusiastic the food - sausages and cheese platters - was well served and tasteful. The beers we tried were all good.,Pivo brewery
40,"Visited in Jan 2016, really nice atmosphere and vibe, with relaxing music and setup. Tried the Weiss (wheat) beer and the IPO, felt lighter than expected. Service was great and the food was good, but not exceptional. Would gladly visit again and try more beers, really have high hopes for this place and am very supportive of the idea of microbreweries in Nicosia.",Pivo brewery
50,"Excellent Beer 4 varieties: Blondie, Noir, Hoppy and Sitarenia, the latter being my favourite. There was also a seasonal one called Graham. Service was very good and polite, food arrived on time. The Pork ""Gonato"" was divine but is only available on weekends or by special order! Will definitely visit again. Venue is also very well renovated.",Pivo brewery
30,"A beautifully converted building in the old city, we sat in the lovely courtyard, which was nicely heated, even in January. It was busy with a nice mix and the girl who served us was lovely. Beer, when it came was great, and it's definitely a good thing to have a microbrewery in Nicosia. So far, so good. The menu though, is small (ok in itself) but dominated by pork dishes. I ordered a burger, since it was pretty much the only thing on the menu that didn't say pork, sadly, one bite told me that it had pork in it. I hailed a passing waiter, who told me that of course it has 20% pork, otherwise it would have been called a beefburger! How stupid of me not to realise that a burger equals pork! I was then left sitting for half an hour with a full plate in front of me, no-one bothered to check back, or offer an alternative. We also left our chips as they were very soggy and greasy.The location, beer and ambiance deserve 4 or 5 stars, but the food and service deserve 1. I would probably go again for a beer, on the way to another restaurant",Pivo brewery
50,This is the best microbrewery in Cyprus. The beer is excellent and the location in the old town is very charming. This is a great place for drinks with friends or co-workers. The owners are usually present at the brewery and are very nice. I would highly recommend Pivo to anyone. It is best to call ahead for reservations as it usually very full.,Pivo brewery
50,"I have visited Pivo Microbrewery last night with some friends and did not know what to expect. I was pleasantly surprised to find out that the beer was excellent and the food was really good (though the menu is quite limited). It's a unique place, made with love and you can feel it in the air. Will definitely be visiting again soon!",Pivo brewery
40,"Being a huge craft beer enthusiast I was more than delighted to hear that we have our own microbrewery in the heart of the capital. The beers created on location are very interesting and the prices are very moderate. A very stylish bar that makes for a good ""hoppy"" night out especially in the summer because of their beer garden.",Pivo brewery
50,"Great effort from all the people there for the beers and the place... Good job guys, keep on doing it",Pivo brewery
40,This is the very first of its kind in Nicosia. Located in the heart of the old city the only challenge is parking.Some truly great beers brewed in-house and the service is great.The crowd is a good mix and and food (although not a huge choice) is very good. Price is not bad either. For around €20 peer head and will eat well and have at least 2-3 great beers,Pivo brewery
50,The place is really cosy with logical prices for their beer. The beer is brewed on location. It is maybe the only microbrewery in Nicosia. There is also a small choice of platters and food.,Pivo brewery
