,r_points,r_text,place,scores,compound,score
64,50,"Gol Hanim is a safe and comfort place to stay in old Nicosia. Although it is located in heart of old city, it is cozy, quiet and suitable for resting. Actually it is a traditional house which keeps its own old appearance in spite of changes that have been done in it for tourist users to feel comfort. All in all it is very nice and interesting place.Historical places of old Nicosia is just a few minutes walking far from Gul Hanim and you really don’t need taxi at all. I visited Buyuk hamam and Buyuk Khan and …. They were so interesting. Also I went to Girna that is just 20 minutes buy bus. You can visit its nice and spectacular harbor and a historical castle and its lighthouse and a new one lighthouse and many beautiful boats over there, or you can buy something from its modern shops.For those Iranians who have an appointment with US consulate in North Cyprus, I strongly recommend here because it is so close, just 10 minutes walking. Also for those of you who don’t have a credit card they will reserve for you by a phone call or E-mail.Its price 60-70 Eu per night seems rather expensive, but all in all prices are same in this district and you cannot find another cheaper one here.Selay is manager here and she speaks English very well. She is so kind and friendly and she does her best try for passengers to feel it is their own home. There are a large number of free maps and plans in her office and she makes marks on them and guides you how and where you can go for visiting historical and interesting places. She is very adaptable and you can call or E-Mail her for request for check in or check out for other hours.I stayed 4 days in Gul Hanim and had a great time, thus if I go to Nicosia again; I will reserve there.Thank you so much Selay.",Gul Hanim House Boutique Hotel,"{'neg': 0.006, 'neu': 0.837, 'pos': 0.157, 'compound': 0.9943}",0.9943,pos
65,50,"I stayed at Gül Hanim House for few days and was completely charmed by the house and its host, the lovely Selay. It is in the center of north Nicosia, about 5 minutes walk from the Ledra Street crossing point. The historical center of both south and north Nicosia is within walking distance and you will be able to explore all the major sites within few minutes walk.The house is just amazing - a paradise in the old town. As soon as you walk in you feel like at home in its pleasant quiet yard. The room was spacious, with high ceilings with exposed wooden beams, super clean and well equipped (TV, Wi-Fi, extra blankets, daily cleaning service etc). One of my favorites is the bathroom - chic, vintage Arabic tiles, brand new appliances but chosen with great taste. All the furniture is wooden, hand-made, respecting the original style of the house.Breakfast is served in a common kitchen (again, tastefully reconstructed and decorated) and can be taken at a table in the common yard.The host of the house, Selay, is half of the success of this amazing house. She is friendly, speaks excellent English and went out of her way to help me enjoy my stay, giving many helpful tips and materials (maps, guide books etc.) and even helped me to rent a car. She has a great love for her country and will do all she can to help you discover it.It is a great place from which you can set out to explore north Cyprus. You will be able to drive to the very north east (Dipkarpaz) in about 2,5 hours and to Girne in only about 30 minutes. North Cyprus, as oppose to the south, is much less touristy and has a lot to offer (great nature, very pleasant and helpful people, beautiful empty beaches, good food..).All in all, a place not to miss out if you travel to north Cyprus!",Gul Hanim House Boutique Hotel,"{'neg': 0.009, 'neu': 0.711, 'pos': 0.28, 'compound': 0.9988}",0.9988,pos
66,50,Place is not bad but it's disappointment because it is very Small and you can't see different or fantastic items.Only this gate's landscape is very nice exactly.Sea and mountain but I think you need to go in summer,Kyrenia Gate,"{'neg': 0.092, 'neu': 0.682, 'pos': 0.226, 'compound': 0.759}",0.759,pos
67,40,"The North Nicosia Tourist Info Office is located inside of the Kyrenia Gate. Walking tours start here but when I asked about the free walking tour that they sponsored, the staff knew knothing about it. But they gave me a map and I took my own walking tour of North Nicosia",Kyrenia Gate,"{'neg': 0.0, 'neu': 0.914, 'pos': 0.086, 'compound': 0.6652}",0.6652,pos
68,40,"The Kyrenia Gate (it may be noted as the Girne Gate) is one of three entrances which were built into the historic Venetian walls which enclosed the old City of Nicosia. It’s located in the northern part of walled quarter of Lefkoşa, the Turkish occupied part of Nicosia. The other two gates are the Paphos Gate at the western end of Lefkosia, and the Famagusta Gate at the eastern end of Lefkosia. I have reviewed each separately, as they all warrant a visit in their own right, for different reasons.It's a little squarish, squat construction, built between 1562 and 1567 from stones of the former medieval wall which the Venetian walls replaced. The little square tower on top, and the dome, were added in 1821. There's a stone panel on the building which records the date of its construction, and also a table inscribed with some verses from the Quran.It was a part of the continuim of the Venetian wall, until the British demolished sections of the wall around it in 1931 to facilitate the flow of traffic. What a shame, as the gate now stands isolated in the middle of a dual carriageway. The surrounding space has a number of significant statues, and is a bit of a focal point for gatherings and political rallies.Today, the gate is put to use as the Tourist Office of Nicosia Turkish Municipality. It was thus named as from this point the road led north-east up to Kryenia (now Girne).It's very pleasing to the eye, and looked beautifully grand in the afternoon sunlight, with the trees behind and the mountains beyond. It's certainly worth a visit if architecture and local history is of interest to you - that's why I went. If you are visiting Lefkoşa (the norther quarter of Nicosia) from the south, you'll need to head north from the Ledra Street Crossing, through Ataturk Square, and along Girne Caddesi to the gate. That's an easy 20 minute walk.I really appreciated this little corner of the history of Cyprus.",Kyrenia Gate,"{'neg': 0.016, 'neu': 0.9, 'pos': 0.084, 'compound': 0.9669}",0.9669,pos
69,40,"Another old tourist attraction. No need to spend much time here but you can enjoy the nice restaurant near by, The Iskemleci.",Kyrenia Gate,"{'neg': 0.054, 'neu': 0.608, 'pos': 0.338, 'compound': 0.8555}",0.8555,pos
70,20,The northern main entrance to Nicosia with its ancient Gate intact and preserved. Okay for a photo opportunity but nothing else,Kyrenia Gate,"{'neg': 0.0, 'neu': 0.782, 'pos': 0.218, 'compound': 0.4118}",0.4118,pos
71,40,Having passed through the checkpoint Kyrenia gate is where you can pick up the buses to travel into the Turkish side of the island.The tourist information is inside the gate. There are a few restaurants near here serving local food.,Kyrenia Gate,"{'neg': 0.0, 'neu': 1.0, 'pos': 0.0, 'compound': 0.0}",0.0,pos
72,40,"North Nicosia is in my view a more interesting place to visit than the south. To get to this gate we walked through a series of streets and lanes which showed us the other side of Nicosia. Buildings in disrepair, streets untrodden by tourists and an obvious lack of money. However the gate itself is beautiful as are the city walls. These are well preserved with a pretty municipal garden in the moat. Such s lot of history with that gate as well.",Kyrenia Gate,"{'neg': 0.026, 'neu': 0.815, 'pos': 0.16, 'compound': 0.8999}",0.8999,pos
73,40,Situated in the Turkish side of Nicosia once you reach this monument you’ll feel like your in one of Turkey’s provinces 100% and that was a feeling I’ve loved. The building has a tourist information point and its well preserved. Minutes before you reach the gate on your right there’s a mevlana museum check it out.,Kyrenia Gate,"{'neg': 0.0, 'neu': 0.794, 'pos': 0.206, 'compound': 0.8481}",0.8481,pos
74,40,"Situated in the North part of Nicosia, this Gate hosts the tourist info office. It's also from there that the buses to Kyrenia depart. We came from Nicosia South to see what it looked like but we did not like the neighborhood at all. It's dirty (the only place in Cyprus where we found that it wasn't clean), polluted and not very pleasant to walk through, in comparison with all the other parts of the city. That being said, the Gate itself is very well preserved and nice!",Kyrenia Gate,"{'neg': 0.074, 'neu': 0.779, 'pos': 0.147, 'compound': 0.7631}",0.7631,pos
75,40,The gate is well preserved and houses the tourist information office. Buses to Girne/ Kyrenia depart from just outside here. The area around the gate is quite tatty but does feature some interesting old architecture. Suggested walks are marked with coloured lines on the streets....but some disappear en route!,Kyrenia Gate,"{'neg': 0.044, 'neu': 0.856, 'pos': 0.1, 'compound': 0.4664}",0.4664,pos
76,40,Tourist information is located inside and once you pick up your free map you will find everything in easy walking distance including the border crossing,Kyrenia Gate,"{'neg': 0.0, 'neu': 0.788, 'pos': 0.212, 'compound': 0.7351}",0.7351,pos
77,40,Tourist information is inside the gate! Takes a good pic! Make sure you wander round the area which is dilapidated but has character.,Kyrenia Gate,"{'neg': 0.0, 'neu': 0.827, 'pos': 0.173, 'compound': 0.4912}",0.4912,pos
78,40,The gate was built by the British and named as the road eventually ends at Kyrenia. There is a small park nearby but the gate is an opportunity for a photograph,Kyrenia Gate,"{'neg': 0.0, 'neu': 0.883, 'pos': 0.117, 'compound': 0.5719}",0.5719,pos
79,50,"This is one of gates of Nicosia when it was with in the Venetian walls. This was the gateway that lead to Kyrenia town. Now is more like a place for events, like concerts or exhibitions. A similar to Famagusta Gate.",Kyrenia Gate,"{'neg': 0.0, 'neu': 0.869, 'pos': 0.131, 'compound': 0.6794}",0.6794,pos
80,40,"The Kyrenia gate is the gate at northern limits of the old city of Nicosia. Originally built by the Venetians, the Ottomans added an inscription to the gate lauding ""Allah as the Opener of Gates"".The gatehouse has been turned into a tourist information centre and very picturesque sitting on it's own in the middle of the road in between parts of the Venetian walls.",Kyrenia Gate,"{'neg': 0.0, 'neu': 0.955, 'pos': 0.045, 'compound': 0.4391}",0.4391,pos
81,40,A pity that modern demands mean that this northern entrance into the city is no longer as impressive as it would have been but no less as interesting - now a useful focus point for buses to the north.,Kyrenia Gate,"{'neg': 0.133, 'neu': 0.665, 'pos': 0.202, 'compound': 0.6289}",0.6289,pos
82,40,The Kyrenia Gate was part of the wall that surrounded the City now it is just the Tourist Information Office,Kyrenia Gate,"{'neg': 0.0, 'neu': 1.0, 'pos': 0.0, 'compound': 0.0}",0.0,pos
83,50,Got the bus from Kyrenia to N Nicosia. Arrives and departs from just out side of Kyrenia Gate. By a nice café. Two lanes of traffic in and out of the city and the tourist information centre is on the centre island of the road. Café's and shop's are to be found just inside the city walls.It is only a short walk to the centre of the city. I have done the trip by car and by bus the best way is by bus.,Kyrenia Gate,"{'neg': 0.0, 'neu': 0.918, 'pos': 0.082, 'compound': 0.7906}",0.7906,pos
84,50,"In 1878 the administration of the island was officially transferred to the British Empire. Nicosia became the colony's capital. During the British occupation Nicosia developed not only within the walls but also outside the historical centre. When the British took over Cyprus they entered Nicosia from the Kyrenia Gate. During the Ottoman period there were gate wardens. Horoz Ali (Ali, The Rooster) was the warden of the Kyrenia Gate and lived in the room on the second floor. Horoz Ali, was allowed by the new administration to carry on his duty of closing the doors at sunset and opening them after the morning Azan was recited. He continued his job until he died in 1946 at the age of 121. From then on the worn out doors of the Kyrenia Gate remained open at all times. In 1931 the walls on either side of the Kyrenia Gate were knocked down to create a road after one of Nicosia's first buses turned out to be too high to go through the original gate.",Kyrenia Gate,"{'neg': 0.043, 'neu': 0.926, 'pos': 0.031, 'compound': -0.4767}",-0.4767,neg
85,30,"This is one of the original city gates, now on an island in the middle of the road, but still good for a photo. Not far from a North / South checkpoint.",Kyrenia Gate,"{'neg': 0.0, 'neu': 0.831, 'pos': 0.169, 'compound': 0.6705}",0.6705,pos
86,50,"Sitting in the centre of the road, just off one of the main roads it’s a well preserved greeting as you head into the town where you can cross the border.",Kyrenia Gate,"{'neg': 0.0, 'neu': 0.856, 'pos': 0.144, 'compound': 0.5719}",0.5719,pos
87,40,"The old building stands in the middle of two lanes of traffic entering the city. You can imagine the many people in the past who have passed through here when it was one of a few ways of entering the old city. Bathed in sunlight, the stone glows. It is only small, but worth seeing as part of seeing the old walls. Inside is a good tourist info centre with many excellent leaflets in full colour, of the areas in Northern Cyprus - available in four languages.",Kyrenia Gate,"{'neg': 0.0, 'neu': 0.878, 'pos': 0.122, 'compound': 0.9052}",0.9052,pos
88,30,"well preserved gateway, sitting on it's own in the middle of the road. may give an idea of the defences of the city.",Kyrenia Gate,"{'neg': 0.049, 'neu': 0.864, 'pos': 0.086, 'compound': 0.2263}",0.2263,pos
89,40,"One of the three gates of the venetian walls this in the Turkish area. Set in the middle of a road island close to a statue of Mustafa Kemal Ataturk. There are some cafe's nearby. From here you can catch coaches and Dolmus around northern Cyprus. Check the signs out on the Dolmus for their destinations. The gate itself is now an information ""booth"" rather than a gate in and out of Nicosia.",Kyrenia Gate,"{'neg': 0.0, 'neu': 1.0, 'pos': 0.0, 'compound': 0.0}",0.0,pos
90,50,This is the smallest of the gates and can be found on the northern side of the checkpoint. It is set in the middle of the town at a busy main road junction and it's interior has been turned into a tourist information centre.,Kyrenia Gate,"{'neg': 0.0, 'neu': 1.0, 'pos': 0.0, 'compound': 0.0}",0.0,pos
91,50,Avery striking GATEWAY that imposes itself on you as you enter the City. Superb piece of Architecture very Ottoman in appearance.,Kyrenia Gate,"{'neg': 0.057, 'neu': 0.776, 'pos': 0.167, 'compound': 0.5719}",0.5719,pos
92,50,"Walking straight from the Byuk Han, you come to the Kyrenia Gate. This is a lively spot with cafes and shops. Also a good place to catch those convenient mini busses to Kyrenia and Guzelyurt",Kyrenia Gate,"{'neg': 0.0, 'neu': 0.796, 'pos': 0.204, 'compound': 0.7717}",0.7717,pos
93,40,An iconic symbol of the history of Cyprus this old Venetian period gate is very well preserved. Worth a look.,Kyrenia Gate,"{'neg': 0.0, 'neu': 0.789, 'pos': 0.211, 'compound': 0.5509}",0.5509,pos
94,30,"It's worth a look as all the mini buses to other parts of Northern Cyprus leave near the gate...it's not a towering gate, but very well maintained...",Kyrenia Gate,"{'neg': 0.04, 'neu': 0.796, 'pos': 0.164, 'compound': 0.533}",0.533,pos
95,50,"Considering it's stood on the site for 500 years and more, this is still a powerful reminder of times past",Kyrenia Gate,"{'neg': 0.0, 'neu': 0.865, 'pos': 0.135, 'compound': 0.4215}",0.4215,pos
96,30,"Visited northern side of Nicosia, up past the Kryenia gate, including a little walk across the green line into southern Cyprus.Beautiful buildings and architecture... sadly some in desperate need of renovation. Don't let the latter put you off visiting though as it adds to the character and feel...",Kyrenia Gate,"{'neg': 0.102, 'neu': 0.898, 'pos': 0.0, 'compound': -0.6249}",-0.6249,neg
97,40,"A nice piece of a history lesson. The gate which once lead to the beautiful city of Kyrenia! Lovely place to visit, especially on a sunny day!",Kyrenia Gate,"{'neg': 0.0, 'neu': 0.585, 'pos': 0.415, 'compound': 0.9344}",0.9344,pos
98,30,"Small gate, now tourist office when it's open, not really a nice area, bit dirty and untidy, none of the restaurants looked worthwhile going into, but we did and didn't eat my food. Walked around most of shops empty, rubbish everywhere, not well kept at all. Disappointed",Kyrenia Gate,"{'neg': 0.233, 'neu': 0.735, 'pos': 0.031, 'compound': -0.8747}",-0.8747,neg
99,40,"Now used as a Tourist office it is situated in the middle of a busy road, so by careful getting to it. They do have a good map of the Turkish side of the town with all the main attractions clearly marked. Some of the museums close at 3pm as they are run by the military.",Kyrenia Gate,"{'neg': 0.0, 'neu': 0.827, 'pos': 0.173, 'compound': 0.8511}",0.8511,pos
100,30,Seems like a tourist office !!! nice to see Islamic write ups which clearly mentioned the cross culture !!!worth for a walk !!!,Kyrenia Gate,"{'neg': 0.0, 'neu': 0.606, 'pos': 0.394, 'compound': 0.877}",0.877,pos
101,30,I was told before I got there that there were free tours of the city done by volunteers. I was enthusiastic and looked forward to doing the city tour. The office was closed to I took my own tour on foot. It was exceedingly hot and I did not want to wait longer or go back. It was a very disappointing experience for me since I was only in Nicosia for the day.,Kyrenia Gate,"{'neg': 0.064, 'neu': 0.847, 'pos': 0.089, 'compound': 0.4186}",0.4186,pos
102,30,"Well preserved northern entrance gate to Nicosia. A lot smaller than I was expecting and now detached from the city walls. Houses the tourist information office which is well stocked with leaflets, and the staff are very helpful.",Kyrenia Gate,"{'neg': 0.037, 'neu': 0.784, 'pos': 0.179, 'compound': 0.6997}",0.6997,pos
103,30,"Get all you city free guides here,although you have to persist to ask the assistants whoseem to be not pushed to be in position of tourist personel,too occupied on computers.The building is superb,situated in centre of road entering old walls,NOTE Look from here a few yards ito city centre on left is,WHIRLING DERVISERS MUSEUM,well worth token entry fee,not well advertised ,this ancient sect still practises its traditional Hypnotic dance,so meditating ,transfixing ,clear your haed and meditate while the music plays.This order congregates in main land with huge groups of dancers,promoting the Dervise.",Kyrenia Gate,"{'neg': 0.0, 'neu': 0.876, 'pos': 0.124, 'compound': 0.8807}",0.8807,pos
104,20,"It is the northern enterance to the old part of the city that is currently used as a tourist information kiosk. Nice addition to the city vibe when you walk by, but not interesting enough to go out of your way to see it.",Kyrenia Gate,"{'neg': 0.063, 'neu': 0.895, 'pos': 0.041, 'compound': -0.2469}",-0.2469,neg
105,30,"Moderately interesting, this is on your way into and out of Northern Nicosia.Worth a couple of minutes, taking pictures.",Kyrenia Gate,"{'neg': 0.0, 'neu': 0.863, 'pos': 0.137, 'compound': 0.4019}",0.4019,pos
106,40,Like the other gates it is a bit of history and well preserved. The walking tour of north Nicosia is supposed to start from here but be warned they are frequently cancelled. If they are follow the blue line and use the map from the office to point out the places of interest.,Kyrenia Gate,"{'neg': 0.087, 'neu': 0.791, 'pos': 0.123, 'compound': 0.2846}",0.2846,pos
107,50,"small but perfect. One day i want to be able to walk right around the walls, without the checkpoints :)",Kyrenia Gate,"{'neg': 0.125, 'neu': 0.622, 'pos': 0.253, 'compound': 0.5073}",0.5073,pos
108,50,"Its gate of old city, its not in use now a days but you can understand what was done the people for safety in history.",Kyrenia Gate,"{'neg': 0.0, 'neu': 0.861, 'pos': 0.139, 'compound': 0.5719}",0.5719,pos
109,30,"I was not that impressed by the gate taken separately, but it is a part of a self-guided walk you can find in ""City maps and walks"" in Apps store, and the walk in the old town is excellent. It covers several important churches and take about 1.5 hours of leisurely walk.",Kyrenia Gate,"{'neg': 0.032, 'neu': 0.836, 'pos': 0.132, 'compound': 0.756}",0.756,pos
110,50,"One of the three original gates which divide Nicosia in two parts, Greek one and Turkish one. Impressive monument. Once you cross on the other side everything change, different language, different coin, different way to live. Turkish people do not speak English and is easy to understand they are less rich. Perhaps not may tourists crossing over, even because you need a passport and you must do a daily visa.",Kyrenia Gate,"{'neg': 0.0, 'neu': 0.844, 'pos': 0.156, 'compound': 0.8958}",0.8958,pos
111,30,Coming south from Kyrenia you pass this imposing gate in the Venetian Wall. It is worth a brief stop for a closer look.at the vvvenetian and Ottoman inscriptions.,Kyrenia Gate,"{'neg': 0.129, 'neu': 0.804, 'pos': 0.066, 'compound': -0.2023}",-0.2023,neg
112,40,One of the ancient gates into the CITY of Nicosia and part of the Venetian Walls which surround the city. It is well worth a visit especially when there is an exhibition of any kind being staged there.,Kyrenia Gate,"{'neg': 0.0, 'neu': 0.821, 'pos': 0.179, 'compound': 0.7506}",0.7506,pos
113,20,"We was in this piace in the old center of town , this is ancient door , but gong be abandoned , better to visti ledra Street and Turkish border.",Kyrenia Gate,"{'neg': 0.122, 'neu': 0.761, 'pos': 0.117, 'compound': -0.0387}",-0.0387,neg
114,40,"The Kyrenia Gate is one of the Venetian walls' gates, the most known in the Turkish part of Nicosia. The attraction itself is not very big, now being used as an tourism information office. The architecture seems more Ottoman than Venetian, and the islamic inscriptions reminds every visitor abou the diversity of the city. Near the gate is a big statue of Kemal Ataturk and also the mini-buses (dolmuş) that connects Nicosia with Kyrenia (Girne) and Famagusta (Mağusa).",Kyrenia Gate,"{'neg': 0.0, 'neu': 0.962, 'pos': 0.038, 'compound': 0.4588}",0.4588,pos
115,50,Gate is part of the history of the Country worth seeing and also worth seeing attractions in the locality as well,Kyrenia Gate,"{'neg': 0.0, 'neu': 0.661, 'pos': 0.339, 'compound': 0.7717}",0.7717,pos
116,40,"Girne gate is now a tourist office. The staff speak English and I managed to obtain some road maps to help me drive around the northern part of Cyprus. Just by the doorway, there are some steps leading to a viewing around on the first floor. Worth a look!Girne (Kyrenia) Gate is one of the three original gates in the North part of the City Walls built in the Venetian period, allowing entrance into Lefkosa. The gate was built in 1562 and named the Porta Del Proveditore after the Venetian military engineer Proveditore Francesco Barbaro. A small domed watchtower was added to the top of the gate in 1821. The gate has inscriptions from the Venetian and Ottoman periods on it's Walls. In 1931, during the British colonial period, sections of the wall on both sides were removed to allow for traffic movement.",Kyrenia Gate,"{'neg': 0.0, 'neu': 0.924, 'pos': 0.076, 'compound': 0.8356}",0.8356,pos
