r_points,r_text,place
30,You pass the Venetian walls at various points as you enter the city of Nicosia. They have been integrated into the modern city and it provides an interesting contrast to the modern city. Some areas are undergoing work to restore the walls which is funded by the European Union.You don't need to take a tour. Most buses pass pass by and you can walk past at various points,Venetian Wall of Nicosia
40,"Amazing to see the walled city, what would of been enclosed is an amazing site to see. Lots of coffee shops and restaurants near by.",Venetian Wall of Nicosia
30,"Well restored and looking very neat. Quite extensive, but somehow not very exciting, and I was a bit disappointed. Good that they have made the effort to preserve the walls.",Venetian Wall of Nicosia
30,The Venetian Walls mark the boundary of the old city and circles it with the bastions (most of them used as parking lots or parks) every few hundred meters apart. At the time of my visit lot of restoration work was taking place and the only distinct gate was the Famagusta Gate on the eastern side.,Venetian Wall of Nicosia
40,"It is a location that was inaccessible some years ago, now cleaned and been accessible by foot. Bus stop very near. Give it some more time, because it is around all old part of Lefkosia (Nicosia), the walk being both informative, romatic, making you feel a part of its past.",Venetian Wall of Nicosia
40,These walls are probably far more effective as a tourist attraction than they would have been an effective defence of the city.An impressive landmark.,Venetian Wall of Nicosia
40,"They are visible from most areas, and stand tall and proud, but there are areas you wouldn't want to get to. As walls go, they're good in most places",Venetian Wall of Nicosia
40,If you are a history buff find time to learn the history of the many ancient walls surrounding the old city here.. so interesting to say the least.. passed them alot,Venetian Wall of Nicosia
50,"I have to say, before opening my description, that I am a local, inhabiting the south sector of Nicosia.The approximately 1.2km in diameter Venetian walls of Nicosia were built in urgency following the Ottoman attack of Malta in 1565, when it became imminently clear that Cyprus would follow in the Ottomans' plans of conquest.The architect Giulio Savorgnan and engineer Francesco Barbaro designed a star shaped ring of slanted walls and arrow/heart shaped bastions, with 3 exits/entrances (North, West and East) surrounded by a moat (having to reroute Pediaios river to fill it in need), that could easily protect the city and changing war strategy and technology of the time.Using materials mainly from the old and outdated medieval Frankish walls that extended along a larger perimeter, the walls were built in around 3 years, starting from 1567, but money ran short and so the richest of the families were asked to contribute to its completion in return for naming each of the bastions their family name. The walls were never quite completed and the city fell to the Ottoman siege in 1571.Since English colonial times, the walls can be crossed over in many places, unlike when they were built when everything was esoteric, and walks in the inner city are truly picturesque, to say the least, revealing of the rich layered history of the most continually inhabited city in the world, of over 4500 years.Of the original gates, the most visually attractive is the Porta Giuliana - or Famagusta Gate having been preserved and restored in its original glory.To be able to see the whole circuit of the city walls and float in and around the 24 Parishes of the mixed culture and religious native history, you will have to cross over into either the Republic of Cyprus sector or the Turkish Republic of North Cyprus (internationally unacclaimed but nonetheless real) so have your passport ready.Points of interest in the inner city vary, whether you are into architecture (eg. Famagusta Gate in the South sector, the Frankish 11th century St Sophia Cathedral known as Selimiye Mosque in the North sector, or churches and restored houses and mansions in both sectors, to name just some of the many worthwhile structures), museums or churches/mosques, sightseeing with scenic routes of narrow streets, or small shops and cafes/restaurants.Planned routes can be found in either side's tourist information offices, but make sure of the opening times beforehand.",Venetian Wall of Nicosia
50,Visit the walls yo meet he history of Nicosia.You can see the Famagusta gates the Paphos gates .a historical place to visit and you can having a Cyprus Coffe in the area around or you can have a nice lunch,Venetian Wall of Nicosia
50,"This place just took my mind, the cool breeze and the warmth of sun was superb.I really loved visiting this place, having a Cyprus Coffee here.",Venetian Wall of Nicosia
40,Well worth seeing along with the Famagusta gates. It gives a sense of protection back then. Keeping the ancient city secure. The walls look pretty solid still.,Venetian Wall of Nicosia
50,A rare opportunity to meet with the past. A historical place worth visitingA great wall surrounding the city of Nicosia build hundreds of years ago,Venetian Wall of Nicosia
50,"Nicosia's Venetian walls are one of the best well kept Walls in the world. The Venetian Walls of Nicosia, constructed in 1567, encircle the old city and it is a cultural heritage of the city. A must see when visiting Nicosia",Venetian Wall of Nicosia
40,Good historical walk.Parts of the walls are surrounded by grass.Nice to sit and take a break.Saturday farmers market is a good visit to see a somewhat bygone Cypriot era.Maps explaining the wall and its gates is very useful.,Venetian Wall of Nicosia
30,"The best examples of the walls we saw were near the Famagusta Gate (although the gate itself is nothing special). It's a little out of the city centre, so not for those visiting with time limitations.",Venetian Wall of Nicosia
20,"You even pass the walls without seeing them when you're not attentive,and this not only through the big infrastructure works. Nicosia is not the real place to be when you visit Cyprus. It has no soul, no fire. The old town is not so old, 1930's. I personally was very disappointed to make the trip.",Venetian Wall of Nicosia
40,"Well, for us is a lovely place to see and visit. These walls separate the ""old"" city from the ""new"" city... of Cyprus. I am not going to do a write up for its historical value since you can get this from million places.",Venetian Wall of Nicosia
50,Walls in great condition as are the old city gates only downside is the length of time being taken to renovate eleftherias square many lovely old buildings to see including old archbishopric and Turkish baths and hammam,Venetian Wall of Nicosia
30,"The venetion walls are stunning and mostly in very good condition, indeed the whole walled city is an excellent example of a large late medieval walled and fortified city. Sadly it is spoiled by partition, and most recently by a monstrous vanity project in Eleftheria Square. If only the vast sum spent on this carbuncle had been spent sprucing up decaying parts of the inner city!!!",Venetian Wall of Nicosia
40,If it were not for the amount of construction work taking place near to large sections of the wall it would be even better. You can appreciate the architecture at certain locations.,Venetian Wall of Nicosia
50,Obviously you cannot go all around the walled city because it is cut in two by the Green Line but it is a wonderful wall to admire and walk along. It is amazing what the Venetians were able to do. Wortha visit to see.,Venetian Wall of Nicosia
50,these walls have always fascinated me! whenever I look at them it travels me to the Venetian times although I would have no clue how they were :)I would recommend to any traveler to walk along the walls to see all angles of them,Venetian Wall of Nicosia
40,The walls are sorounding the old Nicosia city the only devited capital city in Europe. Unfortunately following the Turkish invation in 1974 almost have of the walls are not available to visit because of the Turkish troops in Cyprus.,Venetian Wall of Nicosia
20,"The Venetian Walls of Old Nicosia have long been neglected. They symbolise much that is problematic both in the past and now that the city is divided. It's impossible in a short review to cover everything but the walls, like many things in Cyprus, were ineffective and the capital was quickly overrun. The old centre could be a wonderful place for locals and tourists with the Walls integrated into an overall plan. The current development of the square straddling the main entrance to the town will obscure and negate the Walls. Pity.",Venetian Wall of Nicosia
50,"This city is well worth a visit and recommend you take your Passport. The City is divided with full Passport Controls on both the Greek and Turkish side with a No Mans Land. Experience both the Greek and the Turkish sides of this great divide. There are a lot of walking, around the areas you will come to a dead ends and blockades so have your walking shoes on. We found the whole experience amazing, upsetting, educational and sometimes confusing and to be able to fully appreciate what is going off this is one of those must visit sites.",Venetian Wall of Nicosia
40,"The size and scale of the Venetian walls makes them an ever constant sight in moving around the old city of Nicosia. The various Bastion contain a variety of other sights well worth a viewing, such as the Liberty Monument. The various gates add interest and aid the imagination in understanding how access to the old city was controlled in the past.",Venetian Wall of Nicosia
30,You can walk there on the way to the old city street.Nice place with shops and resturants.Must go to see the border!,Venetian Wall of Nicosia
50,"You must aee, amazing nicw and centeal located spot. You can see the south part in half hour and also the north easy",Venetian Wall of Nicosia
40,"it an old venitian city wall , well preserved in most of the locations and spread in various locations in nicosia, it's worth a quick visit to take photos and admire this durable structure...",Venetian Wall of Nicosia
40,I visited this with a Venetian friend and he was amazed by the walls. What was great for me was the level of preservance and size.,Venetian Wall of Nicosia
40,Nice to see the Venetian walls around the whole city. You have to go under a bridge to get in. Special experiance,Venetian Wall of Nicosia
50,The walles of old Nicosia are really worth while visiting. Superbly restored they offer an exciting glimse into the past. Go through the Famagusta Gate and you will experience the width of the walls that defended the city against the Turks.From the walls look down on the moat and imagine running the gauntlet of shot and arrows to place a ladder and climb up the facade of the battlements. Early morning or evening is best in the summer.,Venetian Wall of Nicosia
40,The walk along and on the walls gives you a nice overview of the city's different faces. We did particularly like the part around the Liberty monument from which you have a nice panorama up to the mountains.,Venetian Wall of Nicosia
40,There is sooooo much to see and visit in this wonderful city. I could have stayed a week just here!! Next time I will!,Venetian Wall of Nicosia
40,"These walls round the city are extensive and give a tight knit feeling inside the walls that, on both sides of the divide mKe modern Nicosia such an interesting city. In the south work is going on to modernise the most areas in place. This is very welcome as there has been a dilapidated feeing in the past. There are significant car parks just inside the wall - I paid €3 for 4 hours by the Tripoli fort next to the main bus interchange.",Venetian Wall of Nicosia
50,The walls of Nicosia are its main landmarks. They surround the old part of the city and separate it from the modern part. It is impossible not to come across or see them once in the city.,Venetian Wall of Nicosia
50,The walls reflect the history of the passage of the Venetians and is a fairly well preserved monument . It is centrally located and has access to public transport.,Venetian Wall of Nicosia
40,Always fascinated by history and the walls here do not disappoint. You can drive around the area or walk through Old Town to see the walls.,Venetian Wall of Nicosia
30,You will pass the wall on the way into the city of nicosia.Not that much really to see and do on the wall.But those that are intrested the sheer size is worth a closer look.,Venetian Wall of Nicosia
30,The walls are seriously impressive but feel a bit under whelming as there appears to be no effort made to make full use of them.,Venetian Wall of Nicosia
30,"The walls of Nicosia are amazing, having been completed in 1570, just in time for the Ottoman invasion. The walls didn't end up protecting the city and you will probably be frustrated with them too. Because Nicosia is divided you can't easily take a tour of the walls. The other problem is that they are surrounded by busy streets, so getting close to them means breathing fumes and being alert to Cypriot drivers, who are not the safest and most polite on the planet. Construction projects, both on the surrounding roads and in the moat of the fortifications also will stop you from admiring this fine example of middle aged military architecture.",Venetian Wall of Nicosia
30,"Nicosia is surrounded by intact walls.Thre are gardens around and parking places.Not very impressive, but nice for a stroll.",Venetian Wall of Nicosia
50,We saw parts of the Venetian Walls of Nicosia. If we had the time we would have tried to walk around all that are standing / accessible and gain a true perspective of the city. One reason to return!. A good pair of shoes needed in places!,Venetian Wall of Nicosia
40,Like most Greek Islands; the Nicosia City was surrounded by a protective wall originally built with 11 gates; the walls and gates in the Greek part of the divided City are well preserved and are used for many regular Events and Exhibitions; it is under continuous development to enhance the historic value of this structure.The walls embrace the old Nicosia; with very narrow streets; many were turned to a lively pedestrian area with hundreds of shops and restaurants; the houses were all rehabilitated while keeping their traditional image.,Venetian Wall of Nicosia
50,The walls are a stunning juxtaposition to the modern city that has grown upon and around its ancient foundations,Venetian Wall of Nicosia
40,"The walls are well preserved, incorporate them in your walking tour itinary but ensure you get a map and guide.",Venetian Wall of Nicosia
40,"Venetian walls was built around the old town. When you use google map you will see exactly as they surrounded city. Today only a part of the wall remains, but they look amazing.",Venetian Wall of Nicosia
30,"Strange that the only capital city in Europe to remain divided (between Greek and Turkisk Cypriots) should contain medieval walls which span the two sectors. Built by one of the many occupying forces, in this case the Venetians, the walls encompass the old town with its bars, cafes and shops. The walls include parks and entertainment areas and the most active is the Famagusta Gate. Worth a wandering exploration.",Venetian Wall of Nicosia
40,This is a beautiful old city with vibrant cafes and shops.Walk across the border to the occupied area to see a different lifestyle. Good shopping and sightseeing.Remember to take your passports with you to cross the border.They will accept all currencies but be careful with the exchange rate.Nicosia is the only city in Europe which is divided.,Venetian Wall of Nicosia
30,"Can't miss them. All around Nicosia, occupied and free, well preserved, either used as parking place or as amusement place for kids and other ceremonies and festivals. Summertime most visited nighttime on an occasion of music concerts and seasonal festivals.",Venetian Wall of Nicosia
50,4.8 klm with 11 bastions 3 entrance gates.The most impressive isFamagusta gate that is used as a culturai centre,Venetian Wall of Nicosia
40,"The Venetian walls have been maintained well and interesting to see how some parts have been turned into gardens and even a car park! As so close to other attractions, worth seeing.",Venetian Wall of Nicosia
50,"I just love these walls the alwYs look so impenetrable and are sitting there right smack in the middle of a city,They really are worthy of a visit,",Venetian Wall of Nicosia
30,The walls are less impressice than I thaought. In some parts works were going on and it was very noisy. Probably it will be a good place for recreation,Venetian Wall of Nicosia
30,"When visiting a place that has walls can only mean one thing; that the place is rich in medieval history. The walls are an ideal example of the Renaissance in the Eastern Mediterranean. The fortifications were built by the the Venetians in order to protect the town from an Ottoman attack. However the Ottomans attacked the island during the Fourth Venetian-Ottoman War and were able to breach Nicosia in a three-month siege when the walls were incomplete. I believe that if the Venetians had the chance to complete the walls, they would have more time during the siege to bring some reinforcements from mainland Italy... It is really worth it to walk around them for half an hour and take some pictures.",Venetian Wall of Nicosia
30,Walls around cities are pretty neat we have seen a few now these aren't the best nor the worst either Took photos so did make an impression Walked along them for a bit too,Venetian Wall of Nicosia
50,"Following the path of the ancient Venetian walls of old Nicosia is a real treat. Start from near Famagusta Gate and follow them all the way around to Paphos Gate, and then if you like, continue on to reach Kyrenia Gate... It is a real treat!",Venetian Wall of Nicosia
40,"Walls built to withstand an invasion that they finally didn't manage to withstand. And in the end, were used against the very people that ordered them built. Plus, so many more fascinating stuff to learn about these Walls. Also, beautiful in the evening!",Venetian Wall of Nicosia
30,But not so high as you might have imagined. See them from both sides and walk a bit along them to have a real feel for it.,Venetian Wall of Nicosia
30,"I have been visiting this old city for years and today I have noticed that the enjoyable walk around the walls has been ruined by the low level of maintenance and rubbish laying around, if in the old city make sure to visit it but I was disappointed today .",Venetian Wall of Nicosia
40,Visted Nicosia several times but never befoe walked to length of the walls. Start oa Paphos gate and end at Famagusta gate.If you have your passport wlak through Ledra street and do the Turkish occupied area.,Venetian Wall of Nicosia
50,"Lovely place to visit with the old walls and narrow streets. There are lovely shops and restaurants, best shops in the are close to Tourist Information Office, they are tucked away.We visited the Turkish side of Cyprus, we passed through the checkpoints very quickly, passport needed. Really enjoyed seeing the two very interesting halves of a city.",Venetian Wall of Nicosia
50,its very nice place for understanding What happened in island history. there are many places for small gift.,Venetian Wall of Nicosia
30,We have driven past many times without actually going inside the gardens. We hope to remedy this one day,Venetian Wall of Nicosia
30,"the wall kind of separates the old town from the hustle bustle of the city. the wall is broken at places, ends at the border between the Greek and Turkish parts (the part controlled by the UN in between)",Venetian Wall of Nicosia
50,"During our free walking tour we walked along quite a bit of the walls. The green line cuts roughly straight through the middle, with observation points dotted along the line. The walls were built in the mid 16 century by the Republic of Venice, with three gates and a moat that was never completed to protect against Ottoman invasion. That didn't work. Witness 300 years of the Ottoman empire in Cyprus. In the 19 century access was cut through near Paphos gate by the British and more access later which we see today. Incredible feat of engineering accomplished in just 3 years by the Venetians.",Venetian Wall of Nicosia
50,A very impressive sight taking you back in time for history lovers cross to the north to see Bayuk HanIt is hard to believe these walls are so old worth the visit,Venetian Wall of Nicosia
50,These ancient Venetian walls encompass the whole of the old part of Nicosia and are amazingly well preserved. Don't forget to take your passport if you want to walk round the walls in the north of Nicosia as these are still under Turkish control. It is now quite easy to access the northern parts from the end of Ledra Street.,Venetian Wall of Nicosia
40,"These walls have been affected by Nicosia's development over the years but there are sections which have been retained and regenerated, particularly in the south and eastern part of the town close to the Famagusta Gate. The walk around the top of them is pretty good and some of the views are impressive. They certainly give you a feel for the height and the security they must have offered the town in years gone by. However, there is not a great deal left so perhaps take them in between the Liberty Monument and the Famagusta Gate to see them possibly at their best.",Venetian Wall of Nicosia
50,"Best time to walk is during the evening just before sunset.1. Start from Pafos Gate. Its now restoring and soon to be open. Its also a good place to ""feel"" the green line that divides the city.2. Continue to Solomou Square where is the Central Bus Station. You get a closer look to the walls3. At D'avila Bastion is the Town Hall, a neoclassic building. Also you get to see Jean Nouvle's Tower 25 and soon Saha Hadid's Eleftheria Square.4. Next is Constanza Bastion with me mosque. Down the walls usually events happen like Nicosia Beer Festival or Christmas Market Park5. Podocatoro Bastion is visitable also during the day as there is the ""Freedom Statue"". During the afternoon and evening have a look down where the Park-Festival Venue is for some events, dogs playing or even couples6. End is the famous Famagusta Gate. The best way to end especially if there is some exhibition going on .",Venetian Wall of Nicosia
50,The walls are really impressive surrounded by an amazing garden. We went there for a wedding reception. Parts of it are available for receptions. Really impressive from the inside too.,Venetian Wall of Nicosia
50,"So nice to be able to enjoy a nice and relaxing walk along these walls, watching people talking and children playing. And of course admiring the strong Venetian architecture.",Venetian Wall of Nicosia
40,"If you are expecting a pedestrian walk only in the narrow streets of the old city inside the Venetian walls then beware! Bikes and cars seem to think they can park and drive anywhere and the tractor train.Crossing the green line is now a lot easier (July 2015), only need to give passport to be scanned at both check points as visa not now required. Make sure you get it scanned at both check points or you might be in trouble! Don't take photos around the greenline!Temperature is a lot hotter in Nicosia but dryer so not so tiring as the coast with it's humidity.",Venetian Wall of Nicosia
40,"We visited the walls which surround the old city of Nicosia in April, and we took a walk around and within the trench in the south part of the old town, below Stasinou and Salaminos street.It was really nice, and the most appropriate time to visit is in the evening, in order to avoid the heat of Nicosia.",Venetian Wall of Nicosia
50,"This is the original Venetian walls built around the old city of Nicosia in 1567. They are continually being restored and even though they are in the middle of a busy, modern city, they are still well preserved and worth a visit.",Venetian Wall of Nicosia
40,Walking around the old town's walls gives you a good idea of how a medieval city would defend it self. Exploring the bastions and soon after walking beside the Famagusta gate sort of made me feel like I was travelling back in time. Good for people interested in medieval history and who enjoy walking. In my opinion the area is a bit underdeveloped; the bastions would make good places for public displays telling the history of the town.Sadly you can't fully explore the walls due to the city being divided.,Venetian Wall of Nicosia
50,"The traffic can get in the way, but try to walk around the walls to get an idea of the size of them. Some of the bastions are clearly visible.",Venetian Wall of Nicosia
20,The Venetian Walls are totally unimpressive like a lot of things in Nicosia. In fact while looking for the walls we parked our car next to the wall without realizing as it is now an official car park.,Venetian Wall of Nicosia
30,"The walls embrace Nicosia, both the Southern and Northern sections. They are hardly visible from ground level, as they rise up from the once moat just outside the walls. When approaching from outside, one can see the real size and significance of the wall that was supposed to protect the city of Nicosia from regularly arriving invaders.",Venetian Wall of Nicosia
