r_points,r_text,place
40,"The wall is well preserved and now they are creating new park and walking areas. It’s interesting to view also the gates Nicosia gates, Famagusta gates etc",Venetian Wall of Nicosia
40,"The longest preserved medieval walls in Europe, surrounding the entire old city. It has three gates and eleven bastions.Although in good condition, they can be seen only from the ouside of the walled city and around bastions. The fact that you walk upon them is impressive.",Venetian Wall of Nicosia
40,We enjoyed our little walk around old Nicosia. We stumbled by an outdoor market where farmers were hacking there produce that was situated by the wall. A soccer match was being on a field within the walls it was a cool find,Venetian Wall of Nicosia
30,"You can walk not quite near it because most of it is under construction, so let's say it is nice, but it isn't anything special. We walked for about an hour and finished it. Make sure it wasn't raining days before, because there is no trail on some parts, just grass. However, you can see also a part of the old town (just some ordinary streets but it looks nice). We ended it at Famagusta gate.",Venetian Wall of Nicosia
50,Well preserved ancient wall surrounding the old city. You can see it by naked eye. Interesting to be viewed mainly that it is renovated and compounded with new and old building surrounding the area,Venetian Wall of Nicosia
30,"To be honest, I was a bit disappointed with the Venetian walls of Lefkosia (Nicosia). On any map of the city, the circular but slightly odd star-like (or snowflake-like) shape of the wall lulls you into a sense of thinking that the walls something magical, a great stone construction that defines Nicosia and provides an amazing tourist attraction to its visitors.The walls form a border around Lefkosia’s Old City, and were built by the Venetians in the 16th century. They were built of mud brick, with only the lower part buttressed by stone. When the Ottomans occupied Lefkosia, they repaired the walls and covered the upper part with stones. The walls were fortified by eleven heart-shaped bastions and protected by an 80-metre wide moat. Five of the bastions, Tripoli, D’Avila, Constanza, Podocataro and Caraffa, are in the southern sector of Nicosia (Lefkosia). The Flatro Bastion on the eastern side of the Old City is occupied by Turkish, Greek Cypriot and UN military forces. The remaining bastions, Cevizli, Musalla, Cephane, Zahra and Kaytazağa, are in North Nicosia (Lefkoşa).The reality of the walls being a major feature of the city is somewhat overstated, from a tourist point of view. Whilst the walls are still largely intact (apparently), they are in places really difficult to see and appreciate, and carparks. the bus station, and various constructions seem to blot out the grandeur of this fortification, (or example the new modern entrance to Ledra Street at the D’Avila bastion where the Town Hall, and a curious glass sculpture, is located. You can’t walk around the walls in its entirety, as the Green Line and the eyesore that is the buffer zone prevent a complete circumnavigation of the wall. There are no crossings on the wall between Lefkosia and the Turkish-occupied north. The moat no longer exists, and is now used for playing fields and carparks.In Lekosia I followed the road on the top of the wall as far as I could, from the Pafos Gate in the west, to the Green Line in the east, just beyond the Caraffa bastion. The best spot to really see and appreciate the grandness of the construction was on the stretch between the Podocataro bastion and the Caraffa bastion, where you’ll find the Famagusta Gate. Here, the sheer height of the wall, and its solid construction, are clearly evident. Walk down Plateia Archiepiskopou Makariou, so you can look back up at the walls, as it’s a really good spot to appreciate the sheer strength and enormity of this Venetian construction. The walls seem to be really well preserved here. The two ‘gates’ which I’ve mentioned - the Pafos Gate beside the Kaytazağa Bastion, and the Famagusta Gate at the Caraffa bastion deserve more than a cursory glance, and I’ve reviewed them separately. The bastions are built upon, with public buildings, mosques, and the occasional grand statue (the Liberty Monument on the Podocataro bastion is interesting).In Lefkoşa (the occupied north) it was even more difficult to get decent views of the Venetian walls; I saw a stretch by the Kyrenia Gate which was nicely preserved.See what you can, and enjoy!",Venetian Wall of Nicosia
50,"They surround all of Old Town Nicosia, both on the South and North side. You can walk around the enjoy the views.",Venetian Wall of Nicosia
50,Very impressive medieval monument in both sides of NicosiaVisit the 3 gates and walk in the park of the moat in the south west part of the city,Venetian Wall of Nicosia
50,You can see them driving or walking in a long way all over across the old city and the city center of Nicosia.,Venetian Wall of Nicosia
40,"Interesting to see these historical walls that surround the main city. Must have been a lot of hard work for the people who built them many years ago, but I would imagine they did the job of keeping the city safe",Venetian Wall of Nicosia
50,"The fortress of the city were designed and built five centuries ago. Beautiful design but ineffective and non functional during a battle, they finally couldn't protect the Venetian army from the Ottoman invasion. Good example of a beautiful and artistic design but not useful for the purpose of creation.",Venetian Wall of Nicosia
40,"The venetians did a good job, this walls are the best preserved Renaissance fortifications in the Eastern Mediterranean",Venetian Wall of Nicosia
40,Visit the Leventis museum first which explains the history of the city walls and then go and have a good look. The bastion style was (apparently) the template for all bastioned city walls after that!,Venetian Wall of Nicosia
20,"Nicosia is suffering from incompetent municipality for more than 15 years. All main areas are dying, venician walls are not an exception. Advice to the mayor: visit Luca in italy then may you understand me",Venetian Wall of Nicosia
30,"Impressive enough in their way, but much modified over the centuries. The gates are, I think, the best features.",Venetian Wall of Nicosia
40,These massive defensive walls still surround the historic inner city of Nicosia for4.5 kms.Buttressed by 11 bastions and featuring 3 city gatesThe Venetians built the walls and controlled Cyprus from the end of the fifteenth century for less than a century before being captured by the Ottoman Turks.,Venetian Wall of Nicosia
40,Most of the citizens still dont know how amazing are those imposing venetian walls that surrounds the old city of Nicosia...after all this yrs and still in very good condition...just take a walk to see them,Venetian Wall of Nicosia
30,"Very impressive from the historical and architectural perspective, miracle they’re still there. However, they didn’t strike a particular impression on me in the divided city with more walls, barriers and fences. Also, not sure it was possible to walk on any stretch of the wall maybe for som nice views of the city?",Venetian Wall of Nicosia
40,"The walls tell a history, not just walls. Imagine that Nicosia was so different at the time and these walls were protecting the inhabitants.Let your imagination take this journey.",Venetian Wall of Nicosia
30,"Built in the Middle Ages, these defensive walls seem incredibly well-preserved! Other than that, nothing spectacular about them.",Venetian Wall of Nicosia
30,"If you go to this city by bus the station is right beside a portion of the ild walls, if you shop or go inside the walls you will see the walls.The design , circular with arrow shaped bastions were the innovation added to the older walls, these were built about the same time as the fort in San Juan, PR was.",Venetian Wall of Nicosia
40,"The Venitian Walls wind around Nicosia like embracing arms. The Walls were pertection from medieval harm. It's magnificient architecture and strength allowed enterprise and safety in the city. Just imagine in the 1600's, living in such a protected nice place.",Venetian Wall of Nicosia
30,"Sorry, someone once said if you seen on wall you've seen them all! Only saw a short section and they are impressive but greater Nicosia hides what would have been a great site from the outside.",Venetian Wall of Nicosia
40,"The walls are in good shape, they are definitely worth visiting. They are spread throughout a larger area.The only thing that bothered us was the fact, that there are a lot of construction sites nearby.",Venetian Wall of Nicosia
50,It is amazing to see the ancient walls standing there in pretty good condition. It looks very beautiful from the map.,Venetian Wall of Nicosia
40,"If you go to Nicosia, you will unavoidably see those walls during one of your walk at the circumference of the city! Dated back to the Venetian occupation of Nicosia, they are the testimony of that period and some of the doors which used to provide access to the walled city are still standing (notably the Famagousta gate).",Venetian Wall of Nicosia
30,"I think the historic Venetian walls was not as woo as I expect. Maybe this is due to the post-war destruction and the walls didn't rehabilitate and show more shocked history as I saw in the museum. I saw people would walk their dogs along the wall and the dogs pee somewhere in the shadow along the wall. That made me feel.......less exciting for this. I walked for 30 mins back and for to try to see the whole view of this wall but the direction was quite messy and unclear. If you really wanna take a look, go ahead but don't expect too much.",Venetian Wall of Nicosia
30,"This walls are a testament of the Venetian occupation that existed in this area, as very few other 'remnants' exist on the island.They are well built, no wonder they can be seen even from the satellite view.",Venetian Wall of Nicosia
30,"Venezia, Pietro Naratovich tipografo editore. Venezia, 1853. Venetian walls of Nicosia Famagusta Gate Siege of Famagusta Kingdom of Cyprus Stato da Mar",Venetian Wall of Nicosia
50,The walls represent the most advance technology of their time for defence. Constructed by Italian architects to protect the city.,Venetian Wall of Nicosia
30,Not sure I would go to see just the walls but as part of a day in Nicosia you should look. Better signage would really improve it.,Venetian Wall of Nicosia
50,"The very first thing when in Lefkosia is to walk around these Venetian walls and imagine how was the city like in medieval times. Visit the three main gates, especially Famagusta Gate.",Venetian Wall of Nicosia
40,but sadly breached by the Ottomons! Looked very robust and magnificent . Imagine water in the moat! Most amazing!,Venetian Wall of Nicosia
30,"A great piece of history but I found there to be a lack of signage. If a friend hadn't told me what they were,I would have assumed they were just part of an old wall that was now surrounding a car park!The lower grounds have some park areas. Most of the time there were just locals laying around and smoking! Not the sort of area is let children play",Venetian Wall of Nicosia
40,Its surprising how good a condition these walls are in. Its certainly different from the usual ruins one finds across Europe. Well done Cyprus.,Venetian Wall of Nicosia
20,"the walls are long and nice. But we could not find an entrance. Finally, we went through some stairs and found an 'entrance' but we were disappointed since the area around the walls is not clean, there are 'strange' men walking around, dog waste, waste in general. The municipality must clean the place and find some use of it. I would not dare to walk there in the evening. must be dangerous and scary.",Venetian Wall of Nicosia
50,The walls are well maintained and it is impressive how they have been incorporated into the city and how the city has adapted to the walls. The shape the walls form is amazing. There is a lot of history packed in these walls!,Venetian Wall of Nicosia
10,"Well the walls are somehow incorporated into the city layout, accomodating parkings, parks etc and not being treetead as a landmark. Can't say it is worth passing by.",Venetian Wall of Nicosia
50,"This is like a small park where you can go and just relax or even a small picnic with friends. And if you are a dog lover, your dog will love this place.",Venetian Wall of Nicosia
40,"The Venetian walls of Nicosia are an incomplete fortifications built to defend the city. The walls have a circumference of 5km, and contains eleven pentagon-shaped bastions named after eleven noble Venetian families of the city. Sadly the fortifications were not completed before the Ottomans invaded.Sections of the walls and the gates can be seen in the divided city. Hopefully the walls can one day encompass the city undivided.",Venetian Wall of Nicosia
40,We can only hope that one day it will be possible to walk all around these magnificent walls without the present problems. Ironically both sides have had E.U. funding to help preserve them.,Venetian Wall of Nicosia
40,"Part of what makes the old city of Nicosia so fascinating is the Venetian Walls. They surround the city (both sides) and are intact today, centuries after they were built for defensive purposes.On the west Turkish side, there are some restaurants where you can eat atop the walls and look out/down through barbed wire into Cyprus.",Venetian Wall of Nicosia
40,"Having fallen once from almost the top, i can certify that the Venetians new their stuff. I used to climb at a certain point - in order to shortcut close to Famagusta Gate, before repair work has been done to extensive parts of the wall, to repair them in their original form. One of the best examples of 16th century Military Architecture",Venetian Wall of Nicosia
30,Big walls for a walk around the city. Not good if the day is rainy. due to muddy ground. Well preserved.,Venetian Wall of Nicosia
50,"(May Allah have mercy on his soul) is a local researcher and a great admirer of Nicosia, his hometown. In his book “Nicosia of Yesterday and Today” he skilfully and accurately describes the historic walled city, her neighbourhoods, ancient monuments, old houses and gardens etc while he paints a vivid and detailed panoramic view of the modern present day Nicosia.Guy de Lusignan, King of Jerusalem, who bought Cyprus from the Knights Templars, who had bought it from Richard the Lionheart, brought many noble people from Europe and Jerusalem to the island to whom he allocated land that belonged to the Orthodox Christians of the island. The indigenous people became serfs under the feudal system introduced by the Frankish rulers, with hardly any rights. Nicosia was proclaimed the capital of the Kingdom of Lusignans. In due course the ruling class amassed a huge wealth, a great part of which was expended to develop the city architecturally. A lot of palaces, mansions, monuments, hundreds of churches including Saint Sophia Cathedral and monasteries were built. The Lusignans also surrounded Nicosia by walls with gates as the part of the fortifications of the city. However the Venetians were not impressed by what the Lusignans had done for the city as they wanted to control Cyprus for purely military and economic reasons. The island’s strategic position enabled them to dominate all eastern trade routes and Cyprus was also a rich source of good timber for shipbuilding, an important asset for a maritime state. So the Venetians were more interested in increasing the defensive capability of Nicosia in case it was attacked by the Ottomans. Therefore they destroyed a large number of the original Lusignan buildings including about 80 churches to construct new fortifications which they thought would stop the Ottoman army from conquering it.During the Lusignan rule when a group of pilgrims were on their way home from the Holy Land they came to the island as well and visited Nicosia. The King was very welcoming towards them and he provided them with decent accomodation and also gave them a gift of one hundred fowls, twenty sheep, two oxen, four vessels of a very good red wine, four skins full of a very good Marboa wine and plenty of very good white bread. The French nobleman Orient D’Anglure notes in his memoirs that four days later, on 9th January, the King sent them presents again including one hundred partridges, sixty hares and five wild sheep. The generousity of the King is an indication as to how rich the city had become albeit at the expense of the local people.Although Nicosia was surrounded by walls it had many gardens that were planted with citrus trees such as lemons, oranges and pomegranates; grapes, vegetables and potates etc. The gardens were irrigated with water drawn from wells. A large amount of land was also available to grow grains such as wheat and barley. The walled town abounded with cypress and date palm trees. However the wealth of Cyprus in general and Nicosia in particular decreased by a substantial amount during the Venetian rule as 2/3 of the tax revenue was sent to the Republic of Venice. The state of the city was not any better during the early years of the Ottoman rule. Although the Turks built a number of inns, baths and fountains and new bazaars and introduced improved handcrafts such as weaving and leatherworks that helped the town to continue to be a commercial centre it actually took many years for the city to re-capture its glorious Lusignan past.",Venetian Wall of Nicosia
40,"The Medical Walls are evident in some places and have been built over and incorporated into the city in other locations. The ""green line"" divides the wall and ramparts between the Cypriot Greek and Turkish sides. There are three main gates, Paphos and Famagusta on the Greek side and Kyrenia on the Turkish side. In some areas, the UN barrels and barbwire is evident.",Venetian Wall of Nicosia
40,To see the high thick walls that once kept the city safe is like going back in history. When we were there there was a large state ceremony going on with many dignitaries and high stepping military officers bearing many flags - interesting and from another world.,Venetian Wall of Nicosia
30,"Well I guess what is special about them is that they are still there. The idea of bastions is pretty normal in several walled European cities, but most are gone. These are still all there, but are sort of unobtrusive, since the are not high, they more or less develop a dry moat . For me the inteesting aspect was how they morphed form Greek to Turkish side. The Greek Cypriots seem to invest a lot in fixing them up, creating a park like area around them and using the rest for parking lots. There are some remaining gates, which are modestly interesting.",Venetian Wall of Nicosia
40,These defensive walls surround Nicosia and were first built in the Middle Ages. They were then rebuilt bythe Venetians in the 16th. century.,Venetian Wall of Nicosia
40,"While in Nicosia for sure you ll love and enjoy the walking there old wall which protected the city long time ago , you ll feel the peace and for sure you are going to love the city , go learn watch and see as I did for sure you ll be part of the place and the history.",Venetian Wall of Nicosia
50,"Most of the walls on the Turkish side are very run down and haven't been properly looked after. However, this is not the case on the Greek side as they seem to be in much better condition. I walked the whole way around the walls on both sides of the checkpoint and this is well worth doing if you have the time as you then do not miss anything worth seeing.",Venetian Wall of Nicosia
40,Interesting sight in Nicosia that can't be missed if one is driving around the city. One runs right into it on any visit through this city.,Venetian Wall of Nicosia
40,This wall is located on the eastern side of Nicosia Historical District. This wall is close to several attractions within walking distance,Venetian Wall of Nicosia
40,Amazing what could be achieved hundreds of years ago - and the fact that they survive to this day is testament to the quality of the work.,Venetian Wall of Nicosia
40,"Big majestic walls that surround the old part of Lefkosia. It's nice to walk past them, and be able to see the medieval side of the city, and the views from the pavement of the walls and underneath are very pretty. Nice for photo taking, although maybe they could be a little more interesting. We didn't walk down and around them, just on the pavement up above, but you can if you want to. Continue on, and you will reach the liberty monument. Worth it for a stroll around!",Venetian Wall of Nicosia
20,"This is about the only attraction you can see in the town without a passport, you must take it if you want to get into the more interesting side (on the Turkish side)",Venetian Wall of Nicosia
50,"Walls are now being refurbished, yet you can imagine Old Nicosia during Venetian times, the fortress is impressive.",Venetian Wall of Nicosia
50,"Fortification walls and castles in Cyprus we have from 7th century AD onwards due to the Arab raids.The Franks rulled Cyprus from 1192-1489.They had rectancular stone walls with 12km perimeter.When the Venetians took over Cyprus in 1489 reconstracted the walls in 1567.It was Juliano Savognian who did the reconstruction. He demolished the Frankish walls and came out with round shape walls 5.5 km perimeter and 11 bastions , representing the 11 provinces that the Venitians devided Cyprus at the time. The moat , today converted into paking places, tennis courts , football stadiums and places for different activities.",Venetian Wall of Nicosia
50,"The Venetian walls of Nicosia are impressive and history is evidenced here. The area is currently under reconstruction and expected to finish in the next months. The end result is planned to be amazing....!!!Visit in the area should be combined with drinking a cup of coffee, and/or eating an ice cream, and/or enjoy lunch, etc.",Venetian Wall of Nicosia
40,Not a lot to look at but the history is interesting as the walls are the original walls built by the Venetians when they were governing the Island of Cyprus.,Venetian Wall of Nicosia
50,Have a walk into the history by seeing the old walls of the old city of Nicosia and have an exciting once-in-a-lifetime treat!,Venetian Wall of Nicosia
50,When you walk into old town you can see the walls throughout. Surrounding the city. So much to do inside the walls,Venetian Wall of Nicosia
30,walls like any other old walls. important is what is inside; two different worlds separated by wires...,Venetian Wall of Nicosia
40,"These Venetians were really busy building defensive walls wherever they went! And so it is with the city of Nicosia. The Venetian presence is quite strongly felt with these huge fortification walls covering a large section of the city, but also serving as some sort of dividing line between the two communities living there today. The Greek and Turkish populations have never really had anything to complain about against each other as they lived happily enough for many years side by side. Unfortunately politicians, as is usually the case everywhere, have decided the fortunes of this city, and the whole island. It is worth coming to this place just to have a look and make up one's mind.",Venetian Wall of Nicosia
30,It is interesting because of its history but not an awful lot to see. I have viewed from both the Greek and Turkish sides and good to visit if for nothing else to say that you have seen it and photographed same.,Venetian Wall of Nicosia
50,Very important view for tourist to understand the history of Nicosia. A nice place to go for a walk with your other half.,Venetian Wall of Nicosia
40,"Very impressive walled divided city with lots of shops, eateries etc. Walked around within the Turkish territory. Great alleyways to meander around and a blue painted line for tourists to follow as this city is divided and one needs a passport to cross over to the southern side. Recommended but take your passport to see it properly",Venetian Wall of Nicosia
50,The Venetian wall constructed out of cut stone are amazing defensive structure around the old city of Nicosia. There are several gates of entery around the city. A moat is also used to protect the city. Part of the moat is still visible. The shape of the fortification is star shape. If you have time you can walk around and see this massive structure.,Venetian Wall of Nicosia
40,"These ancient walls constructed by the Venetian remain an impressive sight. We did not have enough time on our RSD Travel Cultural Tour to explore them fully, but had to dash back to our waiting coach.",Venetian Wall of Nicosia
50,"Really hard not to notice them, as they surround the city. Very nice preservation work; they look amazing and seem as protective as in old times.",Venetian Wall of Nicosia
50,"Almost perfectly , not only the island, not only the capital of Cyprus but the Venetian wall too, is divided into the Cypriot part and the turkish. The Cypriot refer to this partition as occupied territories.So you actually once visit the same wall in Cyprus and after you pass the border-yes-with passport control, you visit the rest of it in turkish territory.We reached Nicosia or Lefkosia as in Cyprus or Lefkosa as in turkish,by buss from Larnaka.It is an one hour + drive but very comfortable.It stops gust a few meters from the wall in Nicosia and very close to the famous Lidras street which takes you strait to the border with the turkish Nicosia.We walked along the Venetian wall towards the Famagusta gate. Inside the gate there was an art exhibition ,entrance free of charge.The walk takes less than an hour and passes by another three gates.This is the most visited gate and is worth this small walking effort.",Venetian Wall of Nicosia
